tcpdump -n -i eth0

h 384
08:09:57.149043 IP 198.211.111.194.41568 > 165.227.40.242.22: Flags [.], ack 859200, win 4386, options [nop,nop,TS val 842834918 ecr 3346750696], length 0
08:09:57.231893 IP 165.227.40.242.22 > 198.211.111.194.41568: Flags [P.], seq 859200:859424, ack 65, win 502, options [nop,nop,TS val 3346750800 ecr 842834918], length 224
08:09:57.232051 IP 165.227.40.242.22 > 198.211.111.194.41568: Flags [P.], seq 859424:859808, ack 65, win 502, options [nop,nop,TS val 3346750800 ecr 842834918], length 384
08:09:57.249569 IP 198.211.111.194.41568 > 165.227.40.242.22: Flags [.], ack 859808, win 4386, options [nop,nop,TS val 842835018 ecr 3346750800], length 0
08:09:57.335846 IP 165.227.40.242.22 > 198.211.111.194.41568: Flags [P.], seq 859808:860032, ack 65, win 502, options [nop,nop,TS val 3346750904 ecr 842835018], length 224
08:09:57.335961 IP 165.227.40.242.22 > 198.211.111.194.41568: Flags [P.], seq 860032:860416, ack 65, win 502, options [nop,nop,TS val 3346750904 ecr 842835018], length 384
08:09:57.354892 IP 198.211.111.194.41568 > 165.227.40.242.22: Flags [.], ack 860416, win 4386, options [nop,nop,TS val 842835124 ecr 3346750904], length 0
08:09:57.439862 IP 165.227.40.242.22 > 198.211.111.194.41568: Flags [P.], seq 860416:860640, ack 65, win 502, options [nop,nop,TS val 3346751008 ecr 842835124], length 224
08:09:57.439958 IP 165.227.40.242.22 > 198.211.111.194.41568: Flags [P.], seq 860640:860880, ack 65, win 502, options [nop,nop,TS val 3346751008 ecr 842835124], length 240
08:09:57.440015 IP 165.227.40.242.22 > 198.211.111.194.41568: Flags [P.], seq 860880:861088, ack 65, win 502, options [nop,nop,TS val 3346751008 ecr 842835124], length 208
08:09:57.461636 IP 198.211.111.194.41568 > 165.227.40.242.22: Flags [.], ack 861088, win 4386, options [nop,nop,TS val 842835231 ecr 3346751008], length 0
08:09:57.474146 IP 165.227.40.242.22 > 167.172.36.79.35018: Flags [P.], seq 2519:2587, ack 1369, win 501, options [nop,nop,TS val 355073999 ecr 2581247832], length 68
08:09:57.543907 IP 165.227.40.242.22 > 198.211.111.194.41568: Flags [P.], seq 861088:861312, ack 65, win 502, options [nop,nop,TS val 3346751112 ecr 842835231], length 224
08:09:57.544040 IP 165.227.40.242.22 > 198.211.111.194.41568: Flags [P.], seq 861312:861872, ack 65, win 502, options [nop,nop,TS val 3346751112 ecr 842835231], length 560
08:09:57.544619 IP 165.227.40.242.22 > 198.211.111.194.41568: Flags [P.], seq 861872:862096, ack 65, win 502, options [nop,nop,TS val 3346751113 ecr 842835231], length 224
08:09:57.572318 IP 198.211.111.194.41568 > 165.227.40.242.22: Flags [.], ack 862096, win 4386, options [nop,nop,TS val 842835341 ecr 3346751112], length 0
08:09:57.610826 IP 167.172.36.79.35018 > 165.227.40.242.22: Flags [.], ack 2587, win 501, options [nop,nop,TS val 2581250125 ecr 355073999], length 0
08:09:57.647847 IP 165.227.40.242.22 > 198.211.111.194.41568: Flags [P.], seq 862096:862320, ack 65, win 502, options [nop,nop,TS val 3346751216 ecr 842835341], length 224
08:09:57.647936 IP 165.227.40.242.22 > 198.211.111.194.41568: Flags [P.], seq 862320:862544, ack 65, win 502, options [nop,nop,TS val 3346751216 ecr 842835341], length 224
08:09:57.647965 IP 165.227.40.242.22 > 198.211.111.194.41568: Flags [P.], seq 862544:862768, ack 65, win 502, options [nop,nop,TS val 3346751216 ecr 842835341], length 224
08:09:57.648003 IP 165.227.40.242.22 > 198.211.111.194.41568: Flags [P.], seq 862768:862976, ack 65, win 502, options [nop,nop,TS val 3346751216 ecr 842835341], length 208
08:09:57.648042 IP 165.227.40.242.22 > 198.211.111.194.41568: Flags [P.], seq 862976:863184, ack 65, win 502, options [nop,nop,TS val 3346751216 ecr 842835341], length 208
08:09:57.648072 IP 165.227.40.242.22 > 198.211.111.194.41568: Flags [P.], seq 863184:863248, ack 65, win 502, options [nop,nop,TS val 3346751216 ecr 842835341], length 64
08:09:57.676231 IP 198.211.111.194.41568 > 165.227.40.242.22: Flags [.], ack 863248, win 4386, options [nop,nop,TS val 842835445 ecr 3346751216], length 0
08:09:57.751881 IP 165.227.40.242.22 > 198.211.111.194.41568: Flags [P.], seq 863248:863472, ack 65, win 502, options [nop,nop,TS val 3346751320 ecr 842835445], length 224
08:09:57.752028 IP 165.227.40.242.22 > 198.211.111.194.41568: Flags [P.], seq 863472:863696, ack 65, win 502, options [nop,nop,TS val 3346751320 ecr 842835445], length 224
08:09:57.752103 IP 165.227.40.242.22 > 198.211.111.194.41568: Flags [P.], seq 863696:863920, ack 65, win 502, options [nop,nop,TS val 3346751320 ecr 842835445], length 224
08:09:57.752239 IP 165.227.40.242.22 > 198.211.111.194.41568: Flags [P.], seq 863920:864144, ack 65, win 502, options [nop,nop,TS val 3346751320 ecr 842835445], length 224
08:09:57.752317 IP 165.227.40.242.22 > 198.211.111.194.41568: Flags [P.], seq 864144:864368, ack 65, win 502, options [nop,nop,TS val 3346751320 ecr 842835445], length 224
08:09:57.752387 IP 165.227.40.242.22 > 198.211.111.194.41568: Flags [P.], seq 864368:864592, ack 65, win 502, options [nop,nop,TS val 3346751320 ecr 842835445], length 224
08:09:57.752462 IP 165.227.40.242.22 > 198.211.111.194.41568: Flags [P.], seq 864592:864800, ack 65, win 502, options [nop,nop,TS val 3346751320 ecr 842835445], length 208
08:09:57.767840 IP 198.211.111.194.41568 > 165.227.40.242.22: Flags [.], ack 864800, win 4378, options [nop,nop,TS val 842835537 ecr 3346751320], length 0
08:09:57.774329 IP 167.172.36.79.35018 > 165.227.40.242.22: Flags [F.], seq 1369, ack 2587, win 501, options [nop,nop,TS val 2581250289 ecr 355073999], length 0
08:09:57.776582 IP 165.227.40.242.22 > 167.172.36.79.35018: Flags [F.], seq 2587, ack 1370, win 501, options [nop,nop,TS val 355074301 ecr 2581250289], length 0
08:09:57.855852 IP 165.227.40.242.22 > 198.211.111.194.41568: Flags [P.], seq 864800:865024, ack 65, win 502, options [nop,nop,TS val 3346751424 ecr 842835537], length 224
08:09:57.855957 IP 165.227.40.242.22 > 198.211.111.194.41568: Flags [P.], seq 865024:865424, ack 65, win 502, options [nop,nop,TS val 3346751424 ecr 842835537], length 400
08:09:57.856046 IP 165.227.40.242.22 > 198.211.111.194.41568: Flags [P.], seq 865424:866000, ack 65, win 502, options [nop,nop,TS val 3346751424 ecr 842835537], length 576
08:09:57.856113 IP 165.227.40.242.22 > 198.211.111.194.41568: Flags [P.], seq 866000:866384, ack 65, win 502, options [nop,nop,TS val 3346751424 ecr 842835537], length 384
08:09:57.856225 IP 165.227.40.242.22 > 198.211.111.194.41568: Flags [P.], seq 866384:866608, ack 65, win 502, options [nop,nop,TS val 3346751424 ecr 842835537], length 224
08:09:57.856259 IP 165.227.40.242.22 > 198.211.111.194.41568: Flags [P.], seq 866608:866672, ack 65, win 502, options [nop,nop,TS val 3346751424 ecr 842835537], length 64
08:09:57.856310 IP 165.227.40.242.22 > 198.211.111.194.41568: Flags [P.], seq 866672:866896, ack 65, win 502, options [nop,nop,TS val 3346751424 ecr 842835537], length 224
08:09:57.856364 IP 165.227.40.242.22 > 198.211.111.194.41568: Flags [P.], seq 866896:866960, ack 65, win 502, options [nop,nop,TS val 3346751424 ecr 842835537], length 64
08:09:57.868771 IP 167.172.36.79.35018 > 165.227.40.242.22: Flags [.], ack 2588, win 501, options [nop,nop,TS val 2581250383 ecr 355074301], length 0
08:09:57.871373 IP 198.211.111.194.41568 > 165.227.40.242.22: Flags [.], ack 866384, win 4378, options [nop,nop,TS val 842835640 ecr 3346751424], length 0
08:09:57.887463 IP 198.211.111.194.41568 > 165.227.40.242.22: Flags [.], ack 866960, win 4386, options [nop,nop,TS val 842835656 ecr 3346751424], length 0
08:09:57.959889 IP 165.227.40.242.22 > 198.211.111.194.41568: Flags [P.], seq 866960:867184, ack 65, win 502, options [nop,nop,TS val 3346751528 ecr 842835656], length 224
08:09:57.959998 IP 165.227.40.242.22 > 198.211.111.194.41568: Flags [P.], seq 867184:867584, ack 65, win 502, options [nop,nop,TS val 3346751528 ecr 842835656], length 400
08:09:57.960053 IP 165.227.40.242.22 > 198.211.111.194.41568: Flags [P.], seq 867584:867824, ack 65, win 502, options [nop,nop,TS val 3346751528 ecr 842835656], length 240
08:09:57.960118 IP 165.227.40.242.22 > 198.211.111.194.41568: Flags [P.], seq 867824:868224, ack 65, win 502, options [nop,nop,TS val 3346751528 ecr 842835656], length 400
08:09:57.960211 IP 165.227.40.242.22 > 198.211.111.194.41568: Flags [P.], seq 868224:868448, ack 65, win 502, options [nop,nop,TS val 3346751528 ecr 842835656], length 224
08:09:57.960242 IP 165.227.40.242.22 > 198.211.111.194.41568: Flags [P.], seq 868448:868512, ack 65, win 502, options [nop,nop,TS val 3346751528 ecr 842835656], length 64
08:09:57.960286 IP 165.227.40.242.22 > 198.211.111.194.41568: Flags [P.], seq 868512:868736, ack 65, win 502, options [nop,nop,TS val 3346751528 ecr 842835656], length 224
08:09:57.960400 IP 165.227.40.242.22 > 198.211.111.194.41568: Flags [P.], seq 868736:869264, ack 65, win 502, options [nop,nop,TS val 3346751528 ecr 842835656], length 528
08:09:57.975533 IP 198.211.111.194.41568 > 165.227.40.242.22: Flags [.], ack 868448, win 4378, options [nop,nop,TS val 842835744 ecr 3346751528], length 0
08:09:57.985776 IP 198.211.111.194.41568 > 165.227.40.242.22: Flags [.], ack 869264, win 4386, options [nop,nop,TS val 842835755 ecr 3346751528], length 0
08:09:58.063864 IP 165.227.40.242.22 > 198.211.111.194.41568: Flags [P.], seq 869264:869488, ack 65, win 502, options [nop,nop,TS val 3346751632 ecr 842835755], length 224
08:09:58.063951 IP 165.227.40.242.22 > 198.211.111.194.41568: Flags [P.], seq 869488:869712, ack 65, win 502, options [nop,nop,TS val 3346751632 ecr 842835755], length 224
08:09:58.064034 IP 165.227.40.242.22 > 198.211.111.194.41568: Flags [P.], seq 869712:870112, ack 65, win 502, options [nop,nop,TS val 3346751632 ecr 842835755], length 400
08:09:58.064126 IP 165.227.40.242.22 > 198.211.111.194.41568: Flags [P.], seq 870112:870688, ack 65, win 502, options [nop,nop,TS val 3346751632 ecr 842835755], length 576
08:09:58.064240 IP 165.227.40.242.22 > 198.211.111.194.41568: Flags [P.], seq 870688:870752, ack 65, win 502, options [nop,nop,TS val 3346751632 ecr 842835755], length 64
08:09:58.064289 IP 165.227.40.242.22 > 198.211.111.194.41568: Flags [P.], seq 870752:870976, ack 65, win 502, options [nop,nop,TS val 3346751632 ecr 842835755], length 224
08:09:58.064318 IP 165.227.40.242.22 > 198.211.111.194.41568: Flags [P.], seq 870976:871040, ack 65, win 502, options [nop,nop,TS val 3346751632 ecr 842835755], length 64
08:09:58.064360 IP 165.227.40.242.22 > 198.211.111.194.41568: Flags [P.], seq 871040:871248, ack 65, win 502, options [nop,nop,TS val 3346751632 ecr 842835755], length 208
08:09:58.064389 IP 165.227.40.242.22 > 198.211.111.194.41568: Flags [P.], seq 871248:871312, ack 65, win 502, options [nop,nop,TS val 3346751632 ecr 842835755], length 64
08:09:58.064429 IP 165.227.40.242.22 > 198.211.111.194.41568: Flags [P.], seq 871312:871520, ack 65, win 502, options [nop,nop,TS val 3346751632 ecr 842835755], length 208
08:09:58.064535 IP 165.227.40.242.22 > 198.211.111.194.41568: Flags [P.], seq 871520:871584, ack 65, win 502, options [nop,nop,TS val 3346751632 ecr 842835755], length 64
08:09:58.079533 IP 198.211.111.194.41568 > 165.227.40.242.22: Flags [.], ack 870752, win 4378, options [nop,nop,TS val 842835848 ecr 3346751632], length 0
08:09:58.103241 IP 198.211.111.194.41568 > 165.227.40.242.22: Flags [.], ack 871584, win 4386, options [nop,nop,TS val 842835872 ecr 3346751632], length 0
08:09:58.167854 IP 165.227.40.242.22 > 198.211.111.194.41568: Flags [P.], seq 871584:871808, ack 65, win 502, options [nop,nop,TS val 3346751736 ecr 842835872], length 224
08:09:58.167958 IP 165.227.40.242.22 > 198.211.111.194.41568: Flags [P.], seq 871808:872208, ack 65, win 502, options [nop,nop,TS val 3346751736 ecr 842835872], length 400
08:09:58.168026 IP 165.227.40.242.22 > 198.211.111.194.41568: Flags [P.], seq 872208:872608, ack 65, win 502, options [nop,nop,TS val 3346751736 ecr 842835872], length 400
08:09:58.168093 IP 165.227.40.242.22 > 198.211.111.194.41568: Flags [P.], seq 872608:873008, ack 65, win 502, options [nop,nop,TS val 3346751736 ecr 842835872], length 400
08:09:58.168211 IP 165.227.40.242.22 > 198.211.111.194.41568: Flags [P.], seq 873008:873408, ack 65, win 502, options [nop,nop,TS val 3346751736 ecr 842835872], length 400
08:09:58.168266 IP 165.227.40.242.22 > 198.211.111.194.41568: Flags [P.], seq 873408:873472, ack 65, win 502, options [nop,nop,TS val 3346751736 ecr 842835872], length 64
08:09:58.168295 IP 165.227.40.242.22 > 198.211.111.194.41568: Flags [P.], seq 873472:873696, ack 65, win 502, options [nop,nop,TS val 3346751736 ecr 842835872], length 224
08:09:58.168341 IP 165.227.40.242.22 > 198.211.111.194.41568: Flags [P.], seq 873696:873920, ack 65, win 502, options [nop,nop,TS val 3346751736 ecr 842835872], length 224
08:09:58.168392 IP 165.227.40.242.22 > 198.211.111.194.41568: Flags [P.], seq 873920:874128, ack 65, win 502, options [nop,nop,TS val 3346751736 ecr 842835872], length 208
08:09:58.168445 IP 165.227.40.242.22 > 198.211.111.194.41568: Flags [P.], seq 874128:874336, ack 65, win 502, options [nop,nop,TS val 3346751736 ecr 842835872], length 208
08:09:58.183538 IP 198.211.111.194.41568 > 165.227.40.242.22: Flags [.], ack 873408, win 4378, options [nop,nop,TS val 842835952 ecr 3346751736], length 0
08:09:58.208254 IP 198.211.111.194.41568 > 165.227.40.242.22: Flags [.], ack 874336, win 4386, options [nop,nop,TS val 842835977 ecr 3346751736], length 0
^C
4233 packets captured
4242 packets received by filter
0 packets dropped by kernel