# tcpdump -i eth0
07:58:13.951881 IP 198.211.111.194.41568 > prabesha2026.ssh: Flags [.], ack 1821905, win 501, options [nop,nop,TS val 842131721 ecr 3346047505], length 0
07:58:13.952203 IP 198.211.111.194.41568 > prabesha2026.ssh: Flags [.], ack 1822705, win 501, options [nop,nop,TS val 842131722 ecr 3346047505], length 0
07:58:14.039960 IP prabesha2026.ssh > 198.211.111.194.41568: Flags [P.], seq 1822705:1822929, ack 64, win 502, options [nop,nop,TS val 3346047608 ecr 842131722], length 224
07:58:14.040088 IP prabesha2026.ssh > 198.211.111.194.41568: Flags [P.], seq 1822929:1823153, ack 64, win 502, options [nop,nop,TS val 3346047608 ecr 842131722], length 224
07:58:14.040178 IP prabesha2026.ssh > 198.211.111.194.41568: Flags [P.], seq 1823153:1823377, ack 64, win 502, options [nop,nop,TS val 3346047608 ecr 842131722], length 224
07:58:14.040252 IP prabesha2026.ssh > 198.211.111.194.41568: Flags [P.], seq 1823377:1823601, ack 64, win 502, options [nop,nop,TS val 3346047608 ecr 842131722], length 224
07:58:14.040343 IP prabesha2026.ssh > 198.211.111.194.41568: Flags [P.], seq 1823601:1824001, ack 64, win 502, options [nop,nop,TS val 3346047608 ecr 842131722], length 400
07:58:14.040425 IP prabesha2026.ssh > 198.211.111.194.41568: Flags [P.], seq 1824001:1824401, ack 64, win 502, options [nop,nop,TS val 3346047608 ecr 842131722], length 400
07:58:14.040510 IP prabesha2026.ssh > 198.211.111.194.41568: Flags [P.], seq 1824401:1824801, ack 64, win 502, options [nop,nop,TS val 3346047608 ecr 842131722], length 400
07:58:14.040607 IP prabesha2026.ssh > 198.211.111.194.41568: Flags [P.], seq 1824801:1825201, ack 64, win 502, options [nop,nop,TS val 3346047609 ecr 842131722], length 400
07:58:14.040707 IP prabesha2026.ssh > 198.211.111.194.41568: Flags [P.], seq 1825201:1825777, ack 64, win 502, options [nop,nop,TS val 3346047609 ecr 842131722], length 576
07:58:14.040791 IP prabesha2026.ssh > 198.211.111.194.41568: Flags [P.], seq 1825777:1826177, ack 64, win 502, options [nop,nop,TS val 3346047609 ecr 842131722], length 400
07:58:14.040872 IP prabesha2026.ssh > 198.211.111.194.41568: Flags [P.], seq 1826177:1826577, ack 64, win 502, options [nop,nop,TS val 3346047609 ecr 842131722], length 400
07:58:14.040950 IP prabesha2026.ssh > 198.211.111.194.41568: Flags [P.], seq 1826577:1826945, ack 64, win 502, options [nop,nop,TS val 3346047609 ecr 842131722], length 368
07:58:14.041029 IP prabesha2026.ssh > 198.211.111.194.41568: Flags [P.], seq 1826945:1827313, ack 64, win 502, options [nop,nop,TS val 3346047609 ecr 842131722], length 368
07:58:14.041105 IP prabesha2026.ssh > 198.211.111.194.41568: Flags [P.], seq 1827313:1827681, ack 64, win 502, options [nop,nop,TS val 3346047609 ecr 842131722], length 368
07:58:14.041150 IP prabesha2026.ssh > 198.211.111.194.41568: Flags [P.], seq 1827681:1827745, ack 64, win 502, options [nop,nop,TS val 3346047609 ecr 842131722], length 64
07:58:14.055843 IP 198.211.111.194.41568 > prabesha2026.ssh: Flags [.], ack 1823601, win 501, options [nop,nop,TS val 842131825 ecr 3346047608], length 0
07:58:14.055844 IP 198.211.111.194.41568 > prabesha2026.ssh: Flags [.], ack 1824401, win 501, options [nop,nop,TS val 842131825 ecr 3346047608], length 0
07:58:14.055903 IP 198.211.111.194.41568 > prabesha2026.ssh: Flags [.], ack 1825201, win 501, options [nop,nop,TS val 842131825 ecr 3346047608], length 0
07:58:14.056080 IP 198.211.111.194.41568 > prabesha2026.ssh: Flags [.], ack 1826177, win 501, options [nop,nop,TS val 842131825 ecr 3346047609], length 0
07:58:14.056184 IP 198.211.111.194.41568 > prabesha2026.ssh: Flags [.], ack 1826945, win 501, options [nop,nop,TS val 842131826 ecr 3346047609], length 0
07:58:14.056410 IP 198.211.111.194.41568 > prabesha2026.ssh: Flags [.], ack 1827745, win 501, options [nop,nop,TS val 842131826 ecr 3346047609], length 0
07:58:14.143928 IP prabesha2026.ssh > 198.211.111.194.41568: Flags [P.], seq 1827745:1827969, ack 64, win 502, options [nop,nop,TS val 3346047712 ecr 842131826], length 224
07:58:14.144015 IP prabesha2026.ssh > 198.211.111.194.41568: Flags [P.], seq 1827969:1828033, ack 64, win 502, options [nop,nop,TS val 3346047712 ecr 842131826], length 64
07:58:14.144031 IP prabesha2026.ssh > 198.211.111.194.41568: Flags [P.], seq 1828033:1828257, ack 64, win 502, options [nop,nop,TS val 3346047712 ecr 842131826], length 224
07:58:14.144101 IP prabesha2026.ssh > 198.211.111.194.41568: Flags [P.], seq 1828257:1828481, ack 64, win 502, options [nop,nop,TS val 3346047712 ecr 842131826], length 224
07:58:14.144191 IP prabesha2026.ssh > 198.211.111.194.41568: Flags [P.], seq 1828481:1828881, ack 64, win 502, options [nop,nop,TS val 3346047712 ecr 842131826], length 400
07:58:14.144260 IP prabesha2026.ssh > 198.211.111.194.41568: Flags [P.], seq 1828881:1829281, ack 64, win 502, options [nop,nop,TS val 3346047712 ecr 842131826], length 400
07:58:14.144310 IP prabesha2026.ssh > 198.211.111.194.41568: Flags [P.], seq 1829281:1829521, ack 64, win 502, options [nop,nop,TS val 3346047712 ecr 842131826], length 240
07:58:14.144377 IP prabesha2026.ssh > 198.211.111.194.41568: Flags [P.], seq 1829521:1829921, ack 64, win 502, options [nop,nop,TS val 3346047712 ecr 842131826], length 400
07:58:14.144434 IP prabesha2026.ssh > 198.211.111.194.41568: Flags [P.], seq 1829921:1830161, ack 64, win 502, options [nop,nop,TS val 3346047712 ecr 842131826], length 240
07:58:14.144497 IP prabesha2026.ssh > 198.211.111.194.41568: Flags [P.], seq 1830161:1830561, ack 64, win 502, options [nop,nop,TS val 3346047712 ecr 842131826], length 400
07:58:14.144572 IP prabesha2026.ssh > 198.211.111.194.41568: Flags [P.], seq 1830561:1830961, ack 64, win 502, options [nop,nop,TS val 3346047713 ecr 842131826], length 400
07:58:14.144644 IP prabesha2026.ssh > 198.211.111.194.41568: Flags [P.], seq 1830961:1831169, ack 64, win 502, options [nop,nop,TS val 3346047713 ecr 842131826], length 208
07:58:14.144710 IP prabesha2026.ssh > 198.211.111.194.41568: Flags [P.], seq 1831169:1831537, ack 64, win 502, options [nop,nop,TS val 3346047713 ecr 842131826], length 368
07:58:14.144758 IP prabesha2026.ssh > 198.211.111.194.41568: Flags [P.], seq 1831537:1831745, ack 64, win 502, options [nop,nop,TS val 3346047713 ecr 842131826], length 208
07:58:14.144816 IP prabesha2026.ssh > 198.211.111.194.41568: Flags [P.], seq 1831745:1831953, ack 64, win 502, options [nop,nop,TS val 3346047713 ecr 842131826], length 208
07:58:14.144882 IP prabesha2026.ssh > 198.211.111.194.41568: Flags [P.], seq 1831953:1832161, ack 64, win 502, options [nop,nop,TS val 3346047713 ecr 842131826], length 208
07:58:14.150326 IP rivdaho.co.uk.42104 > prabesha2026.3330: Flags [S], seq 2359999397, win 1024, length 0
07:58:14.150386 IP prabesha2026.3330 > rivdaho.co.uk.42104: Flags [R.], seq 0, ack 2359999398, win 0, length 0
07:58:14.159454 IP 198.211.111.194.41568 > prabesha2026.ssh: Flags [.], ack 1828881, win 501, options [nop,nop,TS val 842131929 ecr 3346047712], length 0
07:58:14.159583 IP 198.211.111.194.41568 > prabesha2026.ssh: Flags [.], ack 1829921, win 501, options [nop,nop,TS val 842131929 ecr 3346047712], length 0
07:58:14.159767 IP 198.211.111.194.41568 > prabesha2026.ssh: Flags [.], ack 1830961, win 501, options [nop,nop,TS val 842131929 ecr 3346047712], length 0
07:58:14.159940 IP 198.211.111.194.41568 > prabesha2026.ssh: Flags [.], ack 1831745, win 501, options [nop,nop,TS val 842131929 ecr 3346047713], length 0
07:58:14.181295 IP 198.211.111.194.41568 > prabesha2026.ssh: Flags [.], ack 1832161, win 501, options [nop,nop,TS val 842131951 ecr 3346047713], length 0
07:58:14.247991 IP prabesha2026.ssh > 198.211.111.194.41568: Flags [P.], seq 1832161:1832385, ack 64, win 502, options [nop,nop,TS val 3346047816 ecr 842131951], length 224
07:58:14.248055 IP prabesha2026.ssh > 198.211.111.194.41568: Flags [P.], seq 1832385:1832449, ack 64, win 502, options [nop,nop,TS val 3346047816 ecr 842131951], length 64
07:58:14.248118 IP prabesha2026.ssh > 198.211.111.194.41568: Flags [P.], seq 1832449:1832673, ack 64, win 502, options [nop,nop,TS val 3346047816 ecr 842131951], length 224
07:58:14.248171 IP prabesha2026.ssh > 198.211.111.194.41568: Flags [P.], seq 1832673:1832737, ack 64, win 502, options [nop,nop,TS val 3346047816 ecr 842131951], length 64
07:58:14.248231 IP prabesha2026.ssh > 198.211.111.194.41568: Flags [P.], seq 1832737:1832961, ack 64, win 502, options [nop,nop,TS val 3346047816 ecr 842131951], length 224
07:58:14.248261 IP prabesha2026.ssh > 198.211.111.194.41568: Flags [P.], seq 1832961:1833025, ack 64, win 502, options [nop,nop,TS val 3346047816 ecr 842131951], length 64
07:58:14.248306 IP prabesha2026.ssh > 198.211.111.194.41568: Flags [P.], seq 1833025:1833249, ack 64, win 502, options [nop,nop,TS val 3346047816 ecr 842131951], length 224
07:58:14.248334 IP prabesha2026.ssh > 198.211.111.194.41568: Flags [P.], seq 1833249:1833313, ack 64, win 502, options [nop,nop,TS val 3346047816 ecr 842131951], length 64
07:58:14.248379 IP prabesha2026.ssh > 198.211.111.194.41568: Flags [P.], seq 1833313:1833537, ack 64, win 502, options [nop,nop,TS val 3346047816 ecr 842131951], length 224
07:58:14.248407 IP prabesha2026.ssh > 198.211.111.194.41568: Flags [P.], seq 1833537:1833601, ack 64, win 502, options [nop,nop,TS val 3346047816 ecr 842131951], length 64
07:58:14.248450 IP prabesha2026.ssh > 198.211.111.194.41568: Flags [P.], seq 1833601:1833825, ack 64, win 502, options [nop,nop,TS val 3346047816 ecr 842131951], length 224
07:58:14.248516 IP prabesha2026.ssh > 198.211.111.194.41568: Flags [P.], seq 1833825:1834225, ack 64, win 502, options [nop,nop,TS val 3346047816 ecr 842131951], length 400
07:58:14.248575 IP prabesha2026.ssh > 198.211.111.194.41568: Flags [P.], seq 1834225:1834449, ack 64, win 502, options [nop,nop,TS val 3346047817 ecr 842131951], length 224
07:58:14.248642 IP prabesha2026.ssh > 198.211.111.194.41568: Flags [P.], seq 1834449:1834849, ack 64, win 502, options [nop,nop,TS val 3346047817 ecr 842131951], length 400
07:58:14.248702 IP prabesha2026.ssh > 198.211.111.194.41568: Flags [P.], seq 1834849:1835249, ack 64, win 502, options [nop,nop,TS val 3346047817 ecr 842131951], length 400
07:58:14.248747 IP prabesha2026.ssh > 198.211.111.194.41568: Flags [P.], seq 1835249:1835473, ack 64, win 502, options [nop,nop,TS val 3346047817 ecr 842131951], length 224
07:58:14.248810 IP prabesha2026.ssh > 198.211.111.194.41568: Flags [P.], seq 1835473:1835873, ack 64, win 502, options [nop,nop,TS val 3346047817 ecr 842131951], length 400
07:58:14.249292 IP prabesha2026.34282 > 67.207.67.2.domain: 18857+ [1au] PTR? 86.114.128.78.in-addr.arpa. (55)
07:58:14.249388 IP prabesha2026.36068 > 67.207.67.2.domain: 63399+ [1au] PTR? 86.114.128.78.in-addr.arpa. (55)
07:58:14.249423 IP prabesha2026.49130 > 67.207.67.3.domain: Flags [P.], seq 45:91, ack 85, win 502, options [nop,nop,TS val 2661083124 ecr 2065103079], length 46 10193+ PTR? 86.114.128.78.in-addr.arpa. (44)
07:58:14.249491 IP prabesha2026.ssh > 198.211.111.194.41568: Flags [P.], seq 1835873:1835937, ack 64, win 502, options [nop,nop,TS val 3346047817 ecr 842131951], length 64
07:58:14.250663 IP 67.207.67.2.domain > prabesha2026.36068: 63399 1/0/1 PTR rivdaho.co.uk. (82)
07:58:14.251013 IP prabesha2026.ssh > 198.211.111.194.41568: Flags [P.], seq 1835937:1836097, ack 64, win 502, options [nop,nop,TS val 3346047819 ecr 842131951], length 160
07:58:14.251055 IP prabesha2026.ssh > 198.211.111.194.41568: Flags [P.], seq 1836097:1836161, ack 64, win 502, options [nop,nop,TS val 3346047819 ecr 842131951], length 64
07:58:14.251126 IP prabesha2026.ssh > 198.211.111.194.41568: Flags [P.], seq 1836161:1836321, ack 64, win 502, options [nop,nop,TS val 3346047819 ecr 842131951], length 160
07:58:14.251156 IP prabesha2026.ssh > 198.211.111.194.41568: Flags [P.], seq 1836321:1836385, ack 64, win 502, options [nop,nop,TS val 3346047819 ecr 842131951], length 64
07:58:14.251201 IP prabesha2026.ssh > 198.211.111.194.41568: Flags [P.], seq 1836385:1836593, ack 64, win 502, options [nop,nop,TS val 3346047819 ecr 842131951], length 208
07:58:14.251230 IP prabesha2026.ssh > 198.211.111.194.41568: Flags [P.], seq 1836593:1836657, ack 64, win 502, options [nop,nop,TS val 3346047819 ecr 842131951], length 64
07:58:14.251272 IP prabesha2026.ssh > 198.211.111.194.41568: Flags [P.], seq 1836657:1836865, ack 64, win 502, options [nop,nop,TS val 3346047819 ecr 842131951], length 208
07:58:14.251300 IP prabesha2026.ssh > 198.211.111.194.41568: Flags [P.], seq 1836865:1836929, ack 64, win 502, options [nop,nop,TS val 3346047819 ecr 842131951], length 64
07:58:14.251342 IP prabesha2026.ssh > 198.211.111.194.41568: Flags [P.], seq 1836929:1837137, ack 64, win 502, options [nop,nop,TS val 3346047819 ecr 842131951], length 208
07:58:14.251407 IP prabesha2026.ssh > 198.211.111.194.41568: Flags [P.], seq 1837137:1837505, ack 64, win 502, options [nop,nop,TS val 3346047819 ecr 842131951], length 368
07:58:14.251462 IP prabesha2026.ssh > 198.211.111.194.41568: Flags [P.], seq 1837505:1837569, ack 64, win 502, options [nop,nop,TS val 3346047819 ecr 842131951], length 64
07:58:14.252069 IP 67.207.67.2.domain > prabesha2026.34282: 18857 1/0/1 PTR rivdaho.co.uk. (82)
07:58:14.263522 IP 198.211.111.194.41568 > prabesha2026.ssh: Flags [.], ack 1832961, win 501, options [nop,nop,TS val 842132033 ecr 3346047816], length 0
07:58:14.263730 IP 198.211.111.194.41568 > prabesha2026.ssh: Flags [.], ack 1833825, win 501, options [nop,nop,TS val 842132033 ecr 3346047816], length 0
07:58:14.263850 IP 198.211.111.194.41568 > prabesha2026.ssh: Flags [.], ack 1834849, win 501, options [nop,nop,TS val 842132033 ecr 3346047816], length 0
07:58:14.264049 IP 198.211.111.194.41568 > prabesha2026.ssh: Flags [.], ack 1835873, win 501, options [nop,nop,TS val 842132033 ecr 3346047817], length 0
07:58:14.266485 IP 198.211.111.194.41568 > prabesha2026.ssh: Flags [.], ack 1836657, win 501, options [nop,nop,TS val 842132036 ecr 3346047817], length 0
07:58:14.266590 IP 198.211.111.194.41568 > prabesha2026.ssh: Flags [.], ack 1837505, win 501, options [nop,nop,TS val 842132036 ecr 3346047819], length 0
07:58:14.280621 IP rivdaho.co.uk.42104 > prabesha2026.3330: Flags [R], seq 2359999398, win 1200, length 0
07:58:14.280621 IP 198.211.111.194.41568 > prabesha2026.ssh: Flags [.], ack 1837569, win 501, options [nop,nop,TS val 842132050 ecr 3346047819], length 0
07:58:14.295411 IP 67.207.67.3.domain > prabesha2026.49130: Flags [.], ack 91, win 509, options [nop,nop,TS val 2065104349 ecr 2661083124], length 0
07:58:14.351939 IP prabesha2026.ssh > 198.211.111.194.41568: Flags [P.], seq 1837569:1837793, ack 64, win 502, options [nop,nop,TS val 3346047920 ecr 842132050], length 224
07:58:14.352004 IP prabesha2026.ssh > 198.211.111.194.41568: Flags [P.], seq 1837793:1837857, ack 64, win 502, options [nop,nop,TS val 3346047920 ecr 842132050], length 64
07:58:14.352054 IP prabesha2026.ssh > 198.211.111.194.41568: Flags [P.], seq 1837857:1838081, ack 64, win 502, options [nop,nop,TS val 3346047920 ecr 842132050], length 224
07:58:14.352085 IP prabesha2026.ssh > 198.211.111.194.41568: Flags [P.], seq 1838081:1838145, ack 64, win 502, options [nop,nop,TS val 3346047920 ecr 842132050], length 64
07:58:14.352130 IP prabesha2026.ssh > 198.211.111.194.41568: Flags [P.], seq 1838145:1838369, ack 64, win 502, options [nop,nop,TS val 3346047920 ecr 842132050], length 224
07:58:14.352163 IP prabesha2026.ssh > 198.211.111.194.41568: Flags [P.], seq 1838369:1838433, ack 64, win 502, options [nop,nop,TS val 3346047920 ecr 842132050], length 64
07:58:14.352208 IP prabesha2026.ssh > 198.211.111.194.41568: Flags [P.], seq 1838433:1838657, ack 64, win 502, options [nop,nop,TS val 3346047920 ecr 842132050], length 224
07:58:14.352257 IP prabesha2026.ssh > 198.211.111.194.41568: Flags [P.], seq 1838657:1838881, ack 64, win 502, options [nop,nop,TS val 3346047920 ecr 842132050], length 224
07:58:14.352323 IP prabesha2026.ssh > 198.211.111.194.41568: Flags [P.], seq 1838881:1839281, ack 64, win 502, options [nop,nop,TS val 3346047920 ecr 842132050], length 400
07:58:14.352374 IP prabesha2026.ssh > 198.211.111.194.41568: Flags [P.], seq 1839281:1839521, ack 64, win 502, options [nop,nop,TS val 3346047920 ecr 842132050], length 240
07:58:14.352437 IP prabesha2026.ssh > 198.211.111.194.41568: Flags [P.], seq 1839521:1839921, ack 64, win 502, options [nop,nop,TS val 3346047920 ecr 842132050], length 400
07:58:14.352487 IP prabesha2026.ssh > 198.211.111.194.41568: Flags [P.], seq 1839921:1840161, ack 64, win 502, options [nop,nop,TS val 3346047920 ecr 842132050], length 240
07:58:14.352550 IP prabesha2026.ssh > 198.211.111.194.41568: Flags [P.], seq 1840161:1840561, ack 64, win 502, options [nop,nop,TS val 3346047920 ecr 842132050], length 400
07:58:14.352597 IP prabesha2026.ssh > 198.211.111.194.41568: Flags [P.], seq 1840561:1840785, ack 64, win 502, options [nop,nop,TS val 3346047921 ecr 842132050], length 224
07:58:14.352662 IP prabesha2026.ssh > 198.211.111.194.41568: Flags [P.], seq 1840785:1841185, ack 64, win 502, options [nop,nop,TS val 3346047921 ecr 842132050], length 400
07:58:14.352710 IP prabesha2026.ssh > 198.211.111.194.41568: Flags [P.], seq 1841185:1841409, ack 64, win 502, options [nop,nop,TS val 3346047921 ecr 842132050], length 224
07:58:14.352768 IP prabesha2026.ssh > 198.211.111.194.41568: Flags [P.], seq 1841409:1841585, ack 64, win 502, options [nop,nop,TS val 3346047921 ecr 842132050], length 176
07:58:14.352830 IP prabesha2026.ssh > 198.211.111.194.41568: Flags [P.], seq 1841585:1841761, ack 64, win 502, options [nop,nop,TS val 3346047921 ecr 842132050], length 176
07:58:14.352900 IP prabesha2026.ssh > 198.211.111.194.41568: Flags [P.], seq 1841761:1842033, ack 64, win 502, options [nop,nop,TS val 3346047921 ecr 842132050], length 272
07:58:14.352974 IP prabesha2026.ssh > 198.211.111.194.41568: Flags [P.], seq 1842033:1842353, ack 64, win 502, options [nop,nop,TS val 3346047921 ecr 842132050], length 320
07:58:14.353032 IP prabesha2026.ssh > 198.211.111.194.41568: Flags [P.], seq 1842353:1842577, ack 64, win 502, options [nop,nop,TS val 3346047921 ecr 842132050], length 224
07:58:14.353104 IP prabesha2026.ssh > 198.211.111.194.41568: Flags [P.], seq 1842577:1842977, ack 64, win 502, options [nop,nop,TS val 3346047921 ecr 842132050], length 400
07:58:14.353158 IP prabesha2026.ssh > 198.211.111.194.41568: Flags [P.], seq 1842977:1843377, ack 64, win 502, options [nop,nop,TS val 3346047921 ecr 842132050], length 400
07:58:14.353211 IP prabesha2026.ssh > 198.211.111.194.41568: Flags [P.], seq 1843377:1843777, ack 64, win 502, options [nop,nop,TS val 3346047921 ecr 842132050], length 400
07:58:14.353251 IP prabesha2026.ssh > 198.211.111.194.41568: Flags [P.], seq 1843777:1844001, ack 64, win 502, options [nop,nop,TS val 3346047921 ecr 842132050], length 224
07:58:14.353304 IP prabesha2026.ssh > 198.211.111.194.41568: Flags [P.], seq 1844001:1844401, ack 64, win 502, options [nop,nop,TS val 3346047921 ecr 842132050], length 400
07:58:14.353357 IP prabesha2026.ssh > 198.211.111.194.41568: Flags [P.], seq 1844401:1844721, ack 64, win 502, options [nop,nop,TS val 3346047921 ecr 842132050], length 320
07:58:14.353398 IP prabesha2026.ssh > 198.211.111.194.41568: Flags [P.], seq 1844721:1844929, ack 64, win 502, options [nop,nop,TS val 3346047921 ecr 842132050], length 208
07:58:14.353449 IP prabesha2026.ssh > 198.211.111.194.41568: Flags [P.], seq 1844929:1845297, ack 64, win 502, options [nop,nop,TS val 3346047921 ecr 842132050], length 368
07:58:14.353493 IP prabesha2026.ssh > 198.211.111.194.41568: Flags [P.], seq 1845297:1845505, ack 64, win 502, options [nop,nop,TS val 3346047921 ecr 842132050], length 208
07:58:14.353556 IP prabesha2026.ssh > 198.211.111.194.41568: Flags [P.], seq 1845505:1845985, ack 64, win 502, options [nop,nop,TS val 3346047921 ecr 842132050], length 480
07:58:14.353651 IP prabesha2026.ssh > 198.211.111.194.41568: Flags [P.], seq 1845985:1846353, ack 64, win 502, options [nop,nop,TS val 3346047922 ecr 842132050], length 368
07:58:14.353687 IP prabesha2026.ssh > 198.211.111.194.41568: Flags [P.], seq 1846353:1846417, ack 64, win 502, options [nop,nop,TS val 3346047922 ecr 842132050], length 64
07:58:14.367447 IP 198.211.111.194.41568 > prabesha2026.ssh: Flags [.], ack 1838369, win 501, options [nop,nop,TS val 842132137 ecr 3346047920], length 0
07:58:14.367510 IP 198.211.111.194.41568 > prabesha2026.ssh: Flags [.], ack 1839281, win 501, options [nop,nop,TS val 842132137 ecr 3346047920], length 0
07:58:14.367716 IP 198.211.111.194.41568 > prabesha2026.ssh: Flags [.], ack 1840161, win 501, options [nop,nop,TS val 842132137 ecr 3346047920], length 0
07:58:14.367864 IP 198.211.111.194.41568 > prabesha2026.ssh: Flags [.], ack 1841185, win 501, options [nop,nop,TS val 842132137 ecr 3346047920], length 0
07:58:14.368175 IP 198.211.111.194.41568 > prabesha2026.ssh: Flags [.], ack 1842033, win 501, options [nop,nop,TS val 842132138 ecr 3346047921], length 0
07:58:14.368304 IP 198.211.111.194.41568 > prabesha2026.ssh: Flags [.], ack 1842977, win 501, options [nop,nop,TS val 842132138 ecr 3346047921], length 0
07:58:14.368412 IP 198.211.111.194.41568 > prabesha2026.ssh: Flags [.], ack 1843777, win 501, options [nop,nop,TS val 842132138 ecr 3346047921], length 0
07:58:14.368614 IP 198.211.111.194.41568 > prabesha2026.ssh: Flags [.], ack 1844721, win 501, options [nop,nop,TS val 842132138 ecr 3346047921], length 0
07:58:14.368719 IP 198.211.111.194.41568 > prabesha2026.ssh: Flags [.], ack 1845505, win 501, options [nop,nop,TS val 842132138 ecr 3346047921], length 0
07:58:14.368871 IP 198.211.111.194.41568 > prabesha2026.ssh: Flags [.], ack 1846353, win 501, options [nop,nop,TS val 842132138 ecr 3346047921], length 0
07:58:14.388825 IP 67.207.67.3.domain > prabesha2026.49130: Flags [P.], seq 85:158, ack 91, win 509, options [nop,nop,TS val 2065104442 ecr 2661083124], length 73 10193 1/0/0 PTR rivdaho.co.uk. (71)
07:58:14.388882 IP prabesha2026.49130 > 67.207.67.3.domain: Flags [.], ack 158, win 502, options [nop,nop,TS val 2661083264 ecr 2065104442], length 0
07:58:14.400345 IP 198.211.111.194.41568 > prabesha2026.ssh: Flags [.], ack 1846417, win 501, options [nop,nop,TS val 842132170 ecr 3346047922], length 0
07:58:14.455951 IP prabesha2026.ssh > 198.211.111.194.41568: Flags [P.], seq 1846417:1846641, ack 64, win 502, options [nop,nop,TS val 3346048024 ecr 842132170], length 224
07:58:14.456029 IP prabesha2026.ssh > 198.211.111.194.41568: Flags [P.], seq 1846641:1846705, ack 64, win 502, options [nop,nop,TS val 3346048024 ecr 842132170], length 64
07:58:14.456070 IP prabesha2026.ssh > 198.211.111.194.41568: Flags [P.], seq 1846705:1846929, ack 64, win 502, options [nop,nop,TS val 3346048024 ecr 842132170], length 224
07:58:14.456099 IP prabesha2026.ssh > 198.211.111.194.41568: Flags [P.], seq 1846929:1846993, ack 64, win 502, options [nop,nop,TS val 3346048024 ecr 842132170], length 64
07:58:14.456143 IP prabesha2026.ssh > 198.211.111.194.41568: Flags [P.], seq 1846993:1847217, ack 64, win 502, options [nop,nop,TS val 3346048024 ecr 842132170], length 224
07:58:14.456182 IP prabesha2026.ssh > 198.211.111.194.41568: Flags [P.], seq 1847217:1847281, ack 64, win 502, options [nop,nop,TS val 3346048024 ecr 842132170], length 64
07:58:14.456220 IP prabesha2026.ssh > 198.211.111.194.41568: Flags [P.], seq 1847281:1847505, ack 64, win 502, options [nop,nop,TS val 3346048024 ecr 842132170], length 224
07:58:14.456248 IP prabesha2026.ssh > 198.211.111.194.41568: Flags [P.], seq 1847505:1847569, ack 64, win 502, options [nop,nop,TS val 3346048024 ecr 842132170], length 64
07:58:14.456292 IP prabesha2026.ssh > 198.211.111.194.41568: Flags [P.], seq 1847569:1847793, ack 64, win 502, options [nop,nop,TS val 3346048024 ecr 842132170], length 224
07:58:14.456327 IP prabesha2026.ssh > 198.211.111.194.41568: Flags [P.], seq 1847793:1847857, ack 64, win 502, options [nop,nop,TS val 3346048024 ecr 842132170], length 64
07:58:14.456420 IP prabesha2026.ssh > 198.211.111.194.41568: Flags [P.], seq 1847857:1848257, ack 64, win 502, options [nop,nop,TS val 3346048024 ecr 842132170], length 400
07:58:14.456511 IP prabesha2026.ssh > 198.211.111.194.41568: Flags [P.], seq 1848257:1848833, ack 64, win 502, options [nop,nop,TS val 3346048024 ecr 842132170], length 576
07:58:14.456576 IP prabesha2026.ssh > 198.211.111.194.41568: Flags [P.], seq 1848833:1849233, ack 64, win 502, options [nop,nop,TS val 3346048025 ecr 842132170], length 400
07:58:14.456624 IP prabesha2026.ssh > 198.211.111.194.41568: Flags [P.], seq 1849233:1849457, ack 64, win 502, options [nop,nop,TS val 3346048025 ecr 842132170], length 224
07:58:14.456687 IP prabesha2026.ssh > 198.211.111.194.41568: Flags [P.], seq 1849457:1849857, ack 64, win 502, options [nop,nop,TS val 3346048025 ecr 842132170], length 400
07:58:14.456733 IP prabesha2026.ssh > 198.211.111.194.41568: Flags [P.], seq 1849857:1850081, ack 64, win 502, options [nop,nop,TS val 3346048025 ecr 842132170], length 224
07:58:14.456797 IP prabesha2026.ssh > 198.211.111.194.41568: Flags [P.], seq 1850081:1850481, ack 64, win 502, options [nop,nop,TS val 3346048025 ecr 842132170], length 400
07:58:14.456844 IP prabesha2026.ssh > 198.211.111.194.41568: Flags [P.], seq 1850481:1850705, ack 64, win 502, options [nop,nop,TS val 3346048025 ecr 842132170], length 224
07:58:14.456907 IP prabesha2026.ssh > 198.211.111.194.41568: Flags [P.], seq 1850705:1851105, ack 64, win 502, options [nop,nop,TS val 3346048025 ecr 842132170], length 400
07:58:14.456954 IP prabesha2026.ssh > 198.211.111.194.41568: Flags [P.], seq 1851105:1851329, ack 64, win 502, options [nop,nop,TS val 3346048025 ecr 842132170], length 224
07:58:14.457017 IP prabesha2026.ssh > 198.211.111.194.41568: Flags [P.], seq 1851329:1851729, ack 64, win 502, options [nop,nop,TS val 3346048025 ecr 842132170], length 400
07:58:14.457063 IP prabesha2026.ssh > 198.211.111.194.41568: Flags [P.], seq 1851729:1851953, ack 64, win 502, options [nop,nop,TS val 3346048025 ecr 842132170], length 224
07:58:14.457133 IP prabesha2026.ssh > 198.211.111.194.41568: Flags [P.], seq 1851953:1852353, ack 64, win 502, options [nop,nop,TS val 3346048025 ecr 842132170], length 400
07:58:14.457180 IP prabesha2026.ssh > 198.211.111.194.41568: Flags [P.], seq 1852353:1852577, ack 64, win 502, options [nop,nop,TS val 3346048025 ecr 842132170], length 224
07:58:14.457238 IP prabesha2026.ssh > 198.211.111.194.41568: Flags [P.], seq 1852577:1852817, ack 64, win 502, options [nop,nop,TS val 3346048025 ecr 842132170], length 240
07:58:14.457332 IP prabesha2026.ssh > 198.211.111.194.41568: Flags [P.], seq 1852817:1853217, ack 64, win 502, options [nop,nop,TS val 3346048025 ecr 842132170], length 400
07:58:14.457407 IP prabesha2026.ssh > 198.211.111.194.41568: Flags [P.], seq 1853217:1853617, ack 64, win 502, options [nop,nop,TS val 3346048025 ecr 842132170], length 400
07:58:14.457471 IP prabesha2026.ssh > 198.211.111.194.41568: Flags [P.], seq 1853617:1853985, ack 64, win 502, options [nop,nop,TS val 3346048025 ecr 842132170], length 368
07:58:14.457524 IP prabesha2026.ssh > 198.211.111.194.41568: Flags [P.], seq 1853985:1854193, ack 64, win 502, options [nop,nop,TS val 3346048025 ecr 842132170], length 208
07:58:14.457608 IP prabesha2026.ssh > 198.211.111.194.41568: Flags [P.], seq 1854193:1854561, ack 64, win 502, options [nop,nop,TS val 3346048026 ecr 842132170], length 368
07:58:14.457707 IP prabesha2026.ssh > 198.211.111.194.41568: Flags [P.], seq 1854561:1855089, ack 64, win 502, options [nop,nop,TS val 3346048026 ecr 842132170], length 528
07:58:14.457772 IP prabesha2026.ssh > 198.211.111.194.41568: Flags [P.], seq 1855089:1855457, ack 64, win 502, options [nop,nop,TS val 3346048026 ecr 842132170], length 368
07:58:14.457829 IP prabesha2026.ssh > 198.211.111.194.41568: Flags [P.], seq 1855457:1855713, ack 64, win 502, options [nop,nop,TS val 3346048026 ecr 842132170], length 256
07:58:14.457875 IP prabesha2026.ssh > 198.211.111.194.41568: Flags [P.], seq 1855713:1855921, ack 64, win 502, options [nop,nop,TS val 3346048026 ecr 842132170], length 208
07:58:14.457931 IP prabesha2026.ssh > 198.211.111.194.41568: Flags [P.], seq 1855921:1856129, ack 64, win 502, options [nop,nop,TS val 3346048026 ecr 842132170], length 208
07:58:14.471451 IP 198.211.111.194.41568 > prabesha2026.ssh: Flags [.], ack 1847217, win 501, options [nop,nop,TS val 842132241 ecr 3346048024], length 0
07:58:14.471635 IP 198.211.111.194.41568 > prabesha2026.ssh: Flags [.], ack 1848257, win 501, options [nop,nop,TS val 842132241 ecr 3346048024], length 0
07:58:14.471787 IP 198.211.111.194.41568 > prabesha2026.ssh: Flags [.], ack 1849233, win 501, options [nop,nop,TS val 842132241 ecr 3346048024], length 0
07:58:14.471956 IP 198.211.111.194.41568 > prabesha2026.ssh: Flags [.], ack 1850081, win 501, options [nop,nop,TS val 842132241 ecr 3346048025], length 0
07:58:14.472154 IP 198.211.111.194.41568 > prabesha2026.ssh: Flags [.], ack 1851105, win 501, options [nop,nop,TS val 842132242 ecr 3346048025], length 0
07:58:14.472290 IP 198.211.111.194.41568 > prabesha2026.ssh: Flags [.], ack 1851953, win 501, options [nop,nop,TS val 842132242 ecr 3346048025], length 0
07:58:14.472429 IP 198.211.111.194.41568 > prabesha2026.ssh: Flags [.], ack 1852817, win 501, options [nop,nop,TS val 842132242 ecr 3346048025], length 0
07:58:14.472628 IP 198.211.111.194.41568 > prabesha2026.ssh: Flags [.], ack 1853617, win 501, options [nop,nop,TS val 842132242 ecr 3346048025], length 0
07:58:14.472820 IP 198.211.111.194.41568 > prabesha2026.ssh: Flags [.], ack 1854561, win 501, options [nop,nop,TS val 842132242 ecr 3346048025], length 0
07:58:14.472967 IP 198.211.111.194.41568 > prabesha2026.ssh: Flags [.], ack 1855457, win 501, options [nop,nop,TS val 842132242 ecr 3346048026], length 0
07:58:14.511662 IP prabesha2026.ssh > 198.211.111.194.41568: Flags [P.], seq 1855921:1856129, ack 64, win 502, options [nop,nop,TS val 3346048080 ecr 842132242], length 208
07:58:14.516177 IP 198.211.111.194.41568 > prabesha2026.ssh: Flags [.], ack 1856129, win 501, options [nop,nop,TS val 842132285 ecr 3346048026], length 0
07:58:14.527063 IP 198.211.111.194.41568 > prabesha2026.ssh: Flags [.], ack 1856129, win 501, options [nop,nop,TS val 842132296 ecr 3346048080,nop,nop,sack 1 {1855921:1856129}], length 0
07:58:14.559917 IP prabesha2026.ssh > 198.211.111.194.41568: Flags [P.], seq 1856129:1856353, ack 64, win 502, options [nop,nop,TS val 3346048128 ecr 842132296], length 224
07:58:14.559987 IP prabesha2026.ssh > 198.211.111.194.41568: Flags [P.], seq 1856353:1856417, ack 64, win 502, options [nop,nop,TS val 3346048128 ecr 842132296], length 64
07:58:14.560046 IP prabesha2026.ssh > 198.211.111.194.41568: Flags [P.], seq 1856417:1856641, ack 64, win 502, options [nop,nop,TS val 3346048128 ecr 842132296], length 224
07:58:14.560085 IP prabesha2026.ssh > 198.211.111.194.41568: Flags [P.], seq 1856641:1856705, ack 64, win 502, options [nop,nop,TS val 3346048128 ecr 842132296], length 64
07:58:14.560134 IP prabesha2026.ssh > 198.211.111.194.41568: Flags [P.], seq 1856705:1856929, ack 64, win 502, options [nop,nop,TS val 3346048128 ecr 842132296], length 224
07:58:14.560188 IP prabesha2026.ssh > 198.211.111.194.41568: Flags [P.], seq 1856929:1856993, ack 64, win 502, options [nop,nop,TS val 3346048128 ecr 842132296], length 64
07:58:14.560236 IP prabesha2026.ssh > 198.211.111.194.41568: Flags [P.], seq 1856993:1857217, ack 64, win 502, options [nop,nop,TS val 3346048128 ecr 842132296], length 224
07:58:14.560270 IP prabesha2026.ssh > 198.211.111.194.41568: Flags [P.], seq 1857217:1857281, ack 64, win 502, options [nop,nop,TS val 3346048128 ecr 842132296], length 64
07:58:14.560313 IP prabesha2026.ssh > 198.211.111.194.41568: Flags [P.], seq 1857281:1857505, ack 64, win 502, options [nop,nop,TS val 3346048128 ecr 842132296], length 224
07:58:14.560341 IP prabesha2026.ssh > 198.211.111.194.41568: Flags [P.], seq 1857505:1857569, ack 64, win 502, options [nop,nop,TS val 3346048128 ecr 842132296], length 64
07:58:14.560415 IP prabesha2026.ssh > 198.211.111.194.41568: Flags [P.], seq 1857569:1857969, ack 64, win 502, options [nop,nop,TS val 3346048128 ecr 842132296], length 400
07:58:14.560463 IP prabesha2026.ssh > 198.211.111.194.41568: Flags [P.], seq 1857969:1858193, ack 64, win 502, options [nop,nop,TS val 3346048128 ecr 842132296], length 224
07:58:14.560528 IP prabesha2026.ssh > 198.211.111.194.41568: Flags [P.], seq 1858193:1858593, ack 64, win 502, options [nop,nop,TS val 3346048128 ecr 842132296], length 400
07:58:14.560575 IP prabesha2026.ssh > 198.211.111.194.41568: Flags [P.], seq 1858593:1858817, ack 64, win 502, options [nop,nop,TS val 3346048129 ecr 842132296], length 224
07:58:14.560642 IP prabesha2026.ssh > 198.211.111.194.41568: Flags [P.], seq 1858817:1859217, ack 64, win 502, options [nop,nop,TS val 3346048129 ecr 842132296], length 400
07:58:14.560707 IP prabesha2026.ssh > 198.211.111.194.41568: Flags [P.], seq 1859217:1859617, ack 64, win 502, options [nop,nop,TS val 3346048129 ecr 842132296], length 400
07:58:14.560770 IP prabesha2026.ssh > 198.211.111.194.41568: Flags [P.], seq 1859617:1860017, ack 64, win 502, options [nop,nop,TS val 3346048129 ecr 842132296], length 400
07:58:14.560877 IP prabesha2026.ssh > 198.211.111.194.41568: Flags [P.], seq 1860017:1860417, ack 64, win 502, options [nop,nop,TS val 3346048129 ecr 842132296], length 400
07:58:14.560962 IP prabesha2026.ssh > 198.211.111.194.41568: Flags [P.], seq 1860417:1860817, ack 64, win 502, options [nop,nop,TS val 3346048129 ecr 842132296], length 400
07:58:14.561079 IP prabesha2026.ssh > 198.211.111.194.41568: Flags [P.], seq 1860817:1861393, ack 64, win 502, options [nop,nop,TS val 3346048129 ecr 842132296], length 576
07:58:14.561191 IP prabesha2026.ssh > 198.211.111.194.41568: Flags [P.], seq 1861393:1861969, ack 64, win 502, options [nop,nop,TS val 3346048129 ecr 842132296], length 576
07:58:14.561286 IP prabesha2026.ssh > 198.211.111.194.41568: Flags [P.], seq 1861969:1862545, ack 64, win 502, options [nop,nop,TS val 3346048129 ecr 842132296], length 576
07:58:14.561351 IP prabesha2026.ssh > 198.211.111.194.41568: Flags [P.], seq 1862545:1862945, ack 64, win 502, options [nop,nop,TS val 3346048129 ecr 842132296], length 400
07:58:14.561414 IP prabesha2026.ssh > 198.211.111.194.41568: Flags [P.], seq 1862945:1863345, ack 64, win 502, options [nop,nop,TS val 3346048129 ecr 842132296], length 400
07:58:14.561460 IP prabesha2026.ssh > 198.211.111.194.41568: Flags [P.], seq 1863345:1863569, ack 64, win 502, options [nop,nop,TS val 3346048129 ecr 842132296], length 224
07:58:14.561523 IP prabesha2026.ssh > 198.211.111.194.41568: Flags [P.], seq 1863569:1863937, ack 64, win 502, options [nop,nop,TS val 3346048129 ecr 842132296], length 368
07:58:14.561585 IP prabesha2026.ssh > 198.211.111.194.41568: Flags [P.], seq 1863937:1864305, ack 64, win 502, options [nop,nop,TS val 3346048130 ecr 842132296], length 368
07:58:14.561630 IP prabesha2026.ssh > 198.211.111.194.41568: Flags [P.], seq 1864305:1864513, ack 64, win 502, options [nop,nop,TS val 3346048130 ecr 842132296], length 208
07:58:14.561692 IP prabesha2026.ssh > 198.211.111.194.41568: Flags [P.], seq 1864513:1864881, ack 64, win 502, options [nop,nop,TS val 3346048130 ecr 842132296], length 368
07:58:14.561742 IP prabesha2026.ssh > 198.211.111.194.41568: Flags [P.], seq 1864881:1865089, ack 64, win 502, options [nop,nop,TS val 3346048130 ecr 842132296], length 208
07:58:14.561802 IP prabesha2026.ssh > 198.211.111.194.41568: Flags [P.], seq 1865089:1865457, ack 64, win 502, options [nop,nop,TS val 3346048130 ecr 842132296], length 368
07:58:14.561872 IP prabesha2026.ssh > 198.211.111.194.41568: Flags [P.], seq 1865457:1865841, ack 64, win 502, options [nop,nop,TS val 3346048130 ecr 842132296], length 384
07:58:14.561932 IP prabesha2026.ssh > 198.211.111.194.41568: Flags [P.], seq 1865841:1866081, ack 64, win 502, options [nop,nop,TS val 3346048130 ecr 842132296], length 240
07:58:14.575330 IP 198.211.111.194.41568 > prabesha2026.ssh: Flags [.], ack 1856353, win 501, options [nop,nop,TS val 842132345 ecr 3346048128], length 0
07:58:14.575330 IP 198.211.111.194.41568 > prabesha2026.ssh: Flags [.], ack 1856417, win 501, options [nop,nop,TS val 842132345 ecr 3346048128], length 0
07:58:14.575331 IP 198.211.111.194.41568 > prabesha2026.ssh: Flags [.], ack 1856641, win 501, options [nop,nop,TS val 842132345 ecr 3346048128], length 0
07:58:14.575404 IP 198.211.111.194.41568 > prabesha2026.ssh: Flags [.], ack 1856705, win 501, options [nop,nop,TS val 842132345 ecr 3346048128], length 0
07:58:14.575404 IP 198.211.111.194.41568 > prabesha2026.ssh: Flags [.], ack 1856929, win 501, options [nop,nop,TS val 842132345 ecr 3346048128], length 0
07:58:14.575404 IP 198.211.111.194.41568 > prabesha2026.ssh: Flags [.], ack 1856993, win 501, options [nop,nop,TS val 842132345 ecr 3346048128], length 0
07:58:14.575473 IP 198.211.111.194.41568 > prabesha2026.ssh: Flags [.], ack 1857217, win 501, options [nop,nop,TS val 842132345 ecr 3346048128], length 0
07:58:14.575516 IP 198.211.111.194.41568 > prabesha2026.ssh: Flags [.], ack 1857281, win 501, options [nop,nop,TS val 842132345 ecr 3346048128], length 0
07:58:14.575534 IP 198.211.111.194.41568 > prabesha2026.ssh: Flags [.], ack 1857505, win 501, options [nop,nop,TS val 842132345 ecr 3346048128], length 0
07:58:14.575624 IP 198.211.111.194.41568 > prabesha2026.ssh: Flags [.], ack 1857569, win 501, options [nop,nop,TS val 842132345 ecr 3346048128], length 0
07:58:14.575627 IP 198.211.111.194.41568 > prabesha2026.ssh: Flags [.], ack 1857969, win 501, options [nop,nop,TS val 842132345 ecr 3346048128], length 0
07:58:14.575640 IP 198.211.111.194.41568 > prabesha2026.ssh: Flags [.], ack 1858193, win 501, options [nop,nop,TS val 842132345 ecr 3346048128], length 0
07:58:14.575752 IP 198.211.111.194.41568 > prabesha2026.ssh: Flags [.], ack 1858593, win 501, options [nop,nop,TS val 842132345 ecr 3346048128], length 0
07:58:14.575815 IP 198.211.111.194.41568 > prabesha2026.ssh: Flags [.], ack 1858817, win 501, options [nop,nop,TS val 842132345 ecr 3346048129], length 0
07:58:14.575835 IP 198.211.111.194.41568 > prabesha2026.ssh: Flags [.], ack 1859217, win 501, options [nop,nop,TS val 842132345 ecr 3346048129], length 0
07:58:14.576101 IP 198.211.111.194.41568 > prabesha2026.ssh: Flags [.], ack 1860017, win 501, options [nop,nop,TS val 842132346 ecr 3346048129], length 0
07:58:14.576149 IP 198.211.111.194.41568 > prabesha2026.ssh: Flags [.], ack 1860817, win 501, options [nop,nop,TS val 842132346 ecr 3346048129], length 0
07:58:14.576442 IP 198.211.111.194.41568 > prabesha2026.ssh: Flags [.], ack 1861969, win 501, options [nop,nop,TS val 842132346 ecr 3346048129], length 0
07:58:14.576556 IP 198.211.111.194.41568 > prabesha2026.ssh: Flags [.], ack 1862945, win 501, options [nop,nop,TS val 842132346 ecr 3346048129], length 0
07:58:14.576641 IP 198.211.111.194.41568 > prabesha2026.ssh: Flags [.], ack 1863569, win 501, options [nop,nop,TS val 842132346 ecr 3346048129], length 0
07:58:14.576776 IP 198.211.111.194.41568 > prabesha2026.ssh: Flags [.], ack 1864305, win 501, options [nop,nop,TS val 842132346 ecr 3346048129], length 0
07:58:14.577013 IP 198.211.111.194.41568 > prabesha2026.ssh: Flags [.], ack 1865089, win 501, options [nop,nop,TS val 842132346 ecr 3346048130], length 0
07:58:14.577081 IP 198.211.111.194.41568 > prabesha2026.ssh: Flags [.], ack 1865841, win 501, options [nop,nop,TS val 842132347 ecr 3346048130], length 0
07:58:14.617348 IP 198.211.111.194.41568 > prabesha2026.ssh: Flags [.], ack 1866081, win 501, options [nop,nop,TS val 842132387 ecr 3346048130], length 0
07:58:14.663919 IP prabesha2026.ssh > 198.211.111.194.41568: Flags [P.], seq 1866081:1866305, ack 64, win 502, options [nop,nop,TS val 3346048232 ecr 842132387], length 224
07:58:14.663983 IP prabesha2026.ssh > 198.211.111.194.41568: Flags [P.], seq 1866305:1866369, ack 64, win 502, options [nop,nop,TS val 3346048232 ecr 842132387], length 64
07:58:14.664088 IP prabesha2026.ssh > 198.211.111.194.41568: Flags [P.], seq 1866369:1866593, ack 64, win 502, options [nop,nop,TS val 3346048232 ecr 842132387], length 224
07:58:14.664163 IP prabesha2026.ssh > 198.211.111.194.41568: Flags [P.], seq 1866593:1866993, ack 64, win 502, options [nop,nop,TS val 3346048232 ecr 842132387], length 400
07:58:14.664234 IP prabesha2026.ssh > 198.211.111.194.41568: Flags [P.], seq 1866993:1867217, ack 64, win 502, options [nop,nop,TS val 3346048232 ecr 842132387], length 224
07:58:14.664318 IP prabesha2026.ssh > 198.211.111.194.41568: Flags [P.], seq 1867217:1867793, ack 64, win 502, options [nop,nop,TS val 3346048232 ecr 842132387], length 576
07:58:14.664382 IP prabesha2026.ssh > 198.211.111.194.41568: Flags [P.], seq 1867793:1868193, ack 64, win 502, options [nop,nop,TS val 3346048232 ecr 842132387], length 400
07:58:14.664445 IP prabesha2026.ssh > 198.211.111.194.41568: Flags [P.], seq 1868193:1868417, ack 64, win 502, options [nop,nop,TS val 3346048232 ecr 842132387], length 224
07:58:14.664532 IP prabesha2026.ssh > 198.211.111.194.41568: Flags [P.], seq 1868417:1868817, ack 64, win 502, options [nop,nop,TS val 3346048232 ecr 842132387], length 400
07:58:14.664614 IP prabesha2026.ssh > 198.211.111.194.41568: Flags [P.], seq 1868817:1869217, ack 64, win 502, options [nop,nop,TS val 3346048233 ecr 842132387], length 400
07:58:14.664677 IP prabesha2026.ssh > 198.211.111.194.41568: Flags [P.], seq 1869217:1869617, ack 64, win 502, options [nop,nop,TS val 3346048233 ecr 842132387], length 400
07:58:14.664723 IP prabesha2026.ssh > 198.211.111.194.41568: Flags [P.], seq 1869617:1869841, ack 64, win 502, options [nop,nop,TS val 3346048233 ecr 842132387], length 224
07:58:14.664795 IP prabesha2026.ssh > 198.211.111.194.41568: Flags [P.], seq 1869841:1870241, ack 64, win 502, options [nop,nop,TS val 3346048233 ecr 842132387], length 400
07:58:14.664873 IP prabesha2026.ssh > 198.211.111.194.41568: Flags [P.], seq 1870241:1870641, ack 64, win 502, options [nop,nop,TS val 3346048233 ecr 842132387], length 400
07:58:14.664935 IP prabesha2026.ssh > 198.211.111.194.41568: Flags [P.], seq 1870641:1870865, ack 64, win 502, options [nop,nop,TS val 3346048233 ecr 842132387], length 224
07:58:14.665001 IP prabesha2026.ssh > 198.211.111.194.41568: Flags [P.], seq 1870865:1871265, ack 64, win 502, options [nop,nop,TS val 3346048233 ecr 842132387], length 400
07:58:14.665051 IP prabesha2026.ssh > 198.211.111.194.41568: Flags [P.], seq 1871265:1871505, ack 64, win 502, options [nop,nop,TS val 3346048233 ecr 842132387], length 240
07:58:14.665142 IP prabesha2026.ssh > 198.211.111.194.41568: Flags [P.], seq 1871505:1871905, ack 64, win 502, options [nop,nop,TS val 3346048233 ecr 842132387], length 400
07:58:14.665190 IP prabesha2026.ssh > 198.211.111.194.41568: Flags [P.], seq 1871905:1872129, ack 64, win 502, options [nop,nop,TS val 3346048233 ecr 842132387], length 224
07:58:14.665237 IP prabesha2026.ssh > 198.211.111.194.41568: Flags [P.], seq 1872129:1872353, ack 64, win 502, options [nop,nop,TS val 3346048233 ecr 842132387], length 224
07:58:14.665283 IP prabesha2026.ssh > 198.211.111.194.41568: Flags [P.], seq 1872353:1872577, ack 64, win 502, options [nop,nop,TS val 3346048233 ecr 842132387], length 224
07:58:14.665345 IP prabesha2026.ssh > 198.211.111.194.41568: Flags [P.], seq 1872577:1872977, ack 64, win 502, options [nop,nop,TS val 3346048233 ecr 842132387], length 400
07:58:14.665392 IP prabesha2026.ssh > 198.211.111.194.41568: Flags [P.], seq 1872977:1873185, ack 64, win 502, options [nop,nop,TS val 3346048233 ecr 842132387], length 208
07:58:14.665454 IP prabesha2026.ssh > 198.211.111.194.41568: Flags [P.], seq 1873185:1873553, ack 64, win 502, options [nop,nop,TS val 3346048233 ecr 842132387], length 368
07:58:14.665499 IP prabesha2026.ssh > 198.211.111.194.41568: Flags [P.], seq 1873553:1873761, ack 64, win 502, options [nop,nop,TS val 3346048233 ecr 842132387], length 208
07:58:14.665560 IP prabesha2026.ssh > 198.211.111.194.41568: Flags [P.], seq 1873761:1874129, ack 64, win 502, options [nop,nop,TS val 3346048233 ecr 842132387], length 368
07:58:14.665605 IP prabesha2026.ssh > 198.211.111.194.41568: Flags [P.], seq 1874129:1874337, ack 64, win 502, options [nop,nop,TS val 3346048234 ecr 842132387], length 208
07:58:14.665668 IP prabesha2026.ssh > 198.211.111.194.41568: Flags [P.], seq 1874337:1874705, ack 64, win 502, options [nop,nop,TS val 3346048234 ecr 842132387], length 368
07:58:14.665799 IP prabesha2026.ssh > 198.211.111.194.41568: Flags [P.], seq 1874705:1875073, ack 64, win 502, options [nop,nop,TS val 3346048234 ecr 842132387], length 368
07:58:14.665938 IP prabesha2026.ssh > 198.211.111.194.41568: Flags [P.], seq 1875073:1875905, ack 64, win 502, options [nop,nop,TS val 3346048234 ecr 842132387], length 832
07:58:14.666007 IP prabesha2026.ssh > 198.211.111.194.41568: Flags [P.], seq 1875905:1876433, ack 64, win 502, options [nop,nop,TS val 3346048234 ecr 842132387], length 528
07:58:14.666066 IP prabesha2026.ssh > 198.211.111.194.41568: Flags [P.], seq 1876433:1876961, ack 64, win 502, options [nop,nop,TS val 3346048234 ecr 842132387], length 528
07:58:14.666119 IP prabesha2026.ssh > 198.211.111.194.41568: Flags [P.], seq 1876961:1877329, ack 64, win 502, options [nop,nop,TS val 3346048234 ecr 842132387], length 368
07:58:14.666151 IP prabesha2026.ssh > 198.211.111.194.41568: Flags [P.], seq 1877329:1877393, ack 64, win 502, options [nop,nop,TS val 3346048234 ecr 842132387], length 64
07:58:14.679419 IP 198.211.111.194.41568 > prabesha2026.ssh: Flags [.], ack 1866993, win 501, options [nop,nop,TS val 842132449 ecr 3346048232], length 0
07:58:14.679521 IP 198.211.111.194.41568 > prabesha2026.ssh: Flags [.], ack 1867793, win 501, options [nop,nop,TS val 842132449 ecr 3346048232], length 0
07:58:14.679633 IP 198.211.111.194.41568 > prabesha2026.ssh: Flags [.], ack 1868417, win 501, options [nop,nop,TS val 842132449 ecr 3346048232], length 0
07:58:14.679798 IP 198.211.111.194.41568 > prabesha2026.ssh: Flags [.], ack 1869217, win 501, options [nop,nop,TS val 842132449 ecr 3346048232], length 0
07:58:14.679907 IP 198.211.111.194.41568 > prabesha2026.ssh: Flags [.], ack 1869841, win 501, options [nop,nop,TS val 842132449 ecr 3346048233], length 0
07:58:14.680065 IP 198.211.111.194.41568 > prabesha2026.ssh: Flags [.], ack 1870641, win 501, options [nop,nop,TS val 842132450 ecr 3346048233], length 0
07:58:14.680200 IP 198.211.111.194.41568 > prabesha2026.ssh: Flags [.], ack 1871265, win 501, options [nop,nop,TS val 842132450 ecr 3346048233], length 0
07:58:14.680307 IP 198.211.111.194.41568 > prabesha2026.ssh: Flags [.], ack 1871905, win 501, options [nop,nop,TS val 842132450 ecr 3346048233], length 0
07:58:14.680468 IP 198.211.111.194.41568 > prabesha2026.ssh: Flags [.], ack 1872577, win 501, options [nop,nop,TS val 842132450 ecr 3346048233], length 0
07:58:14.680575 IP 198.211.111.194.41568 > prabesha2026.ssh: Flags [.], ack 1873185, win 501, options [nop,nop,TS val 842132450 ecr 3346048233], length 0
07:58:14.680744 IP 198.211.111.194.41568 > prabesha2026.ssh: Flags [.], ack 1874129, win 501, options [nop,nop,TS val 842132450 ecr 3346048233], length 0
07:58:14.680995 IP 198.211.111.194.41568 > prabesha2026.ssh: Flags [.], ack 1875073, win 501, options [nop,nop,TS val 842132450 ecr 3346048234], length 0
07:58:14.681196 IP 198.211.111.194.41568 > prabesha2026.ssh: Flags [.], ack 1876433, win 501, options [nop,nop,TS val 842132451 ecr 3346048234], length 0
07:58:14.681303 IP 198.211.111.194.41568 > prabesha2026.ssh: Flags [.], ack 1877329, win 501, options [nop,nop,TS val 842132451 ecr 3346048234], length 0
07:58:14.724172 IP 198.211.111.194.41568 > prabesha2026.ssh: Flags [.], ack 1877393, win 501, options [nop,nop,TS val 842132493 ecr 3346048234], length 0
07:58:14.767914 IP prabesha2026.ssh > 198.211.111.194.41568: Flags [P.], seq 1877393:1877617, ack 64, win 502, options [nop,nop,TS val 3346048336 ecr 842132493], length 224
07:58:14.767977 IP prabesha2026.ssh > 198.211.111.194.41568: Flags [P.], seq 1877617:1877681, ack 64, win 502, options [nop,nop,TS val 3346048336 ecr 842132493], length 64
07:58:14.768029 IP prabesha2026.ssh > 198.211.111.194.41568: Flags [P.], seq 1877681:1877905, ack 64, win 502, options [nop,nop,TS val 3346048336 ecr 842132493], length 224
07:58:14.768058 IP prabesha2026.ssh > 198.211.111.194.41568: Flags [P.], seq 1877905:1877969, ack 64, win 502, options [nop,nop,TS val 3346048336 ecr 842132493], length 64
07:58:14.768103 IP prabesha2026.ssh > 198.211.111.194.41568: Flags [P.], seq 1877969:1878193, ack 64, win 502, options [nop,nop,TS val 3346048336 ecr 842132493], length 224
07:58:14.768156 IP prabesha2026.ssh > 198.211.111.194.41568: Flags [P.], seq 1878193:1878257, ack 64, win 502, options [nop,nop,TS val 3346048336 ecr 842132493], length 64
07:58:14.768188 IP prabesha2026.ssh > 198.211.111.194.41568: Flags [P.], seq 1878257:1878481, ack 64, win 502, options [nop,nop,TS val 3346048336 ecr 842132493], length 224
07:58:14.768250 IP prabesha2026.ssh > 198.211.111.194.41568: Flags [P.], seq 1878481:1878705, ack 64, win 502, options [nop,nop,TS val 3346048336 ecr 842132493], length 224
07:58:14.768349 IP prabesha2026.ssh > 198.211.111.194.41568: Flags [P.], seq 1878705:1879105, ack 64, win 502, options [nop,nop,TS val 3346048336 ecr 842132493], length 400
07:58:14.768437 IP prabesha2026.ssh > 198.211.111.194.41568: Flags [P.], seq 1879105:1879505, ack 64, win 502, options [nop,nop,TS val 3346048336 ecr 842132493], length 400
07:58:14.768532 IP prabesha2026.ssh > 198.211.111.194.41568: Flags [P.], seq 1879505:1880081, ack 64, win 502, options [nop,nop,TS val 3346048336 ecr 842132493], length 576
07:58:14.768621 IP prabesha2026.ssh > 198.211.111.194.41568: Flags [P.], seq 1880081:1880481, ack 64, win 502, options [nop,nop,TS val 3346048337 ecr 842132493], length 400
07:58:14.768694 IP prabesha2026.ssh > 198.211.111.194.41568: Flags [P.], seq 1880481:1880881, ack 64, win 502, options [nop,nop,TS val 3346048337 ecr 842132493], length 400
07:58:14.768760 IP prabesha2026.ssh > 198.211.111.194.41568: Flags [P.], seq 1880881:1881281, ack 64, win 502, options [nop,nop,TS val 3346048337 ecr 842132493], length 400
07:58:14.768810 IP prabesha2026.ssh > 198.211.111.194.41568: Flags [P.], seq 1881281:1881505, ack 64, win 502, options [nop,nop,TS val 3346048337 ecr 842132493], length 224
07:58:14.768875 IP prabesha2026.ssh > 198.211.111.194.41568: Flags [P.], seq 1881505:1881729, ack 64, win 502, options [nop,nop,TS val 3346048337 ecr 842132493], length 224
07:58:14.768966 IP prabesha2026.ssh > 198.211.111.194.41568: Flags [P.], seq 1881729:1882129, ack 64, win 502, options [nop,nop,TS val 3346048337 ecr 842132493], length 400
07:58:14.769049 IP prabesha2026.ssh > 198.211.111.194.41568: Flags [P.], seq 1882129:1882529, ack 64, win 502, options [nop,nop,TS val 3346048337 ecr 842132493], length 400
07:58:14.769138 IP prabesha2026.ssh > 198.211.111.194.41568: Flags [P.], seq 1882529:1882929, ack 64, win 502, options [nop,nop,TS val 3346048337 ecr 842132493], length 400
07:58:14.769199 IP prabesha2026.ssh > 198.211.111.194.41568: Flags [P.], seq 1882929:1883329, ack 64, win 502, options [nop,nop,TS val 3346048337 ecr 842132493], length 400
07:58:14.769287 IP prabesha2026.ssh > 198.211.111.194.41568: Flags [P.], seq 1883329:1883729, ack 64, win 502, options [nop,nop,TS val 3346048337 ecr 842132493], length 400
07:58:14.769370 IP prabesha2026.ssh > 198.211.111.194.41568: Flags [P.], seq 1883729:1884129, ack 64, win 502, options [nop,nop,TS val 3346048337 ecr 842132493], length 400
07:58:14.769460 IP prabesha2026.ssh > 198.211.111.194.41568: Flags [P.], seq 1884129:1884529, ack 64, win 502, options [nop,nop,TS val 3346048337 ecr 842132493], length 400
07:58:14.769531 IP prabesha2026.ssh > 198.211.111.194.41568: Flags [P.], seq 1884529:1885057, ack 64, win 502, options [nop,nop,TS val 3346048337 ecr 842132493], length 528
07:58:14.769584 IP prabesha2026.ssh > 198.211.111.194.41568: Flags [P.], seq 1885057:1885425, ack 64, win 502, options [nop,nop,TS val 3346048338 ecr 842132493], length 368
07:58:14.769624 IP prabesha2026.ssh > 198.211.111.194.41568: Flags [P.], seq 1885425:1885633, ack 64, win 502, options [nop,nop,TS val 3346048338 ecr 842132493], length 208
07:58:14.769677 IP prabesha2026.ssh > 198.211.111.194.41568: Flags [P.], seq 1885633:1886001, ack 64, win 502, options [nop,nop,TS val 3346048338 ecr 842132493], length 368
07:58:14.769729 IP prabesha2026.ssh > 198.211.111.194.41568: Flags [P.], seq 1886001:1886369, ack 64, win 502, options [nop,nop,TS val 3346048338 ecr 842132493], length 368
07:58:14.769785 IP prabesha2026.ssh > 198.211.111.194.41568: Flags [P.], seq 1886369:1886577, ack 64, win 502, options [nop,nop,TS val 3346048338 ecr 842132493], length 208
07:58:14.769912 IP prabesha2026.ssh > 198.211.111.194.41568: Flags [P.], seq 1886577:1886945, ack 64, win 502, options [nop,nop,TS val 3346048338 ecr 842132493], length 368
07:58:14.770017 IP prabesha2026.ssh > 198.211.111.194.41568: Flags [P.], seq 1886945:1887313, ack 64, win 502, options [nop,nop,TS val 3346048338 ecr 842132493], length 368
07:58:14.783408 IP 198.211.111.194.41568 > prabesha2026.ssh: Flags [.], ack 1877969, win 501, options [nop,nop,TS val 842132553 ecr 3346048336], length 0
07:58:14.783468 IP 198.211.111.194.41568 > prabesha2026.ssh: Flags [.], ack 1878705, win 501, options [nop,nop,TS val 842132553 ecr 3346048336], length 0
07:58:14.783669 IP 198.211.111.194.41568 > prabesha2026.ssh: Flags [.], ack 1879505, win 501, options [nop,nop,TS val 842132553 ecr 3346048336], length 0
07:58:14.783852 IP 198.211.111.194.41568 > prabesha2026.ssh: Flags [.], ack 1880481, win 501, options [nop,nop,TS val 842132553 ecr 3346048336], length 0
07:58:14.783961 IP 198.211.111.194.41568 > prabesha2026.ssh: Flags [.], ack 1881281, win 501, options [nop,nop,TS val 842132553 ecr 3346048337], length 0
07:58:14.784187 IP 198.211.111.194.41568 > prabesha2026.ssh: Flags [.], ack 1882129, win 501, options [nop,nop,TS val 842132554 ecr 3346048337], length 0
07:58:14.784359 IP 198.211.111.194.41568 > prabesha2026.ssh: Flags [.], ack 1882929, win 501, options [nop,nop,TS val 842132554 ecr 3346048337], length 0
07:58:14.784518 IP 198.211.111.194.41568 > prabesha2026.ssh: Flags [.], ack 1883729, win 501, options [nop,nop,TS val 842132554 ecr 3346048337], length 0
07:58:14.784690 IP 198.211.111.194.41568 > prabesha2026.ssh: Flags [.], ack 1884529, win 501, options [nop,nop,TS val 842132554 ecr 3346048337], length 0
07:58:14.784810 IP 198.211.111.194.41568 > prabesha2026.ssh: Flags [.], ack 1885425, win 501, options [nop,nop,TS val 842132554 ecr 3346048337], length 0
07:58:14.784959 IP 198.211.111.194.41568 > prabesha2026.ssh: Flags [.], ack 1886369, win 501, options [nop,nop,TS val 842132554 ecr 3346048338], length 0
07:58:14.785258 IP 198.211.111.194.41568 > prabesha2026.ssh: Flags [.], ack 1887313, win 501, options [nop,nop,TS val 842132555 ecr 3346048338], length 0
07:58:14.872017 IP prabesha2026.ssh > 198.211.111.194.41568: Flags [P.], seq 1887313:1887537, ack 64, win 502, options [nop,nop,TS val 3346048440 ecr 842132555], length 224
07:58:14.872115 IP prabesha2026.ssh > 198.211.111.194.41568: Flags [P.], seq 1887537:1887601, ack 64, win 502, options [nop,nop,TS val 3346048440 ecr 842132555], length 64
07:58:14.872170 IP prabesha2026.ssh > 198.211.111.194.41568: Flags [P.], seq 1887601:1887825, ack 64, win 502, options [nop,nop,TS val 3346048440 ecr 842132555], length 224
07:58:14.872206 IP prabesha2026.ssh > 198.211.111.194.41568: Flags [P.], seq 1887825:1887889, ack 64, win 502, options [nop,nop,TS val 3346048440 ecr 842132555], length 64
07:58:14.872268 IP prabesha2026.ssh > 198.211.111.194.41568: Flags [P.], seq 1887889:1888113, ack 64, win 502, options [nop,nop,TS val 3346048440 ecr 842132555], length 224
07:58:14.872299 IP prabesha2026.ssh > 198.211.111.194.41568: Flags [P.], seq 1888113:1888177, ack 64, win 502, options [nop,nop,TS val 3346048440 ecr 842132555], length 64
07:58:14.872344 IP prabesha2026.ssh > 198.211.111.194.41568: Flags [P.], seq 1888177:1888401, ack 64, win 502, options [nop,nop,TS val 3346048440 ecr 842132555], length 224
07:58:14.872373 IP prabesha2026.ssh > 198.211.111.194.41568: Flags [P.], seq 1888401:1888465, ack 64, win 502, options [nop,nop,TS val 3346048440 ecr 842132555], length 64
07:58:14.872429 IP prabesha2026.ssh > 198.211.111.194.41568: Flags [P.], seq 1888465:1888689, ack 64, win 502, options [nop,nop,TS val 3346048440 ecr 842132555], length 224
07:58:14.872458 IP prabesha2026.ssh > 198.211.111.194.41568: Flags [P.], seq 1888689:1888753, ack 64, win 502, options [nop,nop,TS val 3346048440 ecr 842132555], length 64
07:58:14.872520 IP prabesha2026.ssh > 198.211.111.194.41568: Flags [P.], seq 1888753:1888977, ack 64, win 502, options [nop,nop,TS val 3346048440 ecr 842132555], length 224
07:58:14.872557 IP prabesha2026.ssh > 198.211.111.194.41568: Flags [P.], seq 1888977:1889041, ack 64, win 502, options [nop,nop,TS val 3346048440 ecr 842132555], length 64
07:58:14.872621 IP prabesha2026.ssh > 198.211.111.194.41568: Flags [P.], seq 1889041:1889265, ack 64, win 502, options [nop,nop,TS val 3346048441 ecr 842132555], length 224
07:58:14.872704 IP prabesha2026.ssh > 198.211.111.194.41568: Flags [P.], seq 1889265:1889665, ack 64, win 502, options [nop,nop,TS val 3346048441 ecr 842132555], length 400
07:58:14.872771 IP prabesha2026.ssh > 198.211.111.194.41568: Flags [P.], seq 1889665:1890065, ack 64, win 502, options [nop,nop,TS val 3346048441 ecr 842132555], length 400
07:58:14.872817 IP prabesha2026.ssh > 198.211.111.194.41568: Flags [P.], seq 1890065:1890289, ack 64, win 502, options [nop,nop,TS val 3346048441 ecr 842132555], length 224
07:58:14.872881 IP prabesha2026.ssh > 198.211.111.194.41568: Flags [P.], seq 1890289:1890689, ack 64, win 502, options [nop,nop,TS val 3346048441 ecr 842132555], length 400
07:58:14.872931 IP prabesha2026.ssh > 198.211.111.194.41568: Flags [P.], seq 1890689:1890929, ack 64, win 502, options [nop,nop,TS val 3346048441 ecr 842132555], length 240
07:58:14.872993 IP prabesha2026.ssh > 198.211.111.194.41568: Flags [P.], seq 1890929:1891329, ack 64, win 502, options [nop,nop,TS val 3346048441 ecr 842132555], length 400
07:58:14.873057 IP prabesha2026.ssh > 198.211.111.194.41568: Flags [P.], seq 1891329:1891729, ack 64, win 502, options [nop,nop,TS val 3346048441 ecr 842132555], length 400
07:58:14.873104 IP prabesha2026.ssh > 198.211.111.194.41568: Flags [P.], seq 1891729:1891953, ack 64, win 502, options [nop,nop,TS val 3346048441 ecr 842132555], length 224
07:58:14.873167 IP prabesha2026.ssh > 198.211.111.194.41568: Flags [P.], seq 1891953:1892353, ack 64, win 502, options [nop,nop,TS val 3346048441 ecr 842132555], length 400
07:58:14.873213 IP prabesha2026.ssh > 198.211.111.194.41568: Flags [P.], seq 1892353:1892577, ack 64, win 502, options [nop,nop,TS val 3346048441 ecr 842132555], length 224
07:58:14.873259 IP prabesha2026.ssh > 198.211.111.194.41568: Flags [P.], seq 1892577:1892801, ack 64, win 502, options [nop,nop,TS val 3346048441 ecr 842132555], length 224
07:58:14.873337 IP prabesha2026.ssh > 198.211.111.194.41568: Flags [P.], seq 1892801:1893201, ack 64, win 502, options [nop,nop,TS val 3346048441 ecr 842132555], length 400
07:58:14.873409 IP prabesha2026.ssh > 198.211.111.194.41568: Flags [P.], seq 1893201:1893601, ack 64, win 502, options [nop,nop,TS val 3346048441 ecr 842132555], length 400
07:58:14.873489 IP prabesha2026.ssh > 198.211.111.194.41568: Flags [P.], seq 1893601:1894001, ack 64, win 502, options [nop,nop,TS val 3346048441 ecr 842132555], length 400
07:58:14.873569 IP prabesha2026.ssh > 198.211.111.194.41568: Flags [P.], seq 1894001:1894385, ack 64, win 502, options [nop,nop,TS val 3346048441 ecr 842132555], length 384
07:58:14.873633 IP prabesha2026.ssh > 198.211.111.194.41568: Flags [P.], seq 1894385:1894753, ack 64, win 502, options [nop,nop,TS val 3346048442 ecr 842132555], length 368
07:58:14.873707 IP prabesha2026.ssh > 198.211.111.194.41568: Flags [P.], seq 1894753:1895121, ack 64, win 502, options [nop,nop,TS val 3346048442 ecr 842132555], length 368
07:58:14.873766 IP prabesha2026.ssh > 198.211.111.194.41568: Flags [P.], seq 1895121:1895329, ack 64, win 502, options [nop,nop,TS val 3346048442 ecr 842132555], length 208
07:58:14.873845 IP prabesha2026.ssh > 198.211.111.194.41568: Flags [P.], seq 1895329:1895697, ack 64, win 502, options [nop,nop,TS val 3346048442 ecr 842132555], length 368
07:58:14.873922 IP prabesha2026.ssh > 198.211.111.194.41568: Flags [P.], seq 1895697:1896225, ack 64, win 502, options [nop,nop,TS val 3346048442 ecr 842132555], length 528
07:58:14.873983 IP prabesha2026.ssh > 198.211.111.194.41568: Flags [P.], seq 1896225:1896433, ack 64, win 502, options [nop,nop,TS val 3346048442 ecr 842132555], length 208
07:58:14.887547 IP 198.211.111.194.41568 > prabesha2026.ssh: Flags [.], ack 1888113, win 501, options [nop,nop,TS val 842132657 ecr 3346048440], length 0
07:58:14.887659 IP 198.211.111.194.41568 > prabesha2026.ssh: Flags [.], ack 1888753, win 501, options [nop,nop,TS val 842132657 ecr 3346048440], length 0
07:58:14.887927 IP 198.211.111.194.41568 > prabesha2026.ssh: Flags [.], ack 1889665, win 501, options [nop,nop,TS val 842132657 ecr 3346048440], length 0
07:58:14.888033 IP 198.211.111.194.41568 > prabesha2026.ssh: Flags [.], ack 1890289, win 501, options [nop,nop,TS val 842132657 ecr 3346048441], length 0
07:58:14.888104 IP 198.211.111.194.41568 > prabesha2026.ssh: Flags [.], ack 1890929, win 501, options [nop,nop,TS val 842132658 ecr 3346048441], length 0
07:58:14.888265 IP 198.211.111.194.41568 > prabesha2026.ssh: Flags [.], ack 1891729, win 501, options [nop,nop,TS val 842132658 ecr 3346048441], length 0
07:58:14.888391 IP 198.211.111.194.41568 > prabesha2026.ssh: Flags [.], ack 1892353, win 501, options [nop,nop,TS val 842132658 ecr 3346048441], length 0
07:58:14.888578 IP 198.211.111.194.41568 > prabesha2026.ssh: Flags [.], ack 1893201, win 501, options [nop,nop,TS val 842132658 ecr 3346048441], length 0
07:58:14.888653 IP 198.211.111.194.41568 > prabesha2026.ssh: Flags [.], ack 1894001, win 501, options [nop,nop,TS val 842132658 ecr 3346048441], length 0
07:58:14.888867 IP 198.211.111.194.41568 > prabesha2026.ssh: Flags [.], ack 1894753, win 501, options [nop,nop,TS val 842132658 ecr 3346048441], length 0
07:58:14.889081 IP 198.211.111.194.41568 > prabesha2026.ssh: Flags [.], ack 1895697, win 501, options [nop,nop,TS val 842132659 ecr 3346048442], length 0
07:58:14.889179 IP 198.211.111.194.41568 > prabesha2026.ssh: Flags [.], ack 1896433, win 501, options [nop,nop,TS val 842132659 ecr 3346048442], length 0
07:58:14.975932 IP prabesha2026.ssh > 198.211.111.194.41568: Flags [P.], seq 1896433:1896657, ack 64, win 502, options [nop,nop,TS val 3346048544 ecr 842132659], length 224
07:58:14.976006 IP prabesha2026.ssh > 198.211.111.194.41568: Flags [P.], seq 1896657:1896721, ack 64, win 502, options [nop,nop,TS val 3346048544 ecr 842132659], length 64
07:58:14.976049 IP prabesha2026.ssh > 198.211.111.194.41568: Flags [P.], seq 1896721:1896945, ack 64, win 502, options [nop,nop,TS val 3346048544 ecr 842132659], length 224
07:58:14.976101 IP prabesha2026.ssh > 198.211.111.194.41568: Flags [P.], seq 1896945:1897009, ack 64, win 502, options [nop,nop,TS val 3346048544 ecr 842132659], length 64
07:58:14.976149 IP prabesha2026.ssh > 198.211.111.194.41568: Flags [P.], seq 1897009:1897233, ack 64, win 502, options [nop,nop,TS val 3346048544 ecr 842132659], length 224
07:58:14.976217 IP prabesha2026.ssh > 198.211.111.194.41568: Flags [P.], seq 1897233:1897633, ack 64, win 502, options [nop,nop,TS val 3346048544 ecr 842132659], length 400
07:58:14.976264 IP prabesha2026.ssh > 198.211.111.194.41568: Flags [P.], seq 1897633:1897857, ack 64, win 502, options [nop,nop,TS val 3346048544 ecr 842132659], length 224
07:58:14.976327 IP prabesha2026.ssh > 198.211.111.194.41568: Flags [P.], seq 1897857:1898257, ack 64, win 502, options [nop,nop,TS val 3346048544 ecr 842132659], length 400
07:58:14.976401 IP prabesha2026.ssh > 198.211.111.194.41568: Flags [P.], seq 1898257:1898481, ack 64, win 502, options [nop,nop,TS val 3346048544 ecr 842132659], length 224
07:58:14.976454 IP prabesha2026.ssh > 198.211.111.194.41568: Flags [P.], seq 1898481:1898705, ack 64, win 502, options [nop,nop,TS val 3346048544 ecr 842132659], length 224
07:58:14.976519 IP prabesha2026.ssh > 198.211.111.194.41568: Flags [P.], seq 1898705:1899105, ack 64, win 502, options [nop,nop,TS val 3346048544 ecr 842132659], length 400
07:58:14.976565 IP prabesha2026.ssh > 198.211.111.194.41568: Flags [P.], seq 1899105:1899329, ack 64, win 502, options [nop,nop,TS val 3346048544 ecr 842132659], length 224
07:58:14.976613 IP prabesha2026.ssh > 198.211.111.194.41568: Flags [P.], seq 1899329:1899569, ack 64, win 502, options [nop,nop,TS val 3346048545 ecr 842132659], length 240
07:58:14.976674 IP prabesha2026.ssh > 198.211.111.194.41568: Flags [P.], seq 1899569:1899969, ack 64, win 502, options [nop,nop,TS val 3346048545 ecr 842132659], length 400
07:58:14.976723 IP prabesha2026.ssh > 198.211.111.194.41568: Flags [P.], seq 1899969:1900209, ack 64, win 502, options [nop,nop,TS val 3346048545 ecr 842132659], length 240
07:58:14.976784 IP prabesha2026.ssh > 198.211.111.194.41568: Flags [P.], seq 1900209:1900609, ack 64, win 502, options [nop,nop,TS val 3346048545 ecr 842132659], length 400
07:58:14.976831 IP prabesha2026.ssh > 198.211.111.194.41568: Flags [P.], seq 1900609:1900833, ack 64, win 502, options [nop,nop,TS val 3346048545 ecr 842132659], length 224
07:58:14.976892 IP prabesha2026.ssh > 198.211.111.194.41568: Flags [P.], seq 1900833:1901233, ack 64, win 502, options [nop,nop,TS val 3346048545 ecr 842132659], length 400
07:58:14.976969 IP prabesha2026.ssh > 198.211.111.194.41568: Flags [P.], seq 1901233:1901457, ack 64, win 502, options [nop,nop,TS val 3346048545 ecr 842132659], length 224
07:58:14.977086 IP prabesha2026.ssh > 198.211.111.194.41568: Flags [P.], seq 1901457:1902033, ack 64, win 502, options [nop,nop,TS val 3346048545 ecr 842132659], length 576
07:58:14.977175 IP prabesha2026.ssh > 198.211.111.194.41568: Flags [P.], seq 1902033:1902433, ack 64, win 502, options [nop,nop,TS val 3346048545 ecr 842132659], length 400
07:58:14.977222 IP prabesha2026.ssh > 198.211.111.194.41568: Flags [P.], seq 1902433:1902657, ack 64, win 502, options [nop,nop,TS val 3346048545 ecr 842132659], length 224
07:58:14.977285 IP prabesha2026.ssh > 198.211.111.194.41568: Flags [P.], seq 1902657:1903057, ack 64, win 502, options [nop,nop,TS val 3346048545 ecr 842132659], length 400
07:58:14.977331 IP prabesha2026.ssh > 198.211.111.194.41568: Flags [P.], seq 1903057:1903281, ack 64, win 502, options [nop,nop,TS val 3346048545 ecr 842132659], length 224
07:58:14.977387 IP prabesha2026.ssh > 198.211.111.194.41568: Flags [P.], seq 1903281:1903505, ack 64, win 502, options [nop,nop,TS val 3346048545 ecr 842132659], length 224
07:58:14.977454 IP prabesha2026.ssh > 198.211.111.194.41568: Flags [P.], seq 1903505:1904049, ack 64, win 502, options [nop,nop,TS val 3346048545 ecr 842132659], length 544
07:58:14.977505 IP prabesha2026.ssh > 198.211.111.194.41568: Flags [P.], seq 1904049:1904417, ack 64, win 502, options [nop,nop,TS val 3346048545 ecr 842132659], length 368
07:58:14.977555 IP prabesha2026.ssh > 198.211.111.194.41568: Flags [P.], seq 1904417:1904785, ack 64, win 502, options [nop,nop,TS val 3346048545 ecr 842132659], length 368
07:58:14.977604 IP prabesha2026.ssh > 198.211.111.194.41568: Flags [P.], seq 1904785:1905153, ack 64, win 502, options [nop,nop,TS val 3346048546 ecr 842132659], length 368
07:58:14.977659 IP prabesha2026.ssh > 198.211.111.194.41568: Flags [P.], seq 1905153:1905521, ack 64, win 502, options [nop,nop,TS val 3346048546 ecr 842132659], length 368
07:58:14.977721 IP prabesha2026.ssh > 198.211.111.194.41568: Flags [P.], seq 1905521:1905889, ack 64, win 502, options [nop,nop,TS val 3346048546 ecr 842132659], length 368
07:58:14.984246 IP ec2-13-219-1-233.compute-1.amazonaws.com.40427 > prabesha2026.8010: Flags [S], seq 817148078, win 65535, length 0
07:58:14.984305 IP prabesha2026.8010 > ec2-13-219-1-233.compute-1.amazonaws.com.40427: Flags [R.], seq 0, ack 817148079, win 0, length 0
07:58:14.991437 IP 198.211.111.194.41568 > prabesha2026.ssh: Flags [.], ack 1897233, win 501, options [nop,nop,TS val 842132761 ecr 3346048544], length 0
07:58:14.991487 IP 198.211.111.194.41568 > prabesha2026.ssh: Flags [.], ack 1897857, win 501, options [nop,nop,TS val 842132761 ecr 3346048544], length 0
07:58:14.991618 IP 198.211.111.194.41568 > prabesha2026.ssh: Flags [.], ack 1898481, win 501, options [nop,nop,TS val 842132761 ecr 3346048544], length 0
07:58:14.991735 IP 198.211.111.194.41568 > prabesha2026.ssh: Flags [.], ack 1899105, win 501, options [nop,nop,TS val 842132761 ecr 3346048544], length 0
07:58:14.991894 IP 198.211.111.194.41568 > prabesha2026.ssh: Flags [.], ack 1899969, win 501, options [nop,nop,TS val 842132761 ecr 3346048544], length 0
07:58:14.991959 IP 198.211.111.194.41568 > prabesha2026.ssh: Flags [.], ack 1900609, win 501, options [nop,nop,TS val 842132761 ecr 3346048545], length 0
07:58:14.992135 IP 198.211.111.194.41568 > prabesha2026.ssh: Flags [.], ack 1901233, win 501, options [nop,nop,TS val 842132762 ecr 3346048545], length 0
07:58:14.992315 IP 198.211.111.194.41568 > prabesha2026.ssh: Flags [.], ack 1902033, win 501, options [nop,nop,TS val 842132762 ecr 3346048545], length 0
07:58:14.992442 IP 198.211.111.194.41568 > prabesha2026.ssh: Flags [.], ack 1902657, win 501, options [nop,nop,TS val 842132762 ecr 3346048545], length 0
07:58:14.992554 IP 198.211.111.194.41568 > prabesha2026.ssh: Flags [.], ack 1903281, win 501, options [nop,nop,TS val 842132762 ecr 3346048545], length 0
07:58:14.992665 IP 198.211.111.194.41568 > prabesha2026.ssh: Flags [.], ack 1904049, win 501, options [nop,nop,TS val 842132762 ecr 3346048545], length 0
07:58:14.992741 IP 198.211.111.194.41568 > prabesha2026.ssh: Flags [.], ack 1904785, win 501, options [nop,nop,TS val 842132762 ecr 3346048545], length 0
07:58:14.992849 IP 198.211.111.194.41568 > prabesha2026.ssh: Flags [.], ack 1905521, win 501, options [nop,nop,TS val 842132762 ecr 3346048546], length 0
07:58:15.022551 IP 198.211.111.194.41568 > prabesha2026.ssh: Flags [.], ack 1905889, win 501, options [nop,nop,TS val 842132792 ecr 3346048546], length 0
07:58:15.080044 IP prabesha2026.ssh > 198.211.111.194.41568: Flags [P.], seq 1905889:1906113, ack 64, win 502, options [nop,nop,TS val 3346048648 ecr 842132792], length 224
07:58:15.080162 IP prabesha2026.ssh > 198.211.111.194.41568: Flags [P.], seq 1906113:1906689, ack 64, win 502, options [nop,nop,TS val 3346048648 ecr 842132792], length 576
07:58:15.080230 IP prabesha2026.ssh > 198.211.111.194.41568: Flags [P.], seq 1906689:1907089, ack 64, win 502, options [nop,nop,TS val 3346048648 ecr 842132792], length 400
07:58:15.080288 IP prabesha2026.ssh > 198.211.111.194.41568: Flags [P.], seq 1907089:1907313, ack 64, win 502, options [nop,nop,TS val 3346048648 ecr 842132792], length 224
07:58:15.080355 IP prabesha2026.ssh > 198.211.111.194.41568: Flags [P.], seq 1907313:1907713, ack 64, win 502, options [nop,nop,TS val 3346048648 ecr 842132792], length 400
07:58:15.080421 IP prabesha2026.ssh > 198.211.111.194.41568: Flags [P.], seq 1907713:1908113, ack 64, win 502, options [nop,nop,TS val 3346048648 ecr 842132792], length 400
07:58:15.080484 IP prabesha2026.ssh > 198.211.111.194.41568: Flags [P.], seq 1908113:1908513, ack 64, win 502, options [nop,nop,TS val 3346048648 ecr 842132792], length 400
07:58:15.080587 IP prabesha2026.ssh > 198.211.111.194.41568: Flags [P.], seq 1908513:1908737, ack 64, win 502, options [nop,nop,TS val 3346048649 ecr 842132792], length 224
07:58:15.080621 IP prabesha2026.ssh > 198.211.111.194.41568: Flags [P.], seq 1908737:1908801, ack 64, win 502, options [nop,nop,TS val 3346048649 ecr 842132792], length 64
07:58:15.080666 IP prabesha2026.ssh > 198.211.111.194.41568: Flags [P.], seq 1908801:1909025, ack 64, win 502, options [nop,nop,TS val 3346048649 ecr 842132792], length 224
07:58:15.080712 IP prabesha2026.ssh > 198.211.111.194.41568: Flags [P.], seq 1909025:1909249, ack 64, win 502, options [nop,nop,TS val 3346048649 ecr 842132792], length 224
07:58:15.080781 IP prabesha2026.ssh > 198.211.111.194.41568: Flags [P.], seq 1909249:1909473, ack 64, win 502, options [nop,nop,TS val 3346048649 ecr 842132792], length 224
07:58:15.080832 IP prabesha2026.ssh > 198.211.111.194.41568: Flags [P.], seq 1909473:1909713, ack 64, win 502, options [nop,nop,TS val 3346048649 ecr 842132792], length 240
07:58:15.080893 IP prabesha2026.ssh > 198.211.111.194.41568: Flags [P.], seq 1909713:1910113, ack 64, win 502, options [nop,nop,TS val 3346048649 ecr 842132792], length 400
07:58:15.080956 IP prabesha2026.ssh > 198.211.111.194.41568: Flags [P.], seq 1910113:1910513, ack 64, win 502, options [nop,nop,TS val 3346048649 ecr 842132792], length 400
07:58:15.081001 IP prabesha2026.ssh > 198.211.111.194.41568: Flags [P.], seq 1910513:1910737, ack 64, win 502, options [nop,nop,TS val 3346048649 ecr 842132792], length 224
07:58:15.081048 IP prabesha2026.ssh > 198.211.111.194.41568: Flags [P.], seq 1910737:1910961, ack 64, win 502, options [nop,nop,TS val 3346048649 ecr 842132792], length 224
07:58:15.081110 IP prabesha2026.ssh > 198.211.111.194.41568: Flags [P.], seq 1910961:1911361, ack 64, win 502, options [nop,nop,TS val 3346048649 ecr 842132792], length 400
07:58:15.081160 IP prabesha2026.ssh > 198.211.111.194.41568: Flags [P.], seq 1911361:1911585, ack 64, win 502, options [nop,nop,TS val 3346048649 ecr 842132792], length 224
07:58:15.081223 IP prabesha2026.ssh > 198.211.111.194.41568: Flags [P.], seq 1911585:1911985, ack 64, win 502, options [nop,nop,TS val 3346048649 ecr 842132792], length 400
07:58:15.081292 IP prabesha2026.ssh > 198.211.111.194.41568: Flags [P.], seq 1911985:1912225, ack 64, win 502, options [nop,nop,TS val 3346048649 ecr 842132792], length 240
07:58:15.081793 IP prabesha2026.41355 > 67.207.67.2.domain: 23053+ [1au] PTR? 233.1.219.13.in-addr.arpa. (54)
07:58:15.081879 IP prabesha2026.55069 > 67.207.67.2.domain: 2372+ [1au] PTR? 233.1.219.13.in-addr.arpa. (54)
07:58:15.081911 IP prabesha2026.49130 > 67.207.67.3.domain: Flags [P.], seq 91:136, ack 158, win 502, options [nop,nop,TS val 2661083957 ecr 2065104442], length 45 40395+ PTR? 233.1.219.13.in-addr.arpa. (43)
07:58:15.081970 IP prabesha2026.ssh > 198.211.111.194.41568: Flags [P.], seq 1912225:1912449, ack 64, win 502, options [nop,nop,TS val 3346048650 ecr 842132792], length 224
07:58:15.083102 IP 67.207.67.3.domain > prabesha2026.49130: Flags [.], ack 136, win 509, options [nop,nop,TS val 2065105136 ecr 2661083957], length 0
07:58:15.095449 IP 198.211.111.194.41568 > prabesha2026.ssh: Flags [.], ack 1906689, win 501, options [nop,nop,TS val 842132865 ecr 3346048648], length 0
07:58:15.095507 IP 198.211.111.194.41568 > prabesha2026.ssh: Flags [.], ack 1907313, win 501, options [nop,nop,TS val 842132865 ecr 3346048648], length 0
07:58:15.095638 IP 198.211.111.194.41568 > prabesha2026.ssh: Flags [.], ack 1908113, win 501, options [nop,nop,TS val 842132865 ecr 3346048648], length 0
07:58:15.095802 IP 198.211.111.194.41568 > prabesha2026.ssh: Flags [.], ack 1908737, win 501, options [nop,nop,TS val 842132865 ecr 3346048648], length 0
07:58:15.096000 IP 198.211.111.194.41568 > prabesha2026.ssh: Flags [.], ack 1909473, win 501, options [nop,nop,TS val 842132865 ecr 3346048649], length 0
07:58:15.096125 IP 198.211.111.194.41568 > prabesha2026.ssh: Flags [.], ack 1910113, win 501, options [nop,nop,TS val 842132866 ecr 3346048649], length 0
07:58:15.096258 IP 198.211.111.194.41568 > prabesha2026.ssh: Flags [.], ack 1910737, win 501, options [nop,nop,TS val 842132866 ecr 3346048649], length 0
07:58:15.096342 IP 198.211.111.194.41568 > prabesha2026.ssh: Flags [.], ack 1911361, win 501, options [nop,nop,TS val 842132866 ecr 3346048649], length 0
07:58:15.096469 IP 198.211.111.194.41568 > prabesha2026.ssh: Flags [.], ack 1911985, win 501, options [nop,nop,TS val 842132866 ecr 3346048649], length 0
07:58:15.114938 IP 67.207.67.2.domain > prabesha2026.55069: 2372 1/0/1 PTR ec2-13-219-1-233.compute-1.amazonaws.com. (108)
07:58:15.115438 IP prabesha2026.ssh > 198.211.111.194.41568: Flags [P.], seq 1912449:1912641, ack 64, win 502, options [nop,nop,TS val 3346048683 ecr 842132866], length 192
07:58:15.115453 IP 67.207.67.2.domain > prabesha2026.41355: 23053 1/0/1 PTR ec2-13-219-1-233.compute-1.amazonaws.com. (108)
07:58:15.115539 IP prabesha2026.ssh > 198.211.111.194.41568: Flags [P.], seq 1912641:1912705, ack 64, win 502, options [nop,nop,TS val 3346048683 ecr 842132866], length 64
07:58:15.115668 IP prabesha2026.ssh > 198.211.111.194.41568: Flags [P.], seq 1912705:1912897, ack 64, win 502, options [nop,nop,TS val 3346048684 ecr 842132866], length 192
07:58:15.115770 IP prabesha2026.ssh > 198.211.111.194.41568: Flags [P.], seq 1912897:1912961, ack 64, win 502, options [nop,nop,TS val 3346048684 ecr 842132866], length 64
07:58:15.115837 IP prabesha2026.ssh > 198.211.111.194.41568: Flags [P.], seq 1912961:1913169, ack 64, win 502, options [nop,nop,TS val 3346048684 ecr 842132866], length 208
07:58:15.115922 IP prabesha2026.ssh > 198.211.111.194.41568: Flags [P.], seq 1913169:1913233, ack 64, win 502, options [nop,nop,TS val 3346048684 ecr 842132866], length 64
07:58:15.116004 IP prabesha2026.ssh > 198.211.111.194.41568: Flags [P.], seq 1913233:1913601, ack 64, win 502, options [nop,nop,TS val 3346048684 ecr 842132866], length 368
07:58:15.116068 IP prabesha2026.ssh > 198.211.111.194.41568: Flags [P.], seq 1913601:1913809, ack 64, win 502, options [nop,nop,TS val 3346048684 ecr 842132866], length 208
07:58:15.116177 IP prabesha2026.ssh > 198.211.111.194.41568: Flags [P.], seq 1913809:1914337, ack 64, win 502, options [nop,nop,TS val 3346048684 ecr 842132866], length 528
07:58:15.116259 IP prabesha2026.ssh > 198.211.111.194.41568: Flags [P.], seq 1914337:1915009, ack 64, win 502, options [nop,nop,TS val 3346048684 ecr 842132866], length 672
07:58:15.116310 IP prabesha2026.ssh > 198.211.111.194.41568: Flags [P.], seq 1915009:1915377, ack 64, win 502, options [nop,nop,TS val 3346048684 ecr 842132866], length 368
07:58:15.116358 IP prabesha2026.ssh > 198.211.111.194.41568: Flags [P.], seq 1915377:1915585, ack 64, win 502, options [nop,nop,TS val 3346048684 ecr 842132866], length 208
07:58:15.117028 IP 67.207.67.3.domain > prabesha2026.49130: Flags [P.], seq 158:257, ack 136, win 509, options [nop,nop,TS val 2065105170 ecr 2661083957], length 99 40395 1/0/0 PTR ec2-13-219-1-233.compute-1.amazonaws.com. (97)
07:58:15.117055 IP prabesha2026.49130 > 67.207.67.3.domain: Flags [.], ack 257, win 502, options [nop,nop,TS val 2661083992 ecr 2065105170], length 0
07:58:15.130732 IP 198.211.111.194.41568 > prabesha2026.ssh: Flags [.], ack 1912641, win 501, options [nop,nop,TS val 842132900 ecr 3346048649], length 0
07:58:15.131166 IP 198.211.111.194.41568 > prabesha2026.ssh: Flags [.], ack 1913233, win 501, options [nop,nop,TS val 842132901 ecr 3346048683], length 0
07:58:15.131381 IP 198.211.111.194.41568 > prabesha2026.ssh: Flags [.], ack 1914337, win 501, options [nop,nop,TS val 842132901 ecr 3346048684], length 0
07:58:15.131493 IP 198.211.111.194.41568 > prabesha2026.ssh: Flags [.], ack 1915377, win 501, options [nop,nop,TS val 842132901 ecr 3346048684], length 0
07:58:15.152527 IP 198.211.111.194.41568 > prabesha2026.ssh: Flags [.], ack 1915585, win 501, options [nop,nop,TS val 842132922 ecr 3346048684], length 0
07:58:15.183904 IP prabesha2026.ssh > 198.211.111.194.41568: Flags [P.], seq 1915585:1915809, ack 64, win 502, options [nop,nop,TS val 3346048752 ecr 842132922], length 224
07:58:15.183964 IP prabesha2026.ssh > 198.211.111.194.41568: Flags [P.], seq 1915809:1915873, ack 64, win 502, options [nop,nop,TS val 3346048752 ecr 842132922], length 64
07:58:15.184019 IP prabesha2026.ssh > 198.211.111.194.41568: Flags [P.], seq 1915873:1916097, ack 64, win 502, options [nop,nop,TS val 3346048752 ecr 842132922], length 224
07:58:15.184080 IP prabesha2026.ssh > 198.211.111.194.41568: Flags [P.], seq 1916097:1916161, ack 64, win 502, options [nop,nop,TS val 3346048752 ecr 842132922], length 64
07:58:15.184132 IP prabesha2026.ssh > 198.211.111.194.41568: Flags [P.], seq 1916161:1916385, ack 64, win 502, options [nop,nop,TS val 3346048752 ecr 842132922], length 224
07:58:15.184182 IP prabesha2026.ssh > 198.211.111.194.41568: Flags [P.], seq 1916385:1916609, ack 64, win 502, options [nop,nop,TS val 3346048752 ecr 842132922], length 224
07:58:15.184231 IP prabesha2026.ssh > 198.211.111.194.41568: Flags [P.], seq 1916609:1916849, ack 64, win 502, options [nop,nop,TS val 3346048752 ecr 842132922], length 240
07:58:15.184293 IP prabesha2026.ssh > 198.211.111.194.41568: Flags [P.], seq 1916849:1917249, ack 64, win 502, options [nop,nop,TS val 3346048752 ecr 842132922], length 400
07:58:15.184342 IP prabesha2026.ssh > 198.211.111.194.41568: Flags [P.], seq 1917249:1917489, ack 64, win 502, options [nop,nop,TS val 3346048752 ecr 842132922], length 240
07:58:15.184412 IP prabesha2026.ssh > 198.211.111.194.41568: Flags [P.], seq 1917489:1917713, ack 64, win 502, options [nop,nop,TS val 3346048752 ecr 842132922], length 224
07:58:15.184460 IP prabesha2026.ssh > 198.211.111.194.41568: Flags [P.], seq 1917713:1917937, ack 64, win 502, options [nop,nop,TS val 3346048752 ecr 842132922], length 224
07:58:15.184505 IP prabesha2026.ssh > 198.211.111.194.41568: Flags [P.], seq 1917937:1918161, ack 64, win 502, options [nop,nop,TS val 3346048752 ecr 842132922], length 224
07:58:15.184568 IP prabesha2026.ssh > 198.211.111.194.41568: Flags [P.], seq 1918161:1918561, ack 64, win 502, options [nop,nop,TS val 3346048752 ecr 842132922], length 400
07:58:15.184616 IP prabesha2026.ssh > 198.211.111.194.41568: Flags [P.], seq 1918561:1918801, ack 64, win 502, options [nop,nop,TS val 3346048753 ecr 842132922], length 240
07:58:15.184676 IP prabesha2026.ssh > 198.211.111.194.41568: Flags [P.], seq 1918801:1919201, ack 64, win 502, options [nop,nop,TS val 3346048753 ecr 842132922], length 400
07:58:15.184736 IP prabesha2026.ssh > 198.211.111.194.41568: Flags [P.], seq 1919201:1919425, ack 64, win 502, options [nop,nop,TS val 3346048753 ecr 842132922], length 224
07:58:15.184850 IP prabesha2026.ssh > 198.211.111.194.41568: Flags [P.], seq 1919425:1919825, ack 64, win 502, options [nop,nop,TS val 3346048753 ecr 842132922], length 400
07:58:15.184960 IP prabesha2026.ssh > 198.211.111.194.41568: Flags [P.], seq 1919825:1920337, ack 64, win 502, options [nop,nop,TS val 3346048753 ecr 842132922], length 512
07:58:15.185012 IP prabesha2026.ssh > 198.211.111.194.41568: Flags [P.], seq 1920337:1920497, ack 64, win 502, options [nop,nop,TS val 3346048753 ecr 842132922], length 160
07:58:15.185066 IP prabesha2026.ssh > 198.211.111.194.41568: Flags [P.], seq 1920497:1920769, ack 64, win 502, options [nop,nop,TS val 3346048753 ecr 842132922], length 272
07:58:15.185130 IP prabesha2026.ssh > 198.211.111.194.41568: Flags [P.], seq 1920769:1921153, ack 64, win 502, options [nop,nop,TS val 3346048753 ecr 842132922], length 384
07:58:15.185193 IP prabesha2026.ssh > 198.211.111.194.41568: Flags [P.], seq 1921153:1921521, ack 64, win 502, options [nop,nop,TS val 3346048753 ecr 842132922], length 368
07:58:15.185238 IP prabesha2026.ssh > 198.211.111.194.41568: Flags [P.], seq 1921521:1921729, ack 64, win 502, options [nop,nop,TS val 3346048753 ecr 842132922], length 208
07:58:15.185300 IP prabesha2026.ssh > 198.211.111.194.41568: Flags [P.], seq 1921729:1922097, ack 64, win 502, options [nop,nop,TS val 3346048753 ecr 842132922], length 368
07:58:15.185348 IP prabesha2026.ssh > 198.211.111.194.41568: Flags [P.], seq 1922097:1922305, ack 64, win 502, options [nop,nop,TS val 3346048753 ecr 842132922], length 208
07:58:15.185406 IP prabesha2026.ssh > 198.211.111.194.41568: Flags [P.], seq 1922305:1922673, ack 64, win 502, options [nop,nop,TS val 3346048753 ecr 842132922], length 368
07:58:15.185472 IP prabesha2026.ssh > 198.211.111.194.41568: Flags [P.], seq 1922673:1923009, ack 64, win 502, options [nop,nop,TS val 3346048753 ecr 842132922], length 336
07:58:15.185535 IP prabesha2026.ssh > 198.211.111.194.41568: Flags [P.], seq 1923009:1923233, ack 64, win 502, options [nop,nop,TS val 3346048753 ecr 842132922], length 224
07:58:15.185603 IP prabesha2026.ssh > 198.211.111.194.41568: Flags [P.], seq 1923233:1923409, ack 64, win 502, options [nop,nop,TS val 3346048754 ecr 842132922], length 176
07:58:15.185683 IP prabesha2026.ssh > 198.211.111.194.41568: Flags [P.], seq 1923409:1923809, ack 64, win 502, options [nop,nop,TS val 3346048754 ecr 842132922], length 400
07:58:15.185765 IP prabesha2026.ssh > 198.211.111.194.41568: Flags [P.], seq 1923809:1924209, ack 64, win 502, options [nop,nop,TS val 3346048754 ecr 842132922], length 400
07:58:15.185852 IP prabesha2026.ssh > 198.211.111.194.41568: Flags [P.], seq 1924209:1924609, ack 64, win 502, options [nop,nop,TS val 3346048754 ecr 842132922], length 400
07:58:15.185938 IP prabesha2026.ssh > 198.211.111.194.41568: Flags [P.], seq 1924609:1925009, ack 64, win 502, options [nop,nop,TS val 3346048754 ecr 842132922], length 400
07:58:15.186104 IP prabesha2026.ssh > 198.211.111.194.41568: Flags [P.], seq 1925009:1925409, ack 64, win 502, options [nop,nop,TS val 3346048754 ecr 842132922], length 400
07:58:15.186125 IP prabesha2026.ssh > 198.211.111.194.41568: Flags [P.], seq 1925409:1925873, ack 64, win 502, options [nop,nop,TS val 3346048754 ecr 842132922], length 464
07:58:15.186207 IP prabesha2026.ssh > 198.211.111.194.41568: Flags [P.], seq 1925873:1926241, ack 64, win 502, options [nop,nop,TS val 3346048754 ecr 842132922], length 368
07:58:15.186276 IP prabesha2026.ssh > 198.211.111.194.41568: Flags [P.], seq 1926241:1926609, ack 64, win 502, options [nop,nop,TS val 3346048754 ecr 842132922], length 368
07:58:15.186344 IP prabesha2026.ssh > 198.211.111.194.41568: Flags [P.], seq 1926609:1926977, ack 64, win 502, options [nop,nop,TS val 3346048754 ecr 842132922], length 368
07:58:15.186381 IP prabesha2026.ssh > 198.211.111.194.41568: Flags [P.], seq 1926977:1927041, ack 64, win 502, options [nop,nop,TS val 3346048754 ecr 842132922], length 64
07:58:15.199423 IP 198.211.111.194.41568 > prabesha2026.ssh: Flags [.], ack 1916385, win 501, options [nop,nop,TS val 842132969 ecr 3346048752], length 0
07:58:15.199550 IP 198.211.111.194.41568 > prabesha2026.ssh: Flags [.], ack 1917249, win 501, options [nop,nop,TS val 842132969 ecr 3346048752], length 0
07:58:15.199714 IP 198.211.111.194.41568 > prabesha2026.ssh: Flags [.], ack 1917937, win 501, options [nop,nop,TS val 842132969 ecr 3346048752], length 0
07:58:15.199802 IP 198.211.111.194.41568 > prabesha2026.ssh: Flags [.], ack 1918801, win 501, options [nop,nop,TS val 842132969 ecr 3346048752], length 0
07:58:15.200085 IP 198.211.111.194.41568 > prabesha2026.ssh: Flags [.], ack 1919825, win 501, options [nop,nop,TS val 842132970 ecr 3346048753], length 0
07:58:15.200244 IP 198.211.111.194.41568 > prabesha2026.ssh: Flags [.], ack 1920769, win 501, options [nop,nop,TS val 842132970 ecr 3346048753], length 0
07:58:15.200400 IP 198.211.111.194.41568 > prabesha2026.ssh: Flags [.], ack 1921521, win 501, options [nop,nop,TS val 842132970 ecr 3346048753], length 0
07:58:15.200652 IP 198.211.111.194.41568 > prabesha2026.ssh: Flags [.], ack 1922305, win 501, options [nop,nop,TS val 842132970 ecr 3346048753], length 0
07:58:15.200686 IP 198.211.111.194.41568 > prabesha2026.ssh: Flags [.], ack 1923009, win 501, options [nop,nop,TS val 842132970 ecr 3346048753], length 0
07:58:15.200927 IP 198.211.111.194.41568 > prabesha2026.ssh: Flags [.], ack 1923809, win 501, options [nop,nop,TS val 842132970 ecr 3346048753], length 0
07:58:15.201039 IP 198.211.111.194.41568 > prabesha2026.ssh: Flags [.], ack 1924609, win 501, options [nop,nop,TS val 842132970 ecr 3346048754], length 0
07:58:15.201321 IP 198.211.111.194.41568 > prabesha2026.ssh: Flags [.], ack 1925409, win 501, options [nop,nop,TS val 842132971 ecr 3346048754], length 0
07:58:15.201403 IP 198.211.111.194.41568 > prabesha2026.ssh: Flags [.], ack 1926241, win 501, options [nop,nop,TS val 842132971 ecr 3346048754], length 0
07:58:15.201911 IP 198.211.111.194.41568 > prabesha2026.ssh: Flags [.], ack 1926977, win 496, options [nop,nop,TS val 842132971 ecr 3346048754], length 0
07:58:15.244091 IP 198.211.111.194.41568 > prabesha2026.ssh: Flags [.], ack 1927041, win 496, options [nop,nop,TS val 842133013 ecr 3346048754], length 0
07:58:15.287923 IP prabesha2026.ssh > 198.211.111.194.41568: Flags [P.], seq 1927041:1927265, ack 64, win 502, options [nop,nop,TS val 3346048856 ecr 842133013], length 224
07:58:15.287980 IP prabesha2026.ssh > 198.211.111.194.41568: Flags [P.], seq 1927265:1927329, ack 64, win 502, options [nop,nop,TS val 3346048856 ecr 842133013], length 64
07:58:15.288038 IP prabesha2026.ssh > 198.211.111.194.41568: Flags [P.], seq 1927329:1927553, ack 64, win 502, options [nop,nop,TS val 3346048856 ecr 842133013], length 224
07:58:15.288088 IP prabesha2026.ssh > 198.211.111.194.41568: Flags [P.], seq 1927553:1927777, ack 64, win 502, options [nop,nop,TS val 3346048856 ecr 842133013], length 224
07:58:15.288155 IP prabesha2026.ssh > 198.211.111.194.41568: Flags [P.], seq 1927777:1928177, ack 64, win 502, options [nop,nop,TS val 3346048856 ecr 842133013], length 400
07:58:15.288202 IP prabesha2026.ssh > 198.211.111.194.41568: Flags [P.], seq 1928177:1928401, ack 64, win 502, options [nop,nop,TS val 3346048856 ecr 842133013], length 224
07:58:15.288266 IP prabesha2026.ssh > 198.211.111.194.41568: Flags [P.], seq 1928401:1928801, ack 64, win 502, options [nop,nop,TS val 3346048856 ecr 842133013], length 400
07:58:15.288312 IP prabesha2026.ssh > 198.211.111.194.41568: Flags [P.], seq 1928801:1929025, ack 64, win 502, options [nop,nop,TS val 3346048856 ecr 842133013], length 224
07:58:15.288378 IP prabesha2026.ssh > 198.211.111.194.41568: Flags [P.], seq 1929025:1929425, ack 64, win 502, options [nop,nop,TS val 3346048856 ecr 842133013], length 400
07:58:15.288442 IP prabesha2026.ssh > 198.211.111.194.41568: Flags [P.], seq 1929425:1929825, ack 64, win 502, options [nop,nop,TS val 3346048856 ecr 842133013], length 400
07:58:15.288502 IP prabesha2026.ssh > 198.211.111.194.41568: Flags [P.], seq 1929825:1930049, ack 64, win 502, options [nop,nop,TS val 3346048856 ecr 842133013], length 224
07:58:15.288574 IP prabesha2026.ssh > 198.211.111.194.41568: Flags [P.], seq 1930049:1930449, ack 64, win 502, options [nop,nop,TS val 3346048857 ecr 842133013], length 400
07:58:15.288622 IP prabesha2026.ssh > 198.211.111.194.41568: Flags [P.], seq 1930449:1930673, ack 64, win 502, options [nop,nop,TS val 3346048857 ecr 842133013], length 224
07:58:15.288686 IP prabesha2026.ssh > 198.211.111.194.41568: Flags [P.], seq 1930673:1931073, ack 64, win 502, options [nop,nop,TS val 3346048857 ecr 842133013], length 400
07:58:15.288736 IP prabesha2026.ssh > 198.211.111.194.41568: Flags [P.], seq 1931073:1931297, ack 64, win 502, options [nop,nop,TS val 3346048857 ecr 842133013], length 224
07:58:15.288799 IP prabesha2026.ssh > 198.211.111.194.41568: Flags [P.], seq 1931297:1931697, ack 64, win 502, options [nop,nop,TS val 3346048857 ecr 842133013], length 400
07:58:15.288846 IP prabesha2026.ssh > 198.211.111.194.41568: Flags [P.], seq 1931697:1931921, ack 64, win 502, options [nop,nop,TS val 3346048857 ecr 842133013], length 224
07:58:15.288918 IP prabesha2026.ssh > 198.211.111.194.41568: Flags [P.], seq 1931921:1932321, ack 64, win 502, options [nop,nop,TS val 3346048857 ecr 842133013], length 400
07:58:15.288984 IP prabesha2026.ssh > 198.211.111.194.41568: Flags [P.], seq 1932321:1932721, ack 64, win 502, options [nop,nop,TS val 3346048857 ecr 842133013], length 400
07:58:15.289030 IP prabesha2026.ssh > 198.211.111.194.41568: Flags [P.], seq 1932721:1932945, ack 64, win 502, options [nop,nop,TS val 3346048857 ecr 842133013], length 224
07:58:15.289111 IP prabesha2026.ssh > 198.211.111.194.41568: Flags [P.], seq 1932945:1933345, ack 64, win 502, options [nop,nop,TS val 3346048857 ecr 842133013], length 400
07:58:15.289177 IP prabesha2026.ssh > 198.211.111.194.41568: Flags [P.], seq 1933345:1933745, ack 64, win 502, options [nop,nop,TS val 3346048857 ecr 842133013], length 400
07:58:15.289264 IP prabesha2026.ssh > 198.211.111.194.41568: Flags [P.], seq 1933745:1933969, ack 64, win 502, options [nop,nop,TS val 3346048857 ecr 842133013], length 224
07:58:15.289367 IP prabesha2026.ssh > 198.211.111.194.41568: Flags [P.], seq 1933969:1934545, ack 64, win 502, options [nop,nop,TS val 3346048857 ecr 842133013], length 576
07:58:15.289437 IP prabesha2026.ssh > 198.211.111.194.41568: Flags [P.], seq 1934545:1934945, ack 64, win 502, options [nop,nop,TS val 3346048857 ecr 842133013], length 400
07:58:15.289512 IP prabesha2026.ssh > 198.211.111.194.41568: Flags [P.], seq 1934945:1935329, ack 64, win 502, options [nop,nop,TS val 3346048857 ecr 842133013], length 384
07:58:15.289591 IP prabesha2026.ssh > 198.211.111.194.41568: Flags [P.], seq 1935329:1935697, ack 64, win 502, options [nop,nop,TS val 3346048858 ecr 842133013], length 368
07:58:15.289655 IP prabesha2026.ssh > 198.211.111.194.41568: Flags [P.], seq 1935697:1936065, ack 64, win 502, options [nop,nop,TS val 3346048858 ecr 842133013], length 368
07:58:15.289719 IP prabesha2026.ssh > 198.211.111.194.41568: Flags [P.], seq 1936065:1936433, ack 64, win 502, options [nop,nop,TS val 3346048858 ecr 842133013], length 368
07:58:15.289775 IP prabesha2026.ssh > 198.211.111.194.41568: Flags [P.], seq 1936433:1936641, ack 64, win 502, options [nop,nop,TS val 3346048858 ecr 842133013], length 208
07:58:15.289839 IP prabesha2026.ssh > 198.211.111.194.41568: Flags [P.], seq 1936641:1937009, ack 64, win 502, options [nop,nop,TS val 3346048858 ecr 842133013], length 368
07:58:15.289901 IP prabesha2026.ssh > 198.211.111.194.41568: Flags [P.], seq 1937009:1937377, ack 64, win 502, options [nop,nop,TS val 3346048858 ecr 842133013], length 368
07:58:15.289947 IP prabesha2026.ssh > 198.211.111.194.41568: Flags [P.], seq 1937377:1937585, ack 64, win 502, options [nop,nop,TS val 3346048858 ecr 842133013], length 208
07:58:15.290006 IP prabesha2026.ssh > 198.211.111.194.41568: Flags [P.], seq 1937585:1937953, ack 64, win 502, options [nop,nop,TS val 3346048858 ecr 842133013], length 368
07:58:15.290041 IP prabesha2026.ssh > 198.211.111.194.41568: Flags [P.], seq 1937953:1938017, ack 64, win 502, options [nop,nop,TS val 3346048858 ecr 842133013], length 64
07:58:15.303405 IP 198.211.111.194.41568 > prabesha2026.ssh: Flags [.], ack 1927777, win 501, options [nop,nop,TS val 842133073 ecr 3346048856], length 0
07:58:15.303493 IP 198.211.111.194.41568 > prabesha2026.ssh: Flags [.], ack 1928801, win 501, options [nop,nop,TS val 842133073 ecr 3346048856], length 0
07:58:15.303662 IP 198.211.111.194.41568 > prabesha2026.ssh: Flags [.], ack 1929825, win 501, options [nop,nop,TS val 842133073 ecr 3346048856], length 0
07:58:15.303828 IP 198.211.111.194.41568 > prabesha2026.ssh: Flags [.], ack 1930673, win 501, options [nop,nop,TS val 842133073 ecr 3346048856], length 0
07:58:15.304118 IP 198.211.111.194.41568 > prabesha2026.ssh: Flags [.], ack 1931697, win 501, options [nop,nop,TS val 842133074 ecr 3346048857], length 0
07:58:15.304201 IP 198.211.111.194.41568 > prabesha2026.ssh: Flags [.], ack 1932721, win 501, options [nop,nop,TS val 842133074 ecr 3346048857], length 0
07:58:15.304387 IP 198.211.111.194.41568 > prabesha2026.ssh: Flags [.], ack 1933745, win 501, options [nop,nop,TS val 842133074 ecr 3346048857], length 0
07:58:15.304626 IP 198.211.111.194.41568 > prabesha2026.ssh: Flags [.], ack 1934545, win 501, options [nop,nop,TS val 842133074 ecr 3346048857], length 0
07:58:15.304720 IP 198.211.111.194.41568 > prabesha2026.ssh: Flags [.], ack 1935329, win 501, options [nop,nop,TS val 842133074 ecr 3346048857], length 0
07:58:15.304870 IP 198.211.111.194.41568 > prabesha2026.ssh: Flags [.], ack 1936065, win 501, options [nop,nop,TS val 842133074 ecr 3346048858], length 0
07:58:15.305052 IP 198.211.111.194.41568 > prabesha2026.ssh: Flags [.], ack 1937009, win 501, options [nop,nop,TS val 842133074 ecr 3346048858], length 0
07:58:15.305268 IP 198.211.111.194.41568 > prabesha2026.ssh: Flags [.], ack 1938017, win 494, options [nop,nop,TS val 842133075 ecr 3346048858], length 0
^C^C^C07:58:15.306109 IP 81.90.31.198.53398 > prabesha2026.ssh: Flags [S], seq 4136246673, win 64240, options [mss 1460,sackOK,TS val 3653834985 ecr 0,nop,wscale 7], length 0

9337 packets captured
9474 packets received by filter
23 packets dropped by kernel