tcpdump -i eth0 tcp


root@prabesha2026:~# tcpdump -i eth0 tcp
tcpdump: verbose output suppressed, use -v[v]... for full protocol decode
listening on eth0, link-type EN10MB (Ethernet), snapshot length 262144 bytes
08:10:42.252183 IP prabesha2026.ssh > 198.211.111.194.41568: Flags [P.], seq 3388362225:3388362353, ack 2216297784, win 502, options [nop,nop,TS val 3346795820 ecr 842880012], length 128
08:10:42.252278 IP prabesha2026.ssh > 198.211.111.194.41568: Flags [P.], seq 128:272, ack 1, win 502, options [nop,nop,TS val 3346795820 ecr 842880012], length 144
08:10:42.252337 IP prabesha2026.ssh > 198.211.111.194.41568: Flags [P.], seq 272:352, ack 1, win 502, options [nop,nop,TS val 3346795820 ecr 842880012], length 80
08:10:42.252377 IP prabesha2026.ssh > 198.211.111.194.41568: Flags [P.], seq 352:432, ack 1, win 502, options [nop,nop,TS val 3346795820 ecr 842880012], length 80
08:10:42.252419 IP prabesha2026.ssh > 198.211.111.194.41568: Flags [P.], seq 432:496, ack 1, win 502, options [nop,nop,TS val 3346795820 ecr 842880012], length 64
08:10:42.264497 IP 198.211.111.194.41568 > prabesha2026.ssh: Flags [.], ack 0, win 4386, options [nop,nop,TS val 842880033 ecr 3346795817], length 0
08:10:42.267572 IP 198.211.111.194.41568 > prabesha2026.ssh: Flags [.], ack 128, win 4386, options [nop,nop,TS val 842880036 ecr 3346795820], length 0
08:10:42.267572 IP 198.211.111.194.41568 > prabesha2026.ssh: Flags [.], ack 272, win 4386, options [nop,nop,TS val 842880036 ecr 3346795820], length 0
08:10:42.267572 IP 198.211.111.194.41568 > prabesha2026.ssh: Flags [.], ack 352, win 4386, options [nop,nop,TS val 842880036 ecr 3346795820], length 0
08:10:42.267639 IP 198.211.111.194.41568 > prabesha2026.ssh: Flags [.], ack 432, win 4386, options [nop,nop,TS val 842880037 ecr 3346795820], length 0
08:10:42.267639 IP 198.211.111.194.41568 > prabesha2026.ssh: Flags [.], ack 496, win 4386, options [nop,nop,TS val 842880037 ecr 3346795820], length 0
08:10:42.352737 IP prabesha2026.38874 > 67.207.67.3.domain: Flags [S], seq 2951389746, win 64240, options [mss 1460,sackOK,TS val 2661831228 ecr 0,nop,wscale 7,tfo  cookiereq,nop,nop], length 0
08:10:42.356709 IP 67.207.67.3.domain > prabesha2026.38874: Flags [S.], seq 314978769, ack 2951389747, win 65160, options [mss 1460,sackOK,TS val 4181928012 ecr 2661831228,nop,wscale 10], length 0
08:10:42.356762 IP prabesha2026.38874 > 67.207.67.3.domain: Flags [.], ack 1, win 502, options [nop,nop,TS val 2661831232 ecr 4181928012], length 0
08:10:42.356801 IP prabesha2026.38874 > 67.207.67.3.domain: Flags [P.], seq 1:49, ack 1, win 502, options [nop,nop,TS val 2661831232 ecr 4181928012], length 48 43518+ PTR? 194.111.211.198.in-addr.arpa. (46)
08:10:42.358068 IP 67.207.67.3.domain > prabesha2026.38874: Flags [.], ack 49, win 64, options [nop,nop,TS val 4181928014 ecr 2661831232], length 0
08:10:42.358122 IP 67.207.67.3.domain > prabesha2026.38874: Flags [P.], seq 1:116, ack 49, win 64, options [nop,nop,TS val 4181928015 ecr 2661831232], length 115 43518 NXDomain 0/1/0 (113)
08:10:42.358139 IP prabesha2026.38874 > 67.207.67.3.domain: Flags [.], ack 116, win 502, options [nop,nop,TS val 2661831233 ecr 4181928015], length 0
08:10:42.362125 IP prabesha2026.ssh > 198.211.111.194.41568: Flags [P.], seq 496:736, ack 1, win 502, options [nop,nop,TS val 3346795930 ecr 842880037], length 240
08:10:42.362209 IP prabesha2026.ssh > 198.211.111.194.41568: Flags [P.], seq 736:800, ack 1, win 502, options [nop,nop,TS val 3346795930 ecr 842880037], length 64
08:10:42.362331 IP prabesha2026.ssh > 198.211.111.194.41568: Flags [P.], seq 800:1024, ack 1, win 502, options [nop,nop,TS val 3346795930 ecr 842880037], length 224
08:10:42.362378 IP prabesha2026.ssh > 198.211.111.194.41568: Flags [P.], seq 1024:1088, ack 1, win 502, options [nop,nop,TS val 3346795930 ecr 842880037], length 64
08:10:42.362442 IP prabesha2026.ssh > 198.211.111.194.41568: Flags [P.], seq 1088:1312, ack 1, win 502, options [nop,nop,TS val 3346795930 ecr 842880037], length 224
08:10:42.362516 IP prabesha2026.ssh > 198.211.111.194.41568: Flags [P.], seq 1312:1376, ack 1, win 502, options [nop,nop,TS val 3346795930 ecr 842880037], length 64
08:10:42.362526 IP prabesha2026.ssh > 198.211.111.194.41568: Flags [P.], seq 1376:1600, ack 1, win 502, options [nop,nop,TS val 3346795930 ecr 842880037], length 224
08:10:42.362559 IP prabesha2026.ssh > 198.211.111.194.41568: Flags [P.], seq 1600:1664, ack 1, win 502, options [nop,nop,TS val 3346795930 ecr 842880037], length 64
08:10:42.362617 IP prabesha2026.ssh > 198.211.111.194.41568: Flags [P.], seq 1664:1888, ack 1, win 502, options [nop,nop,TS val 3346795931 ecr 842880037], length 224
08:10:42.362660 IP prabesha2026.ssh > 198.211.111.194.41568: Flags [P.], seq 1888:1952, ack 1, win 502, options [nop,nop,TS val 3346795931 ecr 842880037], length 64
08:10:42.362730 IP prabesha2026.ssh > 198.211.111.194.41568: Flags [P.], seq 1952:2160, ack 1, win 502, options [nop,nop,TS val 3346795931 ecr 842880037], length 208
08:10:42.362769 IP prabesha2026.ssh > 198.211.111.194.41568: Flags [P.], seq 2160:2224, ack 1, win 502, options [nop,nop,TS val 3346795931 ecr 842880037], length 64
08:10:42.377478 IP 198.211.111.194.41568 > prabesha2026.ssh: Flags [.], ack 736, win 4386, options [nop,nop,TS val 842880146 ecr 3346795930], length 0
08:10:42.377479 IP 198.211.111.194.41568 > prabesha2026.ssh: Flags [.], ack 800, win 4386, options [nop,nop,TS val 842880146 ecr 3346795930], length 0
08:10:42.377553 IP prabesha2026.ssh > 198.211.111.194.41568: Flags [P.], seq 2224:3584, ack 1, win 502, options [nop,nop,TS val 3346795945 ecr 842880146], length 1360
08:10:42.377576 IP 198.211.111.194.41568 > prabesha2026.ssh: Flags [.], ack 1024, win 4386, options [nop,nop,TS val 842880146 ecr 3346795930], length 0
08:10:42.377577 IP 198.211.111.194.41568 > prabesha2026.ssh: Flags [.], ack 1088, win 4386, options [nop,nop,TS val 842880147 ecr 3346795930], length 0
08:10:42.377684 IP 198.211.111.194.41568 > prabesha2026.ssh: Flags [.], ack 1312, win 4386, options [nop,nop,TS val 842880147 ecr 3346795930], length 0
08:10:42.377704 IP 198.211.111.194.41568 > prabesha2026.ssh: Flags [.], ack 1376, win 4386, options [nop,nop,TS val 842880147 ecr 3346795930], length 0
08:10:42.377716 IP 198.211.111.194.41568 > prabesha2026.ssh: Flags [.], ack 1600, win 4386, options [nop,nop,TS val 842880147 ecr 3346795930], length 0
08:10:42.377754 IP 198.211.111.194.41568 > prabesha2026.ssh: Flags [.], ack 1664, win 4386, options [nop,nop,TS val 842880147 ecr 3346795930], length 0
08:10:42.377775 IP 198.211.111.194.41568 > prabesha2026.ssh: Flags [.], ack 1888, win 4386, options [nop,nop,TS val 842880147 ecr 3346795931], length 0
08:10:42.377847 IP 198.211.111.194.41568 > prabesha2026.ssh: Flags [.], ack 1952, win 4386, options [nop,nop,TS val 842880147 ecr 3346795931], length 0
08:10:42.386207 IP 198.211.111.194.41568 > prabesha2026.ssh: Flags [.], ack 2224, win 4386, options [nop,nop,TS val 842880155 ecr 3346795931], length 0
08:10:42.400244 IP 198.211.111.194.41568 > prabesha2026.ssh: Flags [.], ack 3584, win 4386, options [nop,nop,TS val 842880169 ecr 3346795945], length 0
08:10:42.456435 IP prabesha2026.38874 > 67.207.67.3.domain: Flags [P.], seq 49:93, ack 116, win 502, options [nop,nop,TS val 2661831331 ecr 4181928015], length 44 9814+ PTR? 3.67.207.67.in-addr.arpa. (42)
08:10:42.457673 IP 67.207.67.3.domain > prabesha2026.38874: Flags [P.], seq 116:227, ack 93, win 64, options [nop,nop,TS val 4181928114 ecr 2661831331], length 111 9814 NXDomain 0/1/0 (109)
08:10:42.457722 IP prabesha2026.38874 > 67.207.67.3.domain: Flags [.], ack 227, win 502, options [nop,nop,TS val 2661831333 ecr 4181928114], length 0
08:10:42.478224 IP prabesha2026.ssh > 198.211.111.194.41568: Flags [P.], seq 3584:3840, ack 1, win 502, options [nop,nop,TS val 3346796046 ecr 842880169], length 256
08:10:42.478294 IP prabesha2026.ssh > 198.211.111.194.41568: Flags [P.], seq 3840:3904, ack 1, win 502, options [nop,nop,TS val 3346796046 ecr 842880169], length 64
08:10:42.478391 IP prabesha2026.ssh > 198.211.111.194.41568: Flags [P.], seq 3904:4160, ack 1, win 502, options [nop,nop,TS val 3346796046 ecr 842880169], length 256
08:10:42.478420 IP prabesha2026.ssh > 198.211.111.194.41568: Flags [P.], seq 4160:4224, ack 1, win 502, options [nop,nop,TS val 3346796046 ecr 842880169], length 64
08:10:42.478466 IP prabesha2026.ssh > 198.211.111.194.41568: Flags [P.], seq 4224:4432, ack 1, win 502, options [nop,nop,TS val 3346796046 ecr 842880169], length 208
08:10:42.478493 IP prabesha2026.ssh > 198.211.111.194.41568: Flags [P.], seq 4432:4496, ack 1, win 502, options [nop,nop,TS val 3346796046 ecr 842880169], length 64
08:10:42.478553 IP prabesha2026.ssh > 198.211.111.194.41568: Flags [P.], seq 4496:4752, ack 1, win 502, options [nop,nop,TS val 3346796046 ecr 842880169], length 256
08:10:42.478583 IP prabesha2026.ssh > 198.211.111.194.41568: Flags [P.], seq 4752:4816, ack 1, win 502, options [nop,nop,TS val 3346796047 ecr 842880169], length 64
08:10:42.478636 IP prabesha2026.ssh > 198.211.111.194.41568: Flags [P.], seq 4816:5024, ack 1, win 502, options [nop,nop,TS val 3346796047 ecr 842880169], length 208
08:10:42.478667 IP prabesha2026.ssh > 198.211.111.194.41568: Flags [P.], seq 5024:5088, ack 1, win 502, options [nop,nop,TS val 3346796047 ecr 842880169], length 64
08:10:42.478716 IP prabesha2026.ssh > 198.211.111.194.41568: Flags [P.], seq 5088:5328, ack 1, win 502, options [nop,nop,TS val 3346796047 ecr 842880169], length 240
08:10:42.478747 IP prabesha2026.ssh > 198.211.111.194.41568: Flags [P.], seq 5328:5392, ack 1, win 502, options [nop,nop,TS val 3346796047 ecr 842880169], length 64
08:10:42.478788 IP prabesha2026.ssh > 198.211.111.194.41568: Flags [P.], seq 5392:5600, ack 1, win 502, options [nop,nop,TS val 3346796047 ecr 842880169], length 208
08:10:42.478835 IP prabesha2026.ssh > 198.211.111.194.41568: Flags [P.], seq 5600:5664, ack 1, win 502, options [nop,nop,TS val 3346796047 ecr 842880169], length 64
08:10:42.478855 IP prabesha2026.ssh > 198.211.111.194.41568: Flags [P.], seq 5664:5888, ack 1, win 502, options [nop,nop,TS val 3346796047 ecr 842880169], length 224
08:10:42.478885 IP prabesha2026.ssh > 198.211.111.194.41568: Flags [P.], seq 5888:5952, ack 1, win 502, options [nop,nop,TS val 3346796047 ecr 842880169], length 64
08:10:42.478932 IP prabesha2026.ssh > 198.211.111.194.41568: Flags [P.], seq 5952:6176, ack 1, win 502, options [nop,nop,TS val 3346796047 ecr 842880169], length 224
08:10:42.478962 IP prabesha2026.ssh > 198.211.111.194.41568: Flags [P.], seq 6176:6240, ack 1, win 502, options [nop,nop,TS val 3346796047 ecr 842880169], length 64
08:10:42.479019 IP prabesha2026.ssh > 198.211.111.194.41568: Flags [P.], seq 6240:6464, ack 1, win 502, options [nop,nop,TS val 3346796047 ecr 842880169], length 224
08:10:42.479059 IP prabesha2026.ssh > 198.211.111.194.41568: Flags [P.], seq 6464:6528, ack 1, win 502, options [nop,nop,TS val 3346796047 ecr 842880169], length 64
08:10:42.479106 IP prabesha2026.ssh > 198.211.111.194.41568: Flags [P.], seq 6528:6752, ack 1, win 502, options [nop,nop,TS val 3346796047 ecr 842880169], length 224
08:10:42.479136 IP prabesha2026.ssh > 198.211.111.194.41568: Flags [P.], seq 6752:6816, ack 1, win 502, options [nop,nop,TS val 3346796047 ecr 842880169], length 64
08:10:42.479181 IP prabesha2026.ssh > 198.211.111.194.41568: Flags [P.], seq 6816:7040, ack 1, win 502, options [nop,nop,TS val 3346796047 ecr 842880169], length 224
08:10:42.479211 IP prabesha2026.ssh > 198.211.111.194.41568: Flags [P.], seq 7040:7104, ack 1, win 502, options [nop,nop,TS val 3346796047 ecr 842880169], length 64
08:10:42.479257 IP prabesha2026.ssh > 198.211.111.194.41568: Flags [P.], seq 7104:7328, ack 1, win 502, options [nop,nop,TS val 3346796047 ecr 842880169], length 224
08:10:42.493942 IP 198.211.111.194.41568 > prabesha2026.ssh: Flags [.], ack 5088, win 4378, options [nop,nop,TS val 842880263 ecr 3346796046], length 0
08:10:42.494008 IP prabesha2026.ssh > 198.211.111.194.41568: Flags [P.], seq 7328:11672, ack 1, win 502, options [nop,nop,TS val 3346796062 ecr 842880263], length 4344
08:10:42.494023 IP prabesha2026.ssh > 198.211.111.194.41568: Flags [P.], seq 11672:12672, ack 1, win 502, options [nop,nop,TS val 3346796062 ecr 842880263], length 1000
08:10:42.494334 IP 198.211.111.194.41568 > prabesha2026.ssh: Flags [.], ack 6752, win 4365, options [nop,nop,TS val 842880263 ecr 3346796047], length 0
08:10:42.509327 IP 198.211.111.194.41568 > prabesha2026.ssh: Flags [.], ack 8776, win 4350, options [nop,nop,TS val 842880278 ecr 3346796047], length 0
08:10:42.509327 IP 198.211.111.194.41568 > prabesha2026.ssh: Flags [.], ack 12672, win 4320, options [nop,nop,TS val 842880278 ecr 3346796062], length 0
08:10:42.559877 IP prabesha2026.ssh > 198.211.111.194.41568: Flags [P.], seq 12672:12928, ack 1, win 502, options [nop,nop,TS val 3346796128 ecr 842880278], length 256
08:10:42.559966 IP prabesha2026.ssh > 198.211.111.194.41568: Flags [P.], seq 12928:12992, ack 1, win 502, options [nop,nop,TS val 3346796128 ecr 842880278], length 64
08:10:42.560008 IP prabesha2026.ssh > 198.211.111.194.41568: Flags [P.], seq 12992:13232, ack 1, win 502, options [nop,nop,TS val 3346796128 ecr 842880278], length 240
08:10:42.560076 IP prabesha2026.ssh > 198.211.111.194.41568: Flags [P.], seq 13232:13504, ack 1, win 502, options [nop,nop,TS val 3346796128 ecr 842880278], length 272
08:10:42.560112 IP prabesha2026.ssh > 198.211.111.194.41568: Flags [P.], seq 13504:13568, ack 1, win 502, options [nop,nop,TS val 3346796128 ecr 842880278], length 64
08:10:42.560203 IP prabesha2026.ssh > 198.211.111.194.41568: Flags [P.], seq 13568:13792, ack 1, win 502, options [nop,nop,TS val 3346796128 ecr 842880278], length 224
08:10:42.560249 IP prabesha2026.ssh > 198.211.111.194.41568: Flags [P.], seq 13792:13856, ack 1, win 502, options [nop,nop,TS val 3346796128 ecr 842880278], length 64
08:10:42.560305 IP prabesha2026.ssh > 198.211.111.194.41568: Flags [P.], seq 13856:14080, ack 1, win 502, options [nop,nop,TS val 3346796128 ecr 842880278], length 224
08:10:42.560348 IP prabesha2026.ssh > 198.211.111.194.41568: Flags [P.], seq 14080:14144, ack 1, win 502, options [nop,nop,TS val 3346796128 ecr 842880278], length 64
08:10:42.560410 IP prabesha2026.ssh > 198.211.111.194.41568: Flags [P.], seq 14144:14368, ack 1, win 502, options [nop,nop,TS val 3346796128 ecr 842880278], length 224
08:10:42.560440 IP prabesha2026.ssh > 198.211.111.194.41568: Flags [P.], seq 14368:14432, ack 1, win 502, options [nop,nop,TS val 3346796128 ecr 842880278], length 64
08:10:42.560494 IP prabesha2026.ssh > 198.211.111.194.41568: Flags [P.], seq 14432:14656, ack 1, win 502, options [nop,nop,TS val 3346796128 ecr 842880278], length 224
08:10:42.560525 IP prabesha2026.ssh > 198.211.111.194.41568: Flags [P.], seq 14656:14720, ack 1, win 502, options [nop,nop,TS val 3346796128 ecr 842880278], length 64
08:10:42.560577 IP prabesha2026.ssh > 198.211.111.194.41568: Flags [P.], seq 14720:14944, ack 1, win 502, options [nop,nop,TS val 3346796129 ecr 842880278], length 224
08:10:42.560606 IP prabesha2026.ssh > 198.211.111.194.41568: Flags [P.], seq 14944:15008, ack 1, win 502, options [nop,nop,TS val 3346796129 ecr 842880278], length 64
08:10:42.560653 IP prabesha2026.ssh > 198.211.111.194.41568: Flags [P.], seq 15008:15232, ack 1, win 502, options [nop,nop,TS val 3346796129 ecr 842880278], length 224
08:10:42.560683 IP prabesha2026.ssh > 198.211.111.194.41568: Flags [P.], seq 15232:15296, ack 1, win 502, options [nop,nop,TS val 3346796129 ecr 842880278], length 64
08:10:42.560742 IP prabesha2026.ssh > 198.211.111.194.41568: Flags [P.], seq 15296:15520, ack 1, win 502, options [nop,nop,TS val 3346796129 ecr 842880278], length 224
08:10:42.560776 IP prabesha2026.ssh > 198.211.111.194.41568: Flags [P.], seq 15520:15584, ack 1, win 502, options [nop,nop,TS val 3346796129 ecr 842880278], length 64
08:10:42.560832 IP prabesha2026.ssh > 198.211.111.194.41568: Flags [P.], seq 15584:15808, ack 1, win 502, options [nop,nop,TS val 3346796129 ecr 842880278], length 224
08:10:42.560869 IP prabesha2026.ssh > 198.211.111.194.41568: Flags [P.], seq 15808:15872, ack 1, win 502, options [nop,nop,TS val 3346796129 ecr 842880278], length 64
08:10:42.560930 IP prabesha2026.ssh > 198.211.111.194.41568: Flags [P.], seq 15872:16096, ack 1, win 502, options [nop,nop,TS val 3346796129 ecr 842880278], length 224
08:10:42.560969 IP prabesha2026.ssh > 198.211.111.194.41568: Flags [P.], seq 16096:16160, ack 1, win 502, options [nop,nop,TS val 3346796129 ecr 842880278], length 64
08:10:42.561027 IP prabesha2026.ssh > 198.211.111.194.41568: Flags [P.], seq 16160:16384, ack 1, win 502, options [nop,nop,TS val 3346796129 ecr 842880278], length 224
08:10:42.561061 IP prabesha2026.ssh > 198.211.111.194.41568: Flags [P.], seq 16384:16448, ack 1, win 502, options [nop,nop,TS val 3346796129 ecr 842880278], length 64
08:10:42.561113 IP prabesha2026.ssh > 198.211.111.194.41568: Flags [P.], seq 16448:16672, ack 1, win 502, options [nop,nop,TS val 3346796129 ecr 842880278], length 224
08:10:42.561145 IP prabesha2026.ssh > 198.211.111.194.41568: Flags [P.], seq 16672:16736, ack 1, win 502, options [nop,nop,TS val 3346796129 ecr 842880278], length 64
08:10:42.561245 IP prabesha2026.ssh > 198.211.111.194.41568: Flags [P.], seq 16736:16960, ack 1, win 502, options [nop,nop,TS val 3346796129 ecr 842880278], length 224
08:10:42.561286 IP prabesha2026.ssh > 198.211.111.194.41568: Flags [P.], seq 16960:17024, ack 1, win 502, options [nop,nop,TS val 3346796129 ecr 842880278], length 64
08:10:42.561357 IP prabesha2026.ssh > 198.211.111.194.41568: Flags [P.], seq 17024:17248, ack 1, win 502, options [nop,nop,TS val 3346796129 ecr 842880278], length 224
08:10:42.561391 IP prabesha2026.ssh > 198.211.111.194.41568: Flags [P.], seq 17248:17312, ack 1, win 502, options [nop,nop,TS val 3346796129 ecr 842880278], length 64
08:10:42.561440 IP prabesha2026.ssh > 198.211.111.194.41568: Flags [P.], seq 17312:17536, ack 1, win 502, options [nop,nop,TS val 3346796129 ecr 842880278], length 224
08:10:42.561470 IP prabesha2026.ssh > 198.211.111.194.41568: Flags [P.], seq 17536:17600, ack 1, win 502, options [nop,nop,TS val 3346796129 ecr 842880278], length 64
08:10:42.561514 IP prabesha2026.ssh > 198.211.111.194.41568: Flags [P.], seq 17600:17824, ack 1, win 502, options [nop,nop,TS val 3346796129 ecr 842880278], length 224
08:10:42.561542 IP prabesha2026.ssh > 198.211.111.194.41568: Flags [P.], seq 17824:17888, ack 1, win 502, options [nop,nop,TS val 3346796129 ecr 842880278], length 64
08:10:42.561584 IP prabesha2026.ssh > 198.211.111.194.41568: Flags [P.], seq 17888:18112, ack 1, win 502, options [nop,nop,TS val 3346796130 ecr 842880278], length 224
08:10:42.561616 IP prabesha2026.ssh > 198.211.111.194.41568: Flags [P.], seq 18112:18176, ack 1, win 502, options [nop,nop,TS val 3346796130 ecr 842880278], length 64
08:10:42.561659 IP prabesha2026.ssh > 198.211.111.194.41568: Flags [P.], seq 18176:18400, ack 1, win 502, options [nop,nop,TS val 3346796130 ecr 842880278], length 224
08:10:42.561687 IP prabesha2026.ssh > 198.211.111.194.41568: Flags [P.], seq 18400:18464, ack 1, win 502, options [nop,nop,TS val 3346796130 ecr 842880278], length 64
08:10:42.561729 IP prabesha2026.ssh > 198.211.111.194.41568: Flags [P.], seq 18464:18688, ack 1, win 502, options [nop,nop,TS val 3346796130 ecr 842880278], length 224
08:10:42.561758 IP prabesha2026.ssh > 198.211.111.194.41568: Flags [P.], seq 18688:18752, ack 1, win 502, options [nop,nop,TS val 3346796130 ecr 842880278], length 64
08:10:42.561801 IP prabesha2026.ssh > 198.211.111.194.41568: Flags [P.], seq 18752:18976, ack 1, win 502, options [nop,nop,TS val 3346796130 ecr 842880278], length 224
08:10:42.561855 IP prabesha2026.ssh > 198.211.111.194.41568: Flags [P.], seq 18976:19040, ack 1, win 502, options [nop,nop,TS val 3346796130 ecr 842880278], length 64
08:10:42.561880 IP prabesha2026.ssh > 198.211.111.194.41568: Flags [P.], seq 19040:19264, ack 1, win 502, options [nop,nop,TS val 3346796130 ecr 842880278], length 224
08:10:42.561909 IP prabesha2026.ssh > 198.211.111.194.41568: Flags [P.], seq 19264:19328, ack 1, win 502, options [nop,nop,TS val 3346796130 ecr 842880278], length 64
08:10:42.561951 IP prabesha2026.ssh > 198.211.111.194.41568: Flags [P.], seq 19328:19552, ack 1, win 502, options [nop,nop,TS val 3346796130 ecr 842880278], length 224
08:10:42.561979 IP prabesha2026.ssh > 198.211.111.194.41568: Flags [P.], seq 19552:19616, ack 1, win 502, options [nop,nop,TS val 3346796130 ecr 842880278], length 64
08:10:42.562023 IP prabesha2026.ssh > 198.211.111.194.41568: Flags [P.], seq 19616:19840, ack 1, win 502, options [nop,nop,TS val 3346796130 ecr 842880278], length 224
08:10:42.562051 IP prabesha2026.ssh > 198.211.111.194.41568: Flags [P.], seq 19840:19904, ack 1, win 502, options [nop,nop,TS val 3346796130 ecr 842880278], length 64
08:10:42.562093 IP prabesha2026.ssh > 198.211.111.194.41568: Flags [P.], seq 19904:20128, ack 1, win 502, options [nop,nop,TS val 3346796130 ecr 842880278], length 224
08:10:42.562120 IP prabesha2026.ssh > 198.211.111.194.41568: Flags [P.], seq 20128:20192, ack 1, win 502, options [nop,nop,TS val 3346796130 ecr 842880278], length 64
08:10:42.562163 IP prabesha2026.ssh > 198.211.111.194.41568: Flags [P.], seq 20192:20416, ack 1, win 502, options [nop,nop,TS val 3346796130 ecr 842880278], length 224
08:10:42.562190 IP prabesha2026.ssh > 198.211.111.194.41568: Flags [P.], seq 20416:20480, ack 1, win 502, options [nop,nop,TS val 3346796130 ecr 842880278], length 64
08:10:42.562233 IP prabesha2026.ssh > 198.211.111.194.41568: Flags [P.], seq 20480:20704, ack 1, win 502, options [nop,nop,TS val 3346796130 ecr 842880278], length 224
08:10:42.575645 IP 198.211.111.194.41568 > prabesha2026.ssh: Flags [.], ack 14144, win 4378, options [nop,nop,TS val 842880345 ecr 3346796128], length 0
08:10:42.575718 IP prabesha2026.ssh > 198.211.111.194.41568: Flags [P.], seq 20704:22432, ack 1, win 502, options [nop,nop,TS val 3346796144 ecr 842880345], length 1728
08:10:42.576040 IP 198.211.111.194.41568 > prabesha2026.ssh: Flags [.], ack 15808, win 4365, options [nop,nop,TS val 842880345 ecr 3346796128], length 0
08:10:42.576684 IP 198.211.111.194.41568 > prabesha2026.ssh: Flags [.], ack 17312, win 4354, options [nop,nop,TS val 842880346 ecr 3346796129], length 0
08:10:42.577056 IP 198.211.111.194.41568 > prabesha2026.ssh: Flags [.], ack 18976, win 4341, options [nop,nop,TS val 842880346 ecr 3346796129], length 0
08:10:42.577406 IP 198.211.111.194.41568 > prabesha2026.ssh: Flags [.], ack 20480, win 4330, options [nop,nop,TS val 842880346 ecr 3346796130], length 0
08:10:42.591021 IP 198.211.111.194.41568 > prabesha2026.ssh: Flags [.], ack 22432, win 4315, options [nop,nop,TS val 842880360 ecr 3346796130], length 0
08:10:42.663887 IP prabesha2026.ssh > 198.211.111.194.41568: Flags [P.], seq 22432:22656, ack 1, win 502, options [nop,nop,TS val 3346796232 ecr 842880360], length 224
08:10:42.663997 IP prabesha2026.ssh > 198.211.111.194.41568: Flags [P.], seq 22656:22944, ack 1, win 502, options [nop,nop,TS val 3346796232 ecr 842880360], length 288
08:10:42.664049 IP prabesha2026.ssh > 198.211.111.194.41568: Flags [P.], seq 22944:23008, ack 1, win 502, options [nop,nop,TS val 3346796232 ecr 842880360], length 64
08:10:42.664083 IP prabesha2026.ssh > 198.211.111.194.41568: Flags [P.], seq 23008:23232, ack 1, win 502, options [nop,nop,TS val 3346796232 ecr 842880360], length 224
08:10:42.664111 IP prabesha2026.ssh > 198.211.111.194.41568: Flags [P.], seq 23232:23296, ack 1, win 502, options [nop,nop,TS val 3346796232 ecr 842880360], length 64
08:10:42.664154 IP prabesha2026.ssh > 198.211.111.194.41568: Flags [P.], seq 23296:23520, ack 1, win 502, options [nop,nop,TS val 3346796232 ecr 842880360], length 224
08:10:42.664278 IP prabesha2026.ssh > 198.211.111.194.41568: Flags [P.], seq 23520:23584, ack 1, win 502, options [nop,nop,TS val 3346796232 ecr 842880360], length 64
08:10:42.664333 IP prabesha2026.ssh > 198.211.111.194.41568: Flags [P.], seq 23584:23808, ack 1, win 502, options [nop,nop,TS val 3346796232 ecr 842880360], length 224
08:10:42.664364 IP prabesha2026.ssh > 198.211.111.194.41568: Flags [P.], seq 23808:23872, ack 1, win 502, options [nop,nop,TS val 3346796232 ecr 842880360], length 64
08:10:42.664407 IP prabesha2026.ssh > 198.211.111.194.41568: Flags [P.], seq 23872:24096, ack 1, win 502, options [nop,nop,TS val 3346796232 ecr 842880360], length 224
08:10:42.664435 IP prabesha2026.ssh > 198.211.111.194.41568: Flags [P.], seq 24096:24160, ack 1, win 502, options [nop,nop,TS val 3346796232 ecr 842880360], length 64
08:10:42.664478 IP prabesha2026.ssh > 198.211.111.194.41568: Flags [P.], seq 24160:24384, ack 1, win 502, options [nop,nop,TS val 3346796232 ecr 842880360], length 224
08:10:42.664532 IP prabesha2026.ssh > 198.211.111.194.41568: Flags [P.], seq 24384:24448, ack 1, win 502, options [nop,nop,TS val 3346796232 ecr 842880360], length 64
08:10:42.664588 IP prabesha2026.ssh > 198.211.111.194.41568: Flags [P.], seq 24448:24672, ack 1, win 502, options [nop,nop,TS val 3346796233 ecr 842880360], length 224
08:10:42.664624 IP prabesha2026.ssh > 198.211.111.194.41568: Flags [P.], seq 24672:24736, ack 1, win 502, options [nop,nop,TS val 3346796233 ecr 842880360], length 64
08:10:42.664676 IP prabesha2026.ssh > 198.211.111.194.41568: Flags [P.], seq 24736:24960, ack 1, win 502, options [nop,nop,TS val 3346796233 ecr 842880360], length 224
08:10:42.664709 IP prabesha2026.ssh > 198.211.111.194.41568: Flags [P.], seq 24960:25024, ack 1, win 502, options [nop,nop,TS val 3346796233 ecr 842880360], length 64
08:10:42.664760 IP prabesha2026.ssh > 198.211.111.194.41568: Flags [P.], seq 25024:25248, ack 1, win 502, options [nop,nop,TS val 3346796233 ecr 842880360], length 224
08:10:42.664789 IP prabesha2026.ssh > 198.211.111.194.41568: Flags [P.], seq 25248:25312, ack 1, win 502, options [nop,nop,TS val 3346796233 ecr 842880360], length 64
08:10:42.664832 IP prabesha2026.ssh > 198.211.111.194.41568: Flags [P.], seq 25312:25536, ack 1, win 502, options [nop,nop,TS val 3346796233 ecr 842880360], length 224
08:10:42.664860 IP prabesha2026.ssh > 198.211.111.194.41568: Flags [P.], seq 25536:25600, ack 1, win 502, options [nop,nop,TS val 3346796233 ecr 842880360], length 64
08:10:42.664913 IP prabesha2026.ssh > 198.211.111.194.41568: Flags [P.], seq 25600:25824, ack 1, win 502, options [nop,nop,TS val 3346796233 ecr 842880360], length 224
08:10:42.664958 IP prabesha2026.ssh > 198.211.111.194.41568: Flags [P.], seq 25824:25888, ack 1, win 502, options [nop,nop,TS val 3346796233 ecr 842880360], length 64
08:10:42.665014 IP prabesha2026.ssh > 198.211.111.194.41568: Flags [P.], seq 25888:26112, ack 1, win 502, options [nop,nop,TS val 3346796233 ecr 842880360], length 224
08:10:42.665061 IP prabesha2026.ssh > 198.211.111.194.41568: Flags [P.], seq 26112:26176, ack 1, win 502, options [nop,nop,TS val 3346796233 ecr 842880360], length 64
08:10:42.665132 IP prabesha2026.ssh > 198.211.111.194.41568: Flags [P.], seq 26176:26400, ack 1, win 502, options [nop,nop,TS val 3346796233 ecr 842880360], length 224
08:10:42.665171 IP prabesha2026.ssh > 198.211.111.194.41568: Flags [P.], seq 26400:26464, ack 1, win 502, options [nop,nop,TS val 3346796233 ecr 842880360], length 64
08:10:42.665233 IP prabesha2026.ssh > 198.211.111.194.41568: Flags [P.], seq 26464:26688, ack 1, win 502, options [nop,nop,TS val 3346796233 ecr 842880360], length 224
08:10:42.665266 IP prabesha2026.ssh > 198.211.111.194.41568: Flags [P.], seq 26688:26752, ack 1, win 502, options [nop,nop,TS val 3346796233 ecr 842880360], length 64
08:10:42.665320 IP prabesha2026.ssh > 198.211.111.194.41568: Flags [P.], seq 26752:26976, ack 1, win 502, options [nop,nop,TS val 3346796233 ecr 842880360], length 224
08:10:42.665371 IP prabesha2026.ssh > 198.211.111.194.41568: Flags [P.], seq 26976:27040, ack 1, win 502, options [nop,nop,TS val 3346796233 ecr 842880360], length 64
08:10:42.665435 IP prabesha2026.ssh > 198.211.111.194.41568: Flags [P.], seq 27040:27264, ack 1, win 502, options [nop,nop,TS val 3346796233 ecr 842880360], length 224
08:10:42.665503 IP prabesha2026.ssh > 198.211.111.194.41568: Flags [P.], seq 27264:27328, ack 1, win 502, options [nop,nop,TS val 3346796233 ecr 842880360], length 64
08:10:42.665543 IP prabesha2026.ssh > 198.211.111.194.41568: Flags [P.], seq 27328:27552, ack 1, win 502, options [nop,nop,TS val 3346796233 ecr 842880360], length 224
08:10:42.665580 IP prabesha2026.ssh > 198.211.111.194.41568: Flags [P.], seq 27552:27616, ack 1, win 502, options [nop,nop,TS val 3346796234 ecr 842880360], length 64
08:10:42.665639 IP prabesha2026.ssh > 198.211.111.194.41568: Flags [P.], seq 27616:27840, ack 1, win 502, options [nop,nop,TS val 3346796234 ecr 842880360], length 224
08:10:42.665681 IP prabesha2026.ssh > 198.211.111.194.41568: Flags [P.], seq 27840:27904, ack 1, win 502, options [nop,nop,TS val 3346796234 ecr 842880360], length 64
08:10:42.665745 IP prabesha2026.ssh > 198.211.111.194.41568: Flags [P.], seq 27904:28128, ack 1, win 502, options [nop,nop,TS val 3346796234 ecr 842880360], length 224
08:10:42.665788 IP prabesha2026.ssh > 198.211.111.194.41568: Flags [P.], seq 28128:28192, ack 1, win 502, options [nop,nop,TS val 3346796234 ecr 842880360], length 64
08:10:42.665850 IP prabesha2026.ssh > 198.211.111.194.41568: Flags [P.], seq 28192:28416, ack 1, win 502, options [nop,nop,TS val 3346796234 ecr 842880360], length 224
08:10:42.665889 IP prabesha2026.ssh > 198.211.111.194.41568: Flags [P.], seq 28416:28480, ack 1, win 502, options [nop,nop,TS val 3346796234 ecr 842880360], length 64
08:10:42.665944 IP prabesha2026.ssh > 198.211.111.194.41568: Flags [P.], seq 28480:28704, ack 1, win 502, options [nop,nop,TS val 3346796234 ecr 842880360], length 224
08:10:42.665980 IP prabesha2026.ssh > 198.211.111.194.41568: Flags [P.], seq 28704:28768, ack 1, win 502, options [nop,nop,TS val 3346796234 ecr 842880360], length 64
08:10:42.666039 IP prabesha2026.ssh > 198.211.111.194.41568: Flags [P.], seq 28768:28992, ack 1, win 502, options [nop,nop,TS val 3346796234 ecr 842880360], length 224
08:10:42.666075 IP prabesha2026.ssh > 198.211.111.194.41568: Flags [P.], seq 28992:29056, ack 1, win 502, options [nop,nop,TS val 3346796234 ecr 842880360], length 64
08:10:42.666131 IP prabesha2026.ssh > 198.211.111.194.41568: Flags [P.], seq 29056:29280, ack 1, win 502, options [nop,nop,TS val 3346796234 ecr 842880360], length 224
08:10:42.666166 IP prabesha2026.ssh > 198.211.111.194.41568: Flags [P.], seq 29280:29344, ack 1, win 502, options [nop,nop,TS val 3346796234 ecr 842880360], length 64
08:10:42.666228 IP prabesha2026.ssh > 198.211.111.194.41568: Flags [P.], seq 29344:29568, ack 1, win 502, options [nop,nop,TS val 3346796234 ecr 842880360], length 224
08:10:42.666267 IP prabesha2026.ssh > 198.211.111.194.41568: Flags [P.], seq 29568:29632, ack 1, win 502, options [nop,nop,TS val 3346796234 ecr 842880360], length 64
08:10:42.666325 IP prabesha2026.ssh > 198.211.111.194.41568: Flags [P.], seq 29632:29856, ack 1, win 502, options [nop,nop,TS val 3346796234 ecr 842880360], length 224
08:10:42.666364 IP prabesha2026.ssh > 198.211.111.194.41568: Flags [P.], seq 29856:29920, ack 1, win 502, options [nop,nop,TS val 3346796234 ecr 842880360], length 64
08:10:42.666422 IP prabesha2026.ssh > 198.211.111.194.41568: Flags [P.], seq 29920:30144, ack 1, win 502, options [nop,nop,TS val 3346796234 ecr 842880360], length 224
08:10:42.666488 IP prabesha2026.ssh > 198.211.111.194.41568: Flags [P.], seq 30144:30208, ack 1, win 502, options [nop,nop,TS val 3346796234 ecr 842880360], length 64
08:10:42.666546 IP prabesha2026.ssh > 198.211.111.194.41568: Flags [P.], seq 30208:30432, ack 1, win 502, options [nop,nop,TS val 3346796234 ecr 842880360], length 224
08:10:42.666583 IP prabesha2026.ssh > 198.211.111.194.41568: Flags [P.], seq 30432:30496, ack 1, win 502, options [nop,nop,TS val 3346796235 ecr 842880360], length 64
08:10:42.666637 IP prabesha2026.ssh > 198.211.111.194.41568: Flags [P.], seq 30496:30720, ack 1, win 502, options [nop,nop,TS val 3346796235 ecr 842880360], length 224
08:10:42.666686 IP prabesha2026.ssh > 198.211.111.194.41568: Flags [P.], seq 30720:30784, ack 1, win 502, options [nop,nop,TS val 3346796235 ecr 842880360], length 64
08:10:42.666749 IP prabesha2026.ssh > 198.211.111.194.41568: Flags [P.], seq 30784:31008, ack 1, win 502, options [nop,nop,TS val 3346796235 ecr 842880360], length 224
08:10:42.666788 IP prabesha2026.ssh > 198.211.111.194.41568: Flags [P.], seq 31008:31072, ack 1, win 502, options [nop,nop,TS val 3346796235 ecr 842880360], length 64
08:10:42.666845 IP prabesha2026.ssh > 198.211.111.194.41568: Flags [P.], seq 31072:31296, ack 1, win 502, options [nop,nop,TS val 3346796235 ecr 842880360], length 224
08:10:42.666922 IP prabesha2026.ssh > 198.211.111.194.41568: Flags [P.], seq 31296:31584, ack 1, win 502, options [nop,nop,TS val 3346796235 ecr 842880360], length 288
08:10:42.667023 IP prabesha2026.ssh > 198.211.111.194.41568: Flags [P.], seq 31584:31936, ack 1, win 502, options [nop,nop,TS val 3346796235 ecr 842880360], length 352
08:10:42.667224 IP prabesha2026.ssh > 198.211.111.194.41568: Flags [P.], seq 31936:32736, ack 1, win 502, options [nop,nop,TS val 3346796235 ecr 842880360], length 800
08:10:42.667249 IP prabesha2026.ssh > 198.211.111.194.41568: Flags [P.], seq 32736:32800, ack 1, win 502, options [nop,nop,TS val 3346796235 ecr 842880360], length 64
08:10:42.667309 IP prabesha2026.ssh > 198.211.111.194.41568: Flags [P.], seq 32800:33024, ack 1, win 502, options [nop,nop,TS val 3346796235 ecr 842880360], length 224
08:10:42.667369 IP prabesha2026.ssh > 198.211.111.194.41568: Flags [P.], seq 33024:33088, ack 1, win 502, options [nop,nop,TS val 3346796235 ecr 842880360], length 64
08:10:42.667413 IP prabesha2026.ssh > 198.211.111.194.41568: Flags [P.], seq 33088:33312, ack 1, win 502, options [nop,nop,TS val 3346796235 ecr 842880360], length 224
08:10:42.667449 IP prabesha2026.ssh > 198.211.111.194.41568: Flags [P.], seq 33312:33376, ack 1, win 502, options [nop,nop,TS val 3346796235 ecr 842880360], length 64
08:10:42.667505 IP prabesha2026.ssh > 198.211.111.194.41568: Flags [P.], seq 33376:33600, ack 1, win 502, options [nop,nop,TS val 3346796235 ecr 842880360], length 224
08:10:42.667552 IP prabesha2026.ssh > 198.211.111.194.41568: Flags [P.], seq 33600:33664, ack 1, win 502, options [nop,nop,TS val 3346796235 ecr 842880360], length 64
08:10:42.667629 IP prabesha2026.ssh > 198.211.111.194.41568: Flags [P.], seq 33664:33888, ack 1, win 502, options [nop,nop,TS val 3346796236 ecr 842880360], length 224
08:10:42.667667 IP prabesha2026.ssh > 198.211.111.194.41568: Flags [P.], seq 33888:33952, ack 1, win 502, options [nop,nop,TS val 3346796236 ecr 842880360], length 64
08:10:42.667725 IP prabesha2026.ssh > 198.211.111.194.41568: Flags [P.], seq 33952:34176, ack 1, win 502, options [nop,nop,TS val 3346796236 ecr 842880360], length 224
08:10:42.667764 IP prabesha2026.ssh > 198.211.111.194.41568: Flags [P.], seq 34176:34240, ack 1, win 502, options [nop,nop,TS val 3346796236 ecr 842880360], length 64
08:10:42.667819 IP prabesha2026.ssh > 198.211.111.194.41568: Flags [P.], seq 34240:34464, ack 1, win 502, options [nop,nop,TS val 3346796236 ecr 842880360], length 224
08:10:42.667857 IP prabesha2026.ssh > 198.211.111.194.41568: Flags [P.], seq 34464:34528, ack 1, win 502, options [nop,nop,TS val 3346796236 ecr 842880360], length 64
08:10:42.667914 IP prabesha2026.ssh > 198.211.111.194.41568: Flags [P.], seq 34528:34752, ack 1, win 502, options [nop,nop,TS val 3346796236 ecr 842880360], length 224
08:10:42.667950 IP prabesha2026.ssh > 198.211.111.194.41568: Flags [P.], seq 34752:34816, ack 1, win 502, options [nop,nop,TS val 3346796236 ecr 842880360], length 64
08:10:42.668009 IP prabesha2026.ssh > 198.211.111.194.41568: Flags [P.], seq 34816:35040, ack 1, win 502, options [nop,nop,TS val 3346796236 ecr 842880360], length 224
08:10:42.668046 IP prabesha2026.ssh > 198.211.111.194.41568: Flags [P.], seq 35040:35104, ack 1, win 502, options [nop,nop,TS val 3346796236 ecr 842880360], length 64
08:10:42.668099 IP prabesha2026.ssh > 198.211.111.194.41568: Flags [P.], seq 35104:35328, ack 1, win 502, options [nop,nop,TS val 3346796236 ecr 842880360], length 224
08:10:42.668135 IP prabesha2026.ssh > 198.211.111.194.41568: Flags [P.], seq 35328:35392, ack 1, win 502, options [nop,nop,TS val 3346796236 ecr 842880360], length 64
08:10:42.668242 IP prabesha2026.ssh > 198.211.111.194.41568: Flags [P.], seq 35392:35616, ack 1, win 502, options [nop,nop,TS val 3346796236 ecr 842880360], length 224
08:10:42.668283 IP prabesha2026.ssh > 198.211.111.194.41568: Flags [P.], seq 35616:35680, ack 1, win 502, options [nop,nop,TS val 3346796236 ecr 842880360], length 64
08:10:42.668343 IP prabesha2026.ssh > 198.211.111.194.41568: Flags [P.], seq 35680:35904, ack 1, win 502, options [nop,nop,TS val 3346796236 ecr 842880360], length 224
08:10:42.668404 IP prabesha2026.ssh > 198.211.111.194.41568: Flags [P.], seq 35904:36128, ack 1, win 502, options [nop,nop,TS val 3346796236 ecr 842880360], length 224
08:10:42.668470 IP prabesha2026.ssh > 198.211.111.194.41568: Flags [P.], seq 36128:36352, ack 1, win 502, options [nop,nop,TS val 3346796236 ecr 842880360], length 224
08:10:42.668559 IP prabesha2026.ssh > 198.211.111.194.41568: Flags [P.], seq 36352:36752, ack 1, win 502, options [nop,nop,TS val 3346796236 ecr 842880360], length 400
08:10:42.668621 IP prabesha2026.ssh > 198.211.111.194.41568: Flags [P.], seq 36752:36976, ack 1, win 502, options [nop,nop,TS val 3346796237 ecr 842880360], length 224
08:10:42.668706 IP prabesha2026.ssh > 198.211.111.194.41568: Flags [P.], seq 36976:37376, ack 1, win 502, options [nop,nop,TS val 3346796237 ecr 842880360], length 400
08:10:42.668769 IP prabesha2026.ssh > 198.211.111.194.41568: Flags [P.], seq 37376:37584, ack 1, win 502, options [nop,nop,TS val 3346796237 ecr 842880360], length 208
08:10:42.668851 IP prabesha2026.ssh > 198.211.111.194.41568: Flags [P.], seq 37584:37968, ack 1, win 502, options [nop,nop,TS val 3346796237 ecr 842880360], length 384
08:10:42.668913 IP prabesha2026.ssh > 198.211.111.194.41568: Flags [P.], seq 37968:38176, ack 1, win 502, options [nop,nop,TS val 3346796237 ecr 842880360], length 208
08:10:42.668988 IP prabesha2026.ssh > 198.211.111.194.41568: Flags [P.], seq 38176:38544, ack 1, win 502, options [nop,nop,TS val 3346796237 ecr 842880360], length 368
08:10:42.669066 IP prabesha2026.ssh > 198.211.111.194.41568: Flags [P.], seq 38544:38752, ack 1, win 502, options [nop,nop,TS val 3346796237 ecr 842880360], length 208
08:10:42.679649 IP 198.211.111.194.41568 > prabesha2026.ssh: Flags [.], ack 24096, win 4378, options [nop,nop,TS val 842880449 ecr 3346796232], length 0
08:10:42.680092 IP 198.211.111.194.41568 > prabesha2026.ssh: Flags [.], ack 25600, win 4367, options [nop,nop,TS val 842880449 ecr 3346796232], length 0
08:10:42.680708 IP 198.211.111.194.41568 > prabesha2026.ssh: Flags [.], ack 27264, win 4354, options [nop,nop,TS val 842880450 ecr 3346796233], length 0
08:10:42.681210 IP 198.211.111.194.41568 > prabesha2026.ssh: Flags [.], ack 28768, win 4343, options [nop,nop,TS val 842880450 ecr 3346796233], length 0
08:10:42.681766 IP 198.211.111.194.41568 > prabesha2026.ssh: Flags [.], ack 30432, win 4330, options [nop,nop,TS val 842880451 ecr 3346796234], length 0
08:10:42.682414 IP 198.211.111.194.41568 > prabesha2026.ssh: Flags [.], ack 31936, win 4319, options [nop,nop,TS val 842880451 ecr 3346796235], length 0
08:10:42.682751 IP 198.211.111.194.41568 > prabesha2026.ssh: Flags [.], ack 33600, win 4306, options [nop,nop,TS val 842880452 ecr 3346796235], length 0
