tcpdump -i eth0 port 22

root@prabesha2026:~# tcpdump -i eth0 port 22
tcpdump: verbose output suppressed, use -v[v]... for full protocol decode
listening on eth0, link-type EN10MB (Ethernet), snapshot length 262144 bytes
08:11:47.514618 IP prabesha2026.ssh > 198.211.111.194.41568: Flags [P.], seq 3388501217:3388501345, ack 2216298200, win 502, options [nop,nop,TS val 3346861083 ecr 842945272], length 128
08:11:47.514693 IP prabesha2026.ssh > 198.211.111.194.41568: Flags [P.], seq 128:192, ack 1, win 502, options [nop,nop,TS val 3346861083 ecr 842945272], length 64
08:11:47.514735 IP prabesha2026.ssh > 198.211.111.194.41568: Flags [P.], seq 192:272, ack 1, win 502, options [nop,nop,TS val 3346861083 ecr 842945272], length 80
08:11:47.514771 IP prabesha2026.ssh > 198.211.111.194.41568: Flags [P.], seq 272:352, ack 1, win 502, options [nop,nop,TS val 3346861083 ecr 842945272], length 80
08:11:47.514809 IP prabesha2026.ssh > 198.211.111.194.41568: Flags [P.], seq 352:432, ack 1, win 502, options [nop,nop,TS val 3346861083 ecr 842945272], length 80
08:11:47.514846 IP prabesha2026.ssh > 198.211.111.194.41568: Flags [P.], seq 432:496, ack 1, win 502, options [nop,nop,TS val 3346861083 ecr 842945272], length 64
08:11:47.523084 IP 198.211.111.194.41568 > prabesha2026.ssh: Flags [.], ack 0, win 4386, options [nop,nop,TS val 842945292 ecr 3346861076], length 0
08:11:47.529961 IP 198.211.111.194.41568 > prabesha2026.ssh: Flags [.], ack 128, win 4386, options [nop,nop,TS val 842945299 ecr 3346861083], length 0
08:11:47.529961 IP 198.211.111.194.41568 > prabesha2026.ssh: Flags [.], ack 192, win 4386, options [nop,nop,TS val 842945299 ecr 3346861083], length 0
08:11:47.529961 IP 198.211.111.194.41568 > prabesha2026.ssh: Flags [.], ack 272, win 4386, options [nop,nop,TS val 842945299 ecr 3346861083], length 0
08:11:47.529961 IP 198.211.111.194.41568 > prabesha2026.ssh: Flags [.], ack 352, win 4386, options [nop,nop,TS val 842945299 ecr 3346861083], length 0
08:11:47.530032 IP 198.211.111.194.41568 > prabesha2026.ssh: Flags [.], ack 432, win 4386, options [nop,nop,TS val 842945299 ecr 3346861083], length 0
08:11:47.530051 IP 198.211.111.194.41568 > prabesha2026.ssh: Flags [.], ack 496, win 4386, options [nop,nop,TS val 842945299 ecr 3346861083], length 0
08:11:47.621664 IP prabesha2026.ssh > 198.211.111.194.41568: Flags [P.], seq 496:736, ack 1, win 502, options [nop,nop,TS val 3346861190 ecr 842945299], length 240
08:11:47.621724 IP prabesha2026.ssh > 198.211.111.194.41568: Flags [P.], seq 736:800, ack 1, win 502, options [nop,nop,TS val 3346861190 ecr 842945299], length 64
08:11:47.621811 IP prabesha2026.ssh > 198.211.111.194.41568: Flags [P.], seq 800:1024, ack 1, win 502, options [nop,nop,TS val 3346861190 ecr 842945299], length 224
08:11:47.621873 IP prabesha2026.ssh > 198.211.111.194.41568: Flags [P.], seq 1024:1088, ack 1, win 502, options [nop,nop,TS val 3346861190 ecr 842945299], length 64
08:11:47.621916 IP prabesha2026.ssh > 198.211.111.194.41568: Flags [P.], seq 1088:1312, ack 1, win 502, options [nop,nop,TS val 3346861190 ecr 842945299], length 224
08:11:47.621946 IP prabesha2026.ssh > 198.211.111.194.41568: Flags [P.], seq 1312:1376, ack 1, win 502, options [nop,nop,TS val 3346861190 ecr 842945299], length 64
08:11:47.621994 IP prabesha2026.ssh > 198.211.111.194.41568: Flags [P.], seq 1376:1600, ack 1, win 502, options [nop,nop,TS val 3346861190 ecr 842945299], length 224
08:11:47.622022 IP prabesha2026.ssh > 198.211.111.194.41568: Flags [P.], seq 1600:1664, ack 1, win 502, options [nop,nop,TS val 3346861190 ecr 842945299], length 64
08:11:47.622067 IP prabesha2026.ssh > 198.211.111.194.41568: Flags [P.], seq 1664:1888, ack 1, win 502, options [nop,nop,TS val 3346861190 ecr 842945299], length 224
08:11:47.622096 IP prabesha2026.ssh > 198.211.111.194.41568: Flags [P.], seq 1888:1952, ack 1, win 502, options [nop,nop,TS val 3346861190 ecr 842945299], length 64
08:11:47.622140 IP prabesha2026.ssh > 198.211.111.194.41568: Flags [P.], seq 1952:2176, ack 1, win 502, options [nop,nop,TS val 3346861190 ecr 842945299], length 224
08:11:47.622167 IP prabesha2026.ssh > 198.211.111.194.41568: Flags [P.], seq 2176:2240, ack 1, win 502, options [nop,nop,TS val 3346861190 ecr 842945299], length 64
08:11:47.622210 IP prabesha2026.ssh > 198.211.111.194.41568: Flags [P.], seq 2240:2448, ack 1, win 502, options [nop,nop,TS val 3346861190 ecr 842945299], length 208
08:11:47.622248 IP prabesha2026.ssh > 198.211.111.194.41568: Flags [P.], seq 2448:2512, ack 1, win 502, options [nop,nop,TS val 3346861190 ecr 842945299], length 64
08:11:47.638230 IP 198.211.111.194.41568 > prabesha2026.ssh: Flags [.], ack 736, win 4386, options [nop,nop,TS val 842945406 ecr 3346861190], length 0
08:11:47.638230 IP 198.211.111.194.41568 > prabesha2026.ssh: Flags [.], ack 800, win 4386, options [nop,nop,TS val 842945406 ecr 3346861190], length 0
08:11:47.638230 IP 198.211.111.194.41568 > prabesha2026.ssh: Flags [.], ack 1024, win 4386, options [nop,nop,TS val 842945406 ecr 3346861190], length 0
08:11:47.638230 IP 198.211.111.194.41568 > prabesha2026.ssh: Flags [.], ack 1088, win 4386, options [nop,nop,TS val 842945406 ecr 3346861190], length 0
08:11:47.638230 IP 198.211.111.194.41568 > prabesha2026.ssh: Flags [.], ack 1312, win 4386, options [nop,nop,TS val 842945406 ecr 3346861190], length 0
08:11:47.638230 IP 198.211.111.194.41568 > prabesha2026.ssh: Flags [.], ack 1376, win 4386, options [nop,nop,TS val 842945406 ecr 3346861190], length 0
08:11:47.638230 IP 198.211.111.194.41568 > prabesha2026.ssh: Flags [.], ack 1600, win 4386, options [nop,nop,TS val 842945406 ecr 3346861190], length 0
08:11:47.638230 IP 198.211.111.194.41568 > prabesha2026.ssh: Flags [.], ack 1664, win 4386, options [nop,nop,TS val 842945406 ecr 3346861190], length 0
08:11:47.638310 IP prabesha2026.ssh > 198.211.111.194.41568: Flags [P.], seq 2512:4144, ack 1, win 502, options [nop,nop,TS val 3346861206 ecr 842945406], length 1632
08:11:47.638369 IP 198.211.111.194.41568 > prabesha2026.ssh: Flags [.], ack 1888, win 4386, options [nop,nop,TS val 842945406 ecr 3346861190], length 0
08:11:47.653649 IP 198.211.111.194.41568 > prabesha2026.ssh: Flags [.], ack 4144, win 4369, options [nop,nop,TS val 842945422 ecr 3346861190], length 0
08:11:47.715862 IP prabesha2026.ssh > 198.211.111.194.41568: Flags [P.], seq 4144:4368, ack 1, win 502, options [nop,nop,TS val 3346861284 ecr 842945422], length 224
08:11:47.715939 IP prabesha2026.ssh > 198.211.111.194.41568: Flags [P.], seq 4368:4432, ack 1, win 502, options [nop,nop,TS val 3346861284 ecr 842945422], length 64
08:11:47.715980 IP prabesha2026.ssh > 198.211.111.194.41568: Flags [P.], seq 4432:4656, ack 1, win 502, options [nop,nop,TS val 3346861284 ecr 842945422], length 224
08:11:47.716009 IP prabesha2026.ssh > 198.211.111.194.41568: Flags [P.], seq 4656:4720, ack 1, win 502, options [nop,nop,TS val 3346861284 ecr 842945422], length 64
08:11:47.716054 IP prabesha2026.ssh > 198.211.111.194.41568: Flags [P.], seq 4720:4944, ack 1, win 502, options [nop,nop,TS val 3346861284 ecr 842945422], length 224
08:11:47.716083 IP prabesha2026.ssh > 198.211.111.194.41568: Flags [P.], seq 4944:5008, ack 1, win 502, options [nop,nop,TS val 3346861284 ecr 842945422], length 64
08:11:47.716126 IP prabesha2026.ssh > 198.211.111.194.41568: Flags [P.], seq 5008:5232, ack 1, win 502, options [nop,nop,TS val 3346861284 ecr 842945422], length 224
08:11:47.716154 IP prabesha2026.ssh > 198.211.111.194.41568: Flags [P.], seq 5232:5296, ack 1, win 502, options [nop,nop,TS val 3346861284 ecr 842945422], length 64
08:11:47.716250 IP prabesha2026.ssh > 198.211.111.194.41568: Flags [P.], seq 5296:5520, ack 1, win 502, options [nop,nop,TS val 3346861284 ecr 842945422], length 224
08:11:47.716285 IP prabesha2026.ssh > 198.211.111.194.41568: Flags [P.], seq 5520:5584, ack 1, win 502, options [nop,nop,TS val 3346861284 ecr 842945422], length 64
08:11:47.716334 IP prabesha2026.ssh > 198.211.111.194.41568: Flags [P.], seq 5584:5808, ack 1, win 502, options [nop,nop,TS val 3346861284 ecr 842945422], length 224
08:11:47.716362 IP prabesha2026.ssh > 198.211.111.194.41568: Flags [P.], seq 5808:5872, ack 1, win 502, options [nop,nop,TS val 3346861284 ecr 842945422], length 64
08:11:47.716410 IP prabesha2026.ssh > 198.211.111.194.41568: Flags [P.], seq 5872:6096, ack 1, win 502, options [nop,nop,TS val 3346861284 ecr 842945422], length 224
08:11:47.716457 IP prabesha2026.ssh > 198.211.111.194.41568: Flags [P.], seq 6096:6160, ack 1, win 502, options [nop,nop,TS val 3346861284 ecr 842945422], length 64
08:11:47.716526 IP prabesha2026.ssh > 198.211.111.194.41568: Flags [P.], seq 6160:6384, ack 1, win 502, options [nop,nop,TS val 3346861284 ecr 842945422], length 224
08:11:47.716564 IP prabesha2026.ssh > 198.211.111.194.41568: Flags [P.], seq 6384:6448, ack 1, win 502, options [nop,nop,TS val 3346861284 ecr 842945422], length 64
08:11:47.716626 IP prabesha2026.ssh > 198.211.111.194.41568: Flags [P.], seq 6448:6672, ack 1, win 502, options [nop,nop,TS val 3346861285 ecr 842945422], length 224
08:11:47.716659 IP prabesha2026.ssh > 198.211.111.194.41568: Flags [P.], seq 6672:6736, ack 1, win 502, options [nop,nop,TS val 3346861285 ecr 842945422], length 64
08:11:47.716714 IP prabesha2026.ssh > 198.211.111.194.41568: Flags [P.], seq 6736:6960, ack 1, win 502, options [nop,nop,TS val 3346861285 ecr 842945422], length 224
08:11:47.716754 IP prabesha2026.ssh > 198.211.111.194.41568: Flags [P.], seq 6960:7024, ack 1, win 502, options [nop,nop,TS val 3346861285 ecr 842945422], length 64
08:11:47.716830 IP prabesha2026.ssh > 198.211.111.194.41568: Flags [P.], seq 7024:7248, ack 1, win 502, options [nop,nop,TS val 3346861285 ecr 842945422], length 224
08:11:47.716868 IP prabesha2026.ssh > 198.211.111.194.41568: Flags [P.], seq 7248:7312, ack 1, win 502, options [nop,nop,TS val 3346861285 ecr 842945422], length 64
08:11:47.716921 IP prabesha2026.ssh > 198.211.111.194.41568: Flags [P.], seq 7312:7536, ack 1, win 502, options [nop,nop,TS val 3346861285 ecr 842945422], length 224
08:11:47.716960 IP prabesha2026.ssh > 198.211.111.194.41568: Flags [P.], seq 7536:7600, ack 1, win 502, options [nop,nop,TS val 3346861285 ecr 842945422], length 64
08:11:47.717017 IP prabesha2026.ssh > 198.211.111.194.41568: Flags [P.], seq 7600:7824, ack 1, win 502, options [nop,nop,TS val 3346861285 ecr 842945422], length 224
08:11:47.717056 IP prabesha2026.ssh > 198.211.111.194.41568: Flags [P.], seq 7824:7888, ack 1, win 502, options [nop,nop,TS val 3346861285 ecr 842945422], length 64
08:11:47.717114 IP prabesha2026.ssh > 198.211.111.194.41568: Flags [P.], seq 7888:8112, ack 1, win 502, options [nop,nop,TS val 3346861285 ecr 842945422], length 224
08:11:47.717150 IP prabesha2026.ssh > 198.211.111.194.41568: Flags [P.], seq 8112:8176, ack 1, win 502, options [nop,nop,TS val 3346861285 ecr 842945422], length 64
08:11:47.717210 IP prabesha2026.ssh > 198.211.111.194.41568: Flags [P.], seq 8176:8384, ack 1, win 502, options [nop,nop,TS val 3346861285 ecr 842945422], length 208
08:11:47.717276 IP prabesha2026.ssh > 198.211.111.194.41568: Flags [P.], seq 8384:8448, ack 1, win 502, options [nop,nop,TS val 3346861285 ecr 842945422], length 64
08:11:47.731635 IP 198.211.111.194.41568 > prabesha2026.ssh: Flags [.], ack 5808, win 4378, options [nop,nop,TS val 842945500 ecr 3346861284], length 0
08:11:47.731699 IP prabesha2026.ssh > 198.211.111.194.41568: Flags [P.], seq 8448:11184, ack 1, win 502, options [nop,nop,TS val 3346861300 ecr 842945500], length 2736
08:11:47.732112 IP 198.211.111.194.41568 > prabesha2026.ssh: Flags [.], ack 7312, win 4367, options [nop,nop,TS val 842945501 ecr 3346861284], length 0
08:11:47.744434 IP 198.211.111.194.41568 > prabesha2026.ssh: Flags [.], ack 8448, win 4386, options [nop,nop,TS val 842945513 ecr 3346861285], length 0
08:11:47.746988 IP 198.211.111.194.41568 > prabesha2026.ssh: Flags [.], ack 11184, win 4378, options [nop,nop,TS val 842945516 ecr 3346861300], length 0
08:11:47.819902 IP prabesha2026.ssh > 198.211.111.194.41568: Flags [P.], seq 11184:11408, ack 1, win 502, options [nop,nop,TS val 3346861388 ecr 842945516], length 224
08:11:47.819978 IP prabesha2026.ssh > 198.211.111.194.41568: Flags [P.], seq 11408:11472, ack 1, win 502, options [nop,nop,TS val 3346861388 ecr 842945516], length 64
08:11:47.820042 IP prabesha2026.ssh > 198.211.111.194.41568: Flags [P.], seq 11472:11696, ack 1, win 502, options [nop,nop,TS val 3346861388 ecr 842945516], length 224
08:11:47.820072 IP prabesha2026.ssh > 198.211.111.194.41568: Flags [P.], seq 11696:11760, ack 1, win 502, options [nop,nop,TS val 3346861388 ecr 842945516], length 64
08:11:47.820118 IP prabesha2026.ssh > 198.211.111.194.41568: Flags [P.], seq 11760:11984, ack 1, win 502, options [nop,nop,TS val 3346861388 ecr 842945516], length 224
08:11:47.820148 IP prabesha2026.ssh > 198.211.111.194.41568: Flags [P.], seq 11984:12048, ack 1, win 502, options [nop,nop,TS val 3346861388 ecr 842945516], length 64
08:11:47.820255 IP prabesha2026.ssh > 198.211.111.194.41568: Flags [P.], seq 12048:12272, ack 1, win 502, options [nop,nop,TS val 3346861388 ecr 842945516], length 224
08:11:47.820300 IP prabesha2026.ssh > 198.211.111.194.41568: Flags [P.], seq 12272:12336, ack 1, win 502, options [nop,nop,TS val 3346861388 ecr 842945516], length 64
08:11:47.820361 IP prabesha2026.ssh > 198.211.111.194.41568: Flags [P.], seq 12336:12560, ack 1, win 502, options [nop,nop,TS val 3346861388 ecr 842945516], length 224
08:11:47.820402 IP prabesha2026.ssh > 198.211.111.194.41568: Flags [P.], seq 12560:12624, ack 1, win 502, options [nop,nop,TS val 3346861388 ecr 842945516], length 64
08:11:47.820467 IP prabesha2026.ssh > 198.211.111.194.41568: Flags [P.], seq 12624:12848, ack 1, win 502, options [nop,nop,TS val 3346861388 ecr 842945516], length 224
08:11:47.820497 IP prabesha2026.ssh > 198.211.111.194.41568: Flags [P.], seq 12848:12912, ack 1, win 502, options [nop,nop,TS val 3346861388 ecr 842945516], length 64
08:11:47.820548 IP prabesha2026.ssh > 198.211.111.194.41568: Flags [P.], seq 12912:13136, ack 1, win 502, options [nop,nop,TS val 3346861388 ecr 842945516], length 224
08:11:47.820575 IP prabesha2026.ssh > 198.211.111.194.41568: Flags [P.], seq 13136:13200, ack 1, win 502, options [nop,nop,TS val 3346861389 ecr 842945516], length 64
08:11:47.820619 IP prabesha2026.ssh > 198.211.111.194.41568: Flags [P.], seq 13200:13424, ack 1, win 502, options [nop,nop,TS val 3346861389 ecr 842945516], length 224
08:11:47.820647 IP prabesha2026.ssh > 198.211.111.194.41568: Flags [P.], seq 13424:13488, ack 1, win 502, options [nop,nop,TS val 3346861389 ecr 842945516], length 64
08:11:47.820690 IP prabesha2026.ssh > 198.211.111.194.41568: Flags [P.], seq 13488:13712, ack 1, win 502, options [nop,nop,TS val 3346861389 ecr 842945516], length 224
08:11:47.820718 IP prabesha2026.ssh > 198.211.111.194.41568: Flags [P.], seq 13712:13776, ack 1, win 502, options [nop,nop,TS val 3346861389 ecr 842945516], length 64
08:11:47.820765 IP prabesha2026.ssh > 198.211.111.194.41568: Flags [P.], seq 13776:14000, ack 1, win 502, options [nop,nop,TS val 3346861389 ecr 842945516], length 224
08:11:47.820809 IP prabesha2026.ssh > 198.211.111.194.41568: Flags [P.], seq 14000:14064, ack 1, win 502, options [nop,nop,TS val 3346861389 ecr 842945516], length 64
08:11:47.820861 IP prabesha2026.ssh > 198.211.111.194.41568: Flags [P.], seq 14064:14288, ack 1, win 502, options [nop,nop,TS val 3346861389 ecr 842945516], length 224
08:11:47.820889 IP prabesha2026.ssh > 198.211.111.194.41568: Flags [P.], seq 14288:14352, ack 1, win 502, options [nop,nop,TS val 3346861389 ecr 842945516], length 64
08:11:47.820940 IP prabesha2026.ssh > 198.211.111.194.41568: Flags [P.], seq 14352:14576, ack 1, win 502, options [nop,nop,TS val 3346861389 ecr 842945516], length 224
08:11:47.820970 IP prabesha2026.ssh > 198.211.111.194.41568: Flags [P.], seq 14576:14640, ack 1, win 502, options [nop,nop,TS val 3346861389 ecr 842945516], length 64
08:11:47.821016 IP prabesha2026.ssh > 198.211.111.194.41568: Flags [P.], seq 14640:14864, ack 1, win 502, options [nop,nop,TS val 3346861389 ecr 842945516], length 224
08:11:47.821044 IP prabesha2026.ssh > 198.211.111.194.41568: Flags [P.], seq 14864:14928, ack 1, win 502, options [nop,nop,TS val 3346861389 ecr 842945516], length 64
08:11:47.821087 IP prabesha2026.ssh > 198.211.111.194.41568: Flags [P.], seq 14928:15152, ack 1, win 502, options [nop,nop,TS val 3346861389 ecr 842945516], length 224
08:11:47.821115 IP prabesha2026.ssh > 198.211.111.194.41568: Flags [P.], seq 15152:15216, ack 1, win 502, options [nop,nop,TS val 3346861389 ecr 842945516], length 64
08:11:47.821157 IP prabesha2026.ssh > 198.211.111.194.41568: Flags [P.], seq 15216:15440, ack 1, win 502, options [nop,nop,TS val 3346861389 ecr 842945516], length 224
08:11:47.821184 IP prabesha2026.ssh > 198.211.111.194.41568: Flags [P.], seq 15440:15504, ack 1, win 502, options [nop,nop,TS val 3346861389 ecr 842945516], length 64
08:11:47.821238 IP prabesha2026.ssh > 198.211.111.194.41568: Flags [P.], seq 15504:15728, ack 1, win 502, options [nop,nop,TS val 3346861389 ecr 842945516], length 224
08:11:47.821265 IP prabesha2026.ssh > 198.211.111.194.41568: Flags [P.], seq 15728:15792, ack 1, win 502, options [nop,nop,TS val 3346861389 ecr 842945516], length 64
08:11:47.821309 IP prabesha2026.ssh > 198.211.111.194.41568: Flags [P.], seq 15792:16016, ack 1, win 502, options [nop,nop,TS val 3346861389 ecr 842945516], length 224
08:11:47.821357 IP prabesha2026.ssh > 198.211.111.194.41568: Flags [P.], seq 16016:16080, ack 1, win 502, options [nop,nop,TS val 3346861389 ecr 842945516], length 64
08:11:47.821401 IP prabesha2026.ssh > 198.211.111.194.41568: Flags [P.], seq 16080:16304, ack 1, win 502, options [nop,nop,TS val 3346861389 ecr 842945516], length 224
08:11:47.821429 IP prabesha2026.ssh > 198.211.111.194.41568: Flags [P.], seq 16304:16368, ack 1, win 502, options [nop,nop,TS val 3346861389 ecr 842945516], length 64
08:11:47.821471 IP prabesha2026.ssh > 198.211.111.194.41568: Flags [P.], seq 16368:16592, ack 1, win 502, options [nop,nop,TS val 3346861389 ecr 842945516], length 224
08:11:47.821499 IP prabesha2026.ssh > 198.211.111.194.41568: Flags [P.], seq 16592:16656, ack 1, win 502, options [nop,nop,TS val 3346861389 ecr 842945516], length 64
08:11:47.821541 IP prabesha2026.ssh > 198.211.111.194.41568: Flags [P.], seq 16656:16880, ack 1, win 502, options [nop,nop,TS val 3346861389 ecr 842945516], length 224
08:11:47.821569 IP prabesha2026.ssh > 198.211.111.194.41568: Flags [P.], seq 16880:16944, ack 1, win 502, options [nop,nop,TS val 3346861390 ecr 842945516], length 64
08:11:47.821611 IP prabesha2026.ssh > 198.211.111.194.41568: Flags [P.], seq 16944:17168, ack 1, win 502, options [nop,nop,TS val 3346861390 ecr 842945516], length 224
08:11:47.821639 IP prabesha2026.ssh > 198.211.111.194.41568: Flags [P.], seq 17168:17232, ack 1, win 502, options [nop,nop,TS val 3346861390 ecr 842945516], length 64
08:11:47.821680 IP prabesha2026.ssh > 198.211.111.194.41568: Flags [P.], seq 17232:17456, ack 1, win 502, options [nop,nop,TS val 3346861390 ecr 842945516], length 224
08:11:47.821708 IP prabesha2026.ssh > 198.211.111.194.41568: Flags [P.], seq 17456:17520, ack 1, win 502, options [nop,nop,TS val 3346861390 ecr 842945516], length 64
08:11:47.821749 IP prabesha2026.ssh > 198.211.111.194.41568: Flags [P.], seq 17520:17744, ack 1, win 502, options [nop,nop,TS val 3346861390 ecr 842945516], length 224
08:11:47.821777 IP prabesha2026.ssh > 198.211.111.194.41568: Flags [P.], seq 17744:17808, ack 1, win 502, options [nop,nop,TS val 3346861390 ecr 842945516], length 64
08:11:47.821818 IP prabesha2026.ssh > 198.211.111.194.41568: Flags [P.], seq 17808:18032, ack 1, win 502, options [nop,nop,TS val 3346861390 ecr 842945516], length 224
08:11:47.821846 IP prabesha2026.ssh > 198.211.111.194.41568: Flags [P.], seq 18032:18096, ack 1, win 502, options [nop,nop,TS val 3346861390 ecr 842945516], length 64
08:11:47.821889 IP prabesha2026.ssh > 198.211.111.194.41568: Flags [P.], seq 18096:18320, ack 1, win 502, options [nop,nop,TS val 3346861390 ecr 842945516], length 224
08:11:47.821917 IP prabesha2026.ssh > 198.211.111.194.41568: Flags [P.], seq 18320:18384, ack 1, win 502, options [nop,nop,TS val 3346861390 ecr 842945516], length 64
08:11:47.821959 IP prabesha2026.ssh > 198.211.111.194.41568: Flags [P.], seq 18384:18608, ack 1, win 502, options [nop,nop,TS val 3346861390 ecr 842945516], length 224
08:11:47.821986 IP prabesha2026.ssh > 198.211.111.194.41568: Flags [P.], seq 18608:18672, ack 1, win 502, options [nop,nop,TS val 3346861390 ecr 842945516], length 64
08:11:47.822028 IP prabesha2026.ssh > 198.211.111.194.41568: Flags [P.], seq 18672:18896, ack 1, win 502, options [nop,nop,TS val 3346861390 ecr 842945516], length 224
08:11:47.822055 IP prabesha2026.ssh > 198.211.111.194.41568: Flags [P.], seq 18896:18960, ack 1, win 502, options [nop,nop,TS val 3346861390 ecr 842945516], length 64
08:11:47.822097 IP prabesha2026.ssh > 198.211.111.194.41568: Flags [P.], seq 18960:19184, ack 1, win 502, options [nop,nop,TS val 3346861390 ecr 842945516], length 224
08:11:47.822125 IP prabesha2026.ssh > 198.211.111.194.41568: Flags [P.], seq 19184:19248, ack 1, win 502, options [nop,nop,TS val 3346861390 ecr 842945516], length 64
08:11:47.822168 IP prabesha2026.ssh > 198.211.111.194.41568: Flags [P.], seq 19248:19472, ack 1, win 502, options [nop,nop,TS val 3346861390 ecr 842945516], length 224
08:11:47.822195 IP prabesha2026.ssh > 198.211.111.194.41568: Flags [P.], seq 19472:19536, ack 1, win 502, options [nop,nop,TS val 3346861390 ecr 842945516], length 64
08:11:47.822238 IP prabesha2026.ssh > 198.211.111.194.41568: Flags [P.], seq 19536:19760, ack 1, win 502, options [nop,nop,TS val 3346861390 ecr 842945516], length 224
08:11:47.822266 IP prabesha2026.ssh > 198.211.111.194.41568: Flags [P.], seq 19760:19824, ack 1, win 502, options [nop,nop,TS val 3346861390 ecr 842945516], length 64
08:11:47.822308 IP prabesha2026.ssh > 198.211.111.194.41568: Flags [P.], seq 19824:20032, ack 1, win 502, options [nop,nop,TS val 3346861390 ecr 842945516], length 208
08:11:47.822335 IP prabesha2026.ssh > 198.211.111.194.41568: Flags [P.], seq 20032:20096, ack 1, win 502, options [nop,nop,TS val 3346861390 ecr 842945516], length 64
08:11:47.835733 IP 198.211.111.194.41568 > prabesha2026.ssh: Flags [.], ack 12848, win 4378, options [nop,nop,TS val 842945605 ecr 3346861388], length 0
08:11:47.835804 IP prabesha2026.ssh > 198.211.111.194.41568: Flags [P.], seq 20096:21200, ack 1, win 502, options [nop,nop,TS val 3346861404 ecr 842945605], length 1104
08:11:47.836109 IP 198.211.111.194.41568 > prabesha2026.ssh: Flags [.], ack 14352, win 4367, options [nop,nop,TS val 842945605 ecr 3346861388], length 0
08:11:47.836479 IP 198.211.111.194.41568 > prabesha2026.ssh: Flags [.], ack 16016, win 4354, options [nop,nop,TS val 842945605 ecr 3346861389], length 0
08:11:47.836911 IP 198.211.111.194.41568 > prabesha2026.ssh: Flags [.], ack 17520, win 4343, options [nop,nop,TS val 842945606 ecr 3346861389], length 0
08:11:47.837327 IP 198.211.111.194.41568 > prabesha2026.ssh: Flags [.], ack 19248, win 4330, options [nop,nop,TS val 842945606 ecr 3346861390], length 0
08:11:47.852711 IP 198.211.111.194.41568 > prabesha2026.ssh: Flags [.], ack 21200, win 4315, options [nop,nop,TS val 842945622 ecr 3346861390], length 0
08:11:47.923866 IP prabesha2026.ssh > 198.211.111.194.41568: Flags [P.], seq 21200:21424, ack 1, win 502, options [nop,nop,TS val 3346861492 ecr 842945622], length 224
08:11:47.923931 IP prabesha2026.ssh > 198.211.111.194.41568: Flags [P.], seq 21424:21488, ack 1, win 502, options [nop,nop,TS val 3346861492 ecr 842945622], length 64
08:11:47.923984 IP prabesha2026.ssh > 198.211.111.194.41568: Flags [P.], seq 21488:21712, ack 1, win 502, options [nop,nop,TS val 3346861492 ecr 842945622], length 224
08:11:47.924014 IP prabesha2026.ssh > 198.211.111.194.41568: Flags [P.], seq 21712:21776, ack 1, win 502, options [nop,nop,TS val 3346861492 ecr 842945622], length 64
08:11:47.924060 IP prabesha2026.ssh > 198.211.111.194.41568: Flags [P.], seq 21776:22000, ack 1, win 502, options [nop,nop,TS val 3346861492 ecr 842945622], length 224
08:11:47.924088 IP prabesha2026.ssh > 198.211.111.194.41568: Flags [P.], seq 22000:22064, ack 1, win 502, options [nop,nop,TS val 3346861492 ecr 842945622], length 64
08:11:47.924133 IP prabesha2026.ssh > 198.211.111.194.41568: Flags [P.], seq 22064:22288, ack 1, win 502, options [nop,nop,TS val 3346861492 ecr 842945622], length 224
08:11:47.924168 IP prabesha2026.ssh > 198.211.111.194.41568: Flags [P.], seq 22288:22352, ack 1, win 502, options [nop,nop,TS val 3346861492 ecr 842945622], length 64
08:11:47.924319 IP prabesha2026.ssh > 198.211.111.194.41568: Flags [P.], seq 22352:22576, ack 1, win 502, options [nop,nop,TS val 3346861492 ecr 842945622], length 224
08:11:47.924358 IP prabesha2026.ssh > 198.211.111.194.41568: Flags [P.], seq 22576:22640, ack 1, win 502, options [nop,nop,TS val 3346861492 ecr 842945622], length 64
08:11:47.924410 IP prabesha2026.ssh > 198.211.111.194.41568: Flags [P.], seq 22640:22864, ack 1, win 502, options [nop,nop,TS val 3346861492 ecr 842945622], length 224
08:11:47.924439 IP prabesha2026.ssh > 198.211.111.194.41568: Flags [P.], seq 22864:22928, ack 1, win 502, options [nop,nop,TS val 3346861492 ecr 842945622], length 64
08:11:47.924482 IP prabesha2026.ssh > 198.211.111.194.41568: Flags [P.], seq 22928:23152, ack 1, win 502, options [nop,nop,TS val 3346861492 ecr 842945622], length 224
08:11:47.924509 IP prabesha2026.ssh > 198.211.111.194.41568: Flags [P.], seq 23152:23216, ack 1, win 502, options [nop,nop,TS val 3346861492 ecr 842945622], length 64
08:11:47.924552 IP prabesha2026.ssh > 198.211.111.194.41568: Flags [P.], seq 23216:23440, ack 1, win 502, options [nop,nop,TS val 3346861492 ecr 842945622], length 224
08:11:47.924580 IP prabesha2026.ssh > 198.211.111.194.41568: Flags [P.], seq 23440:23504, ack 1, win 502, options [nop,nop,TS val 3346861493 ecr 842945622], length 64
08:11:47.924622 IP prabesha2026.ssh > 198.211.111.194.41568: Flags [P.], seq 23504:23728, ack 1, win 502, options [nop,nop,TS val 3346861493 ecr 842945622], length 224
08:11:47.924650 IP prabesha2026.ssh > 198.211.111.194.41568: Flags [P.], seq 23728:23792, ack 1, win 502, options [nop,nop,TS val 3346861493 ecr 842945622], length 64
08:11:47.924692 IP prabesha2026.ssh > 198.211.111.194.41568: Flags [P.], seq 23792:24016, ack 1, win 502, options [nop,nop,TS val 3346861493 ecr 842945622], length 224
08:11:47.924721 IP prabesha2026.ssh > 198.211.111.194.41568: Flags [P.], seq 24016:24080, ack 1, win 502, options [nop,nop,TS val 3346861493 ecr 842945622], length 64
08:11:47.924763 IP prabesha2026.ssh > 198.211.111.194.41568: Flags [P.], seq 24080:24304, ack 1, win 502, options [nop,nop,TS val 3346861493 ecr 842945622], length 224
08:11:47.924790 IP prabesha2026.ssh > 198.211.111.194.41568: Flags [P.], seq 24304:24368, ack 1, win 502, options [nop,nop,TS val 3346861493 ecr 842945622], length 64
08:11:47.924833 IP prabesha2026.ssh > 198.211.111.194.41568: Flags [P.], seq 24368:24592, ack 1, win 502, options [nop,nop,TS val 3346861493 ecr 842945622], length 224
08:11:47.924886 IP prabesha2026.ssh > 198.211.111.194.41568: Flags [P.], seq 24592:24656, ack 1, win 502, options [nop,nop,TS val 3346861493 ecr 842945622], length 64
08:11:47.924934 IP prabesha2026.ssh > 198.211.111.194.41568: Flags [P.], seq 24656:24880, ack 1, win 502, options [nop,nop,TS val 3346861493 ecr 842945622], length 224
08:11:47.924962 IP prabesha2026.ssh > 198.211.111.194.41568: Flags [P.], seq 24880:24944, ack 1, win 502, options [nop,nop,TS val 3346861493 ecr 842945622], length 64
08:11:47.925004 IP prabesha2026.ssh > 198.211.111.194.41568: Flags [P.], seq 24944:25168, ack 1, win 502, options [nop,nop,TS val 3346861493 ecr 842945622], length 224
08:11:47.925032 IP prabesha2026.ssh > 198.211.111.194.41568: Flags [P.], seq 25168:25232, ack 1, win 502, options [nop,nop,TS val 3346861493 ecr 842945622], length 64
08:11:47.925075 IP prabesha2026.ssh > 198.211.111.194.41568: Flags [P.], seq 25232:25456, ack 1, win 502, options [nop,nop,TS val 3346861493 ecr 842945622], length 224
08:11:47.925103 IP prabesha2026.ssh > 198.211.111.194.41568: Flags [P.], seq 25456:25520, ack 1, win 502, options [nop,nop,TS val 3346861493 ecr 842945622], length 64
08:11:47.925164 IP prabesha2026.ssh > 198.211.111.194.41568: Flags [P.], seq 25520:25744, ack 1, win 502, options [nop,nop,TS val 3346861493 ecr 842945622], length 224
08:11:47.925209 IP prabesha2026.ssh > 198.211.111.194.41568: Flags [P.], seq 25744:25808, ack 1, win 502, options [nop,nop,TS val 3346861493 ecr 842945622], length 64
08:11:47.925282 IP prabesha2026.ssh > 198.211.111.194.41568: Flags [P.], seq 25808:26032, ack 1, win 502, options [nop,nop,TS val 3346861493 ecr 842945622], length 224
08:11:47.925326 IP prabesha2026.ssh > 198.211.111.194.41568: Flags [P.], seq 26032:26096, ack 1, win 502, options [nop,nop,TS val 3346861493 ecr 842945622], length 64
08:11:47.925406 IP prabesha2026.ssh > 198.211.111.194.41568: Flags [P.], seq 26096:26320, ack 1, win 502, options [nop,nop,TS val 3346861493 ecr 842945622], length 224
08:11:47.925444 IP prabesha2026.ssh > 198.211.111.194.41568: Flags [P.], seq 26320:26384, ack 1, win 502, options [nop,nop,TS val 3346861493 ecr 842945622], length 64
08:11:47.925509 IP prabesha2026.ssh > 198.211.111.194.41568: Flags [P.], seq 26384:26608, ack 1, win 502, options [nop,nop,TS val 3346861493 ecr 842945622], length 224
08:11:47.925543 IP prabesha2026.ssh > 198.211.111.194.41568: Flags [P.], seq 26608:26672, ack 1, win 502, options [nop,nop,TS val 3346861493 ecr 842945622], length 64
08:11:47.925589 IP prabesha2026.ssh > 198.211.111.194.41568: Flags [P.], seq 26672:26896, ack 1, win 502, options [nop,nop,TS val 3346861494 ecr 842945622], length 224
08:11:47.925616 IP prabesha2026.ssh > 198.211.111.194.41568: Flags [P.], seq 26896:26960, ack 1, win 502, options [nop,nop,TS val 3346861494 ecr 842945622], length 64
08:11:47.925659 IP prabesha2026.ssh > 198.211.111.194.41568: Flags [P.], seq 26960:27184, ack 1, win 502, options [nop,nop,TS val 3346861494 ecr 842945622], length 224
08:11:47.925686 IP prabesha2026.ssh > 198.211.111.194.41568: Flags [P.], seq 27184:27248, ack 1, win 502, options [nop,nop,TS val 3346861494 ecr 842945622], length 64
08:11:47.925726 IP prabesha2026.ssh > 198.211.111.194.41568: Flags [P.], seq 27248:27472, ack 1, win 502, options [nop,nop,TS val 3346861494 ecr 842945622], length 224
08:11:47.925753 IP prabesha2026.ssh > 198.211.111.194.41568: Flags [P.], seq 27472:27536, ack 1, win 502, options [nop,nop,TS val 3346861494 ecr 842945622], length 64
08:11:47.925794 IP prabesha2026.ssh > 198.211.111.194.41568: Flags [P.], seq 27536:27760, ack 1, win 502, options [nop,nop,TS val 3346861494 ecr 842945622], length 224
08:11:47.925821 IP prabesha2026.ssh > 198.211.111.194.41568: Flags [P.], seq 27760:27824, ack 1, win 502, options [nop,nop,TS val 3346861494 ecr 842945622], length 64
08:11:47.925863 IP prabesha2026.ssh > 198.211.111.194.41568: Flags [P.], seq 27824:28048, ack 1, win 502, options [nop,nop,TS val 3346861494 ecr 842945622], length 224
08:11:47.925890 IP prabesha2026.ssh > 198.211.111.194.41568: Flags [P.], seq 28048:28112, ack 1, win 502, options [nop,nop,TS val 3346861494 ecr 842945622], length 64
08:11:47.925932 IP prabesha2026.ssh > 198.211.111.194.41568: Flags [P.], seq 28112:28336, ack 1, win 502, options [nop,nop,TS val 3346861494 ecr 842945622], length 224
08:11:47.925976 IP prabesha2026.ssh > 198.211.111.194.41568: Flags [P.], seq 28336:28400, ack 1, win 502, options [nop,nop,TS val 3346861494 ecr 842945622], length 64
08:11:47.926029 IP prabesha2026.ssh > 198.211.111.194.41568: Flags [P.], seq 28400:28624, ack 1, win 502, options [nop,nop,TS val 3346861494 ecr 842945622], length 224
08:11:47.926080 IP prabesha2026.ssh > 198.211.111.194.41568: Flags [P.], seq 28624:28688, ack 1, win 502, options [nop,nop,TS val 3346861494 ecr 842945622], length 64
08:11:47.926130 IP prabesha2026.ssh > 198.211.111.194.41568: Flags [P.], seq 28688:28912, ack 1, win 502, options [nop,nop,TS val 3346861494 ecr 842945622], length 224
08:11:47.926155 IP prabesha2026.ssh > 198.211.111.194.41568: Flags [P.], seq 28912:28976, ack 1, win 502, options [nop,nop,TS val 3346861494 ecr 842945622], length 64
08:11:47.926204 IP prabesha2026.ssh > 198.211.111.194.41568: Flags [P.], seq 28976:29200, ack 1, win 502, options [nop,nop,TS val 3346861494 ecr 842945622], length 224
08:11:47.926229 IP prabesha2026.ssh > 198.211.111.194.41568: Flags [P.], seq 29200:29264, ack 1, win 502, options [nop,nop,TS val 3346861494 ecr 842945622], length 64
08:11:47.926265 IP prabesha2026.ssh > 198.211.111.194.41568: Flags [P.], seq 29264:29488, ack 1, win 502, options [nop,nop,TS val 3346861494 ecr 842945622], length 224
08:11:47.926288 IP prabesha2026.ssh > 198.211.111.194.41568: Flags [P.], seq 29488:29552, ack 1, win 502, options [nop,nop,TS val 3346861494 ecr 842945622], length 64
08:11:47.926323 IP prabesha2026.ssh > 198.211.111.194.41568: Flags [P.], seq 29552:29776, ack 1, win 502, options [nop,nop,TS val 3346861494 ecr 842945622], length 224
08:11:47.926347 IP prabesha2026.ssh > 198.211.111.194.41568: Flags [P.], seq 29776:29840, ack 1, win 502, options [nop,nop,TS val 3346861494 ecr 842945622], length 64
08:11:47.926382 IP prabesha2026.ssh > 198.211.111.194.41568: Flags [P.], seq 29840:30064, ack 1, win 502, options [nop,nop,TS val 3346861494 ecr 842945622], length 224
08:11:47.926404 IP prabesha2026.ssh > 198.211.111.194.41568: Flags [P.], seq 30064:30128, ack 1, win 502, options [nop,nop,TS val 3346861494 ecr 842945622], length 64
08:11:47.926472 IP prabesha2026.ssh > 198.211.111.194.41568: Flags [P.], seq 30128:30352, ack 1, win 502, options [nop,nop,TS val 3346861494 ecr 842945622], length 224
08:11:47.926514 IP prabesha2026.ssh > 198.211.111.194.41568: Flags [P.], seq 30352:30416, ack 1, win 502, options [nop,nop,TS val 3346861494 ecr 842945622], length 64
08:11:47.926552 IP prabesha2026.ssh > 198.211.111.194.41568: Flags [P.], seq 30416:30640, ack 1, win 502, options [nop,nop,TS val 3346861494 ecr 842945622], length 224
08:11:47.926575 IP prabesha2026.ssh > 198.211.111.194.41568: Flags [P.], seq 30640:30704, ack 1, win 502, options [nop,nop,TS val 3346861495 ecr 842945622], length 64
08:11:47.926612 IP prabesha2026.ssh > 198.211.111.194.41568: Flags [P.], seq 30704:30928, ack 1, win 502, options [nop,nop,TS val 3346861495 ecr 842945622], length 224
08:11:47.926636 IP prabesha2026.ssh > 198.211.111.194.41568: Flags [P.], seq 30928:30992, ack 1, win 502, options [nop,nop,TS val 3346861495 ecr 842945622], length 64
08:11:47.926672 IP prabesha2026.ssh > 198.211.111.194.41568: Flags [P.], seq 30992:31216, ack 1, win 502, options [nop,nop,TS val 3346861495 ecr 842945622], length 224
08:11:47.926696 IP prabesha2026.ssh > 198.211.111.194.41568: Flags [P.], seq 31216:31280, ack 1, win 502, options [nop,nop,TS val 3346861495 ecr 842945622], length 64
08:11:47.926734 IP prabesha2026.ssh > 198.211.111.194.41568: Flags [P.], seq 31280:31504, ack 1, win 502, options [nop,nop,TS val 3346861495 ecr 842945622], length 224
08:11:47.926758 IP prabesha2026.ssh > 198.211.111.194.41568: Flags [P.], seq 31504:31568, ack 1, win 502, options [nop,nop,TS val 3346861495 ecr 842945622], length 64
08:11:47.926794 IP prabesha2026.ssh > 198.211.111.194.41568: Flags [P.], seq 31568:31792, ack 1, win 502, options [nop,nop,TS val 3346861495 ecr 842945622], length 224
08:11:47.926831 IP prabesha2026.ssh > 198.211.111.194.41568: Flags [P.], seq 31792:31856, ack 1, win 502, options [nop,nop,TS val 3346861495 ecr 842945622], length 64
08:11:47.926868 IP prabesha2026.ssh > 198.211.111.194.41568: Flags [P.], seq 31856:32080, ack 1, win 502, options [nop,nop,TS val 3346861495 ecr 842945622], length 224
08:11:47.926892 IP prabesha2026.ssh > 198.211.111.194.41568: Flags [P.], seq 32080:32144, ack 1, win 502, options [nop,nop,TS val 3346861495 ecr 842945622], length 64
08:11:47.926927 IP prabesha2026.ssh > 198.211.111.194.41568: Flags [P.], seq 32144:32368, ack 1, win 502, options [nop,nop,TS val 3346861495 ecr 842945622], length 224
08:11:47.926960 IP prabesha2026.ssh > 198.211.111.194.41568: Flags [P.], seq 32368:32432, ack 1, win 502, options [nop,nop,TS val 3346861495 ecr 842945622], length 64
08:11:47.927009 IP prabesha2026.ssh > 198.211.111.194.41568: Flags [P.], seq 32432:32656, ack 1, win 502, options [nop,nop,TS val 3346861495 ecr 842945622], length 224
08:11:47.927037 IP prabesha2026.ssh > 198.211.111.194.41568: Flags [P.], seq 32656:32720, ack 1, win 502, options [nop,nop,TS val 3346861495 ecr 842945622], length 64
08:11:47.927091 IP prabesha2026.ssh > 198.211.111.194.41568: Flags [P.], seq 32720:32944, ack 1, win 502, options [nop,nop,TS val 3346861495 ecr 842945622], length 224
08:11:47.927127 IP prabesha2026.ssh > 198.211.111.194.41568: Flags [P.], seq 32944:33008, ack 1, win 502, options [nop,nop,TS val 3346861495 ecr 842945622], length 64
08:11:47.927184 IP prabesha2026.ssh > 198.211.111.194.41568: Flags [P.], seq 33008:33232, ack 1, win 502, options [nop,nop,TS val 3346861495 ecr 842945622], length 224
08:11:47.927214 IP prabesha2026.ssh > 198.211.111.194.41568: Flags [P.], seq 33232:33296, ack 1, win 502, options [nop,nop,TS val 3346861495 ecr 842945622], length 64
08:11:47.927259 IP prabesha2026.ssh > 198.211.111.194.41568: Flags [P.], seq 33296:33520, ack 1, win 502, options [nop,nop,TS val 3346861495 ecr 842945622], length 224
08:11:47.927288 IP prabesha2026.ssh > 198.211.111.194.41568: Flags [P.], seq 33520:33584, ack 1, win 502, options [nop,nop,TS val 3346861495 ecr 842945622], length 64
08:11:47.927333 IP prabesha2026.ssh > 198.211.111.194.41568: Flags [P.], seq 33584:33808, ack 1, win 502, options [nop,nop,TS val 3346861495 ecr 842945622], length 224
08:11:47.927360 IP prabesha2026.ssh > 198.211.111.194.41568: Flags [P.], seq 33808:33872, ack 1, win 502, options [nop,nop,TS val 3346861495 ecr 842945622], length 64
08:11:47.927401 IP prabesha2026.ssh > 198.211.111.194.41568: Flags [P.], seq 33872:34096, ack 1, win 502, options [nop,nop,TS val 3346861495 ecr 842945622], length 224
08:11:47.927427 IP prabesha2026.ssh > 198.211.111.194.41568: Flags [P.], seq 34096:34160, ack 1, win 502, options [nop,nop,TS val 3346861495 ecr 842945622], length 64
08:11:47.927468 IP prabesha2026.ssh > 198.211.111.194.41568: Flags [P.], seq 34160:34384, ack 1, win 502, options [nop,nop,TS val 3346861495 ecr 842945622], length 224
08:11:47.927522 IP prabesha2026.ssh > 198.211.111.194.41568: Flags [P.], seq 34384:34448, ack 1, win 502, options [nop,nop,TS val 3346861495 ecr 842945622], length 64
08:11:47.927600 IP prabesha2026.ssh > 198.211.111.194.41568: Flags [P.], seq 34448:34672, ack 1, win 502, options [nop,nop,TS val 3346861496 ecr 842945622], length 224
08:11:47.927664 IP prabesha2026.ssh > 198.211.111.194.41568: Flags [P.], seq 34672:34896, ack 1, win 502, options [nop,nop,TS val 3346861496 ecr 842945622], length 224
08:11:47.927739 IP prabesha2026.ssh > 198.211.111.194.41568: Flags [P.], seq 34896:35296, ack 1, win 502, options [nop,nop,TS val 3346861496 ecr 842945622], length 400
08:11:47.927804 IP prabesha2026.ssh > 198.211.111.194.41568: Flags [P.], seq 35296:35696, ack 1, win 502, options [nop,nop,TS val 3346861496 ecr 842945622], length 400
08:11:47.927868 IP prabesha2026.ssh > 198.211.111.194.41568: Flags [P.], seq 35696:36096, ack 1, win 502, options [nop,nop,TS val 3346861496 ecr 842945622], length 400
08:11:47.927915 IP prabesha2026.ssh > 198.211.111.194.41568: Flags [P.], seq 36096:36320, ack 1, win 502, options [nop,nop,TS val 3346861496 ecr 842945622], length 224
08:11:47.927978 IP prabesha2026.ssh > 198.211.111.194.41568: Flags [P.], seq 36320:36720, ack 1, win 502, options [nop,nop,TS val 3346861496 ecr 842945622], length 400
08:11:47.928024 IP prabesha2026.ssh > 198.211.111.194.41568: Flags [P.], seq 36720:36944, ack 1, win 502, options [nop,nop,TS val 3346861496 ecr 842945622], length 224
08:11:47.928081 IP prabesha2026.ssh > 198.211.111.194.41568: Flags [P.], seq 36944:37168, ack 1, win 502, options [nop,nop,TS val 3346861496 ecr 842945622], length 224
08:11:47.928165 IP prabesha2026.ssh > 198.211.111.194.41568: Flags [P.], seq 37168:37568, ack 1, win 502, options [nop,nop,TS val 3346861496 ecr 842945622], length 400
08:11:47.928283 IP prabesha2026.ssh > 198.211.111.194.41568: Flags [P.], seq 37568:37952, ack 1, win 502, options [nop,nop,TS val 3346861496 ecr 842945622], length 384
08:11:47.928377 IP prabesha2026.ssh > 198.211.111.194.41568: Flags [P.], seq 37952:38336, ack 1, win 502, options [nop,nop,TS val 3346861496 ecr 842945622], length 384
08:11:47.928481 IP prabesha2026.ssh > 198.211.111.194.41568: Flags [P.], seq 38336:38848, ack 1, win 502, options [nop,nop,TS val 3346861496 ecr 842945622], length 512
08:11:47.928543 IP prabesha2026.ssh > 198.211.111.194.41568: Flags [P.], seq 38848:39056, ack 1, win 502, options [nop,nop,TS val 3346861496 ecr 842945622], length 208
08:11:47.939666 IP 198.211.111.194.41568 > prabesha2026.ssh: Flags [.], ack 22864, win 4378, options [nop,nop,TS val 842945709 ecr 3346861492], length 0
08:11:47.939994 IP 198.211.111.194.41568 > prabesha2026.ssh: Flags [.], ack 24368, win 4367, options [nop,nop,TS val 842945709 ecr 3346861492], length 0
08:11:47.940469 IP 198.211.111.194.41568 > prabesha2026.ssh: Flags [.], ack 26032, win 4354, options [nop,nop,TS val 842945709 ecr 3346861493], length 0
08:11:47.940990 IP 198.211.111.194.41568 > prabesha2026.ssh: Flags [.], ack 27536, win 4343, options [nop,nop,TS val 842945710 ecr 3346861493], length 0
08:11:47.941447 IP 198.211.111.194.41568 > prabesha2026.ssh: Flags [.], ack 29264, win 4330, options [nop,nop,TS val 842945710 ecr 3346861494], length 0
08:11:47.941806 IP 198.211.111.194.41568 > prabesha2026.ssh: Flags [.], ack 30928, win 4317, options [nop,nop,TS val 842945711 ecr 3346861494], length 0
08:11:47.942215 IP 198.211.111.194.41568 > prabesha2026.ssh: Flags [.], ack 32432, win 4306, options [nop,nop,TS val 842945711 ecr 3346861495], length 0
08:11:47.942631 IP 198.211.111.194.41568 > prabesha2026.ssh: Flags [.], ack 34096, win 4293, options [nop,nop,TS val 842945712 ecr 3346861495], length 0
08:11:47.943007 IP 198.211.111.194.41568 > prabesha2026.ssh: Flags [.], ack 35696, win 4281, options [nop,nop,TS val 842945712 ecr 3346861495], length 0
08:11:47.943290 IP 198.211.111.194.41568 > prabesha2026.ssh: Flags [.], ack 37168, win 4270, options [nop,nop,TS val 842945712 ecr 3346861496], length 0
08:11:47.943690 IP 198.211.111.194.41568 > prabesha2026.ssh: Flags [.], ack 38848, win 4257, options [nop,nop,TS val 842945713 ecr 3346861496], length 0
08:11:47.984623 IP 198.211.111.194.41568 > prabesha2026.ssh: Flags [.], ack 39056, win 4256, options [nop,nop,TS val 842945753 ecr 3346861496], length 0
08:11:48.027860 IP prabesha2026.ssh > 198.211.111.194.41568: Flags [P.], seq 39056:39280, ack 1, win 502, options [nop,nop,TS val 3346861596 ecr 842945753], length 224
08:11:48.027979 IP prabesha2026.ssh > 198.211.111.194.41568: Flags [P.], seq 39280:39504, ack 1, win 502, options [nop,nop,TS val 3346861596 ecr 842945753], length 224
08:11:48.028081 IP prabesha2026.ssh > 198.211.111.194.41568: Flags [P.], seq 39504:39728, ack 1, win 502, options [nop,nop,TS val 3346861596 ecr 842945753], length 224
08:11:48.028154 IP prabesha2026.ssh > 198.211.111.194.41568: Flags [P.], seq 39728:39952, ack 1, win 502, options [nop,nop,TS val 3346861596 ecr 842945753], length 224
08:11:48.028276 IP prabesha2026.ssh > 198.211.111.194.41568: Flags [P.], seq 39952:40176, ack 1, win 502, options [nop,nop,TS val 3346861596 ecr 842945753], length 224
08:11:48.028318 IP prabesha2026.ssh > 198.211.111.194.41568: Flags [P.], seq 40176:40240, ack 1, win 502, options [nop,nop,TS val 3346861596 ecr 842945753], length 64
08:11:48.028388 IP prabesha2026.ssh > 198.211.111.194.41568: Flags [P.], seq 40240:40464, ack 1, win 502, options [nop,nop,TS val 3346861596 ecr 842945753], length 224
08:11:48.028464 IP prabesha2026.ssh > 198.211.111.194.41568: Flags [P.], seq 40464:40688, ack 1, win 502, options [nop,nop,TS val 3346861596 ecr 842945753], length 224
08:11:48.028536 IP prabesha2026.ssh > 198.211.111.194.41568: Flags [P.], seq 40688:40912, ack 1, win 502, options [nop,nop,TS val 3346861596 ecr 842945753], length 224
08:11:48.028629 IP prabesha2026.ssh > 198.211.111.194.41568: Flags [P.], seq 40912:41312, ack 1, win 502, options [nop,nop,TS val 3346861597 ecr 842945753], length 400
08:11:48.028743 IP prabesha2026.ssh > 198.211.111.194.41568: Flags [P.], seq 41312:41872, ack 1, win 502, options [nop,nop,TS val 3346861597 ecr 842945753], length 560
08:11:48.028840 IP prabesha2026.ssh > 198.211.111.194.41568: Flags [P.], seq 41872:42272, ack 1, win 502, options [nop,nop,TS val 3346861597 ecr 842945753], length 400
08:11:48.028929 IP prabesha2026.ssh > 198.211.111.194.41568: Flags [P.], seq 42272:42672, ack 1, win 502, options [nop,nop,TS val 3346861597 ecr 842945753], length 400
08:11:48.029036 IP prabesha2026.ssh > 198.211.111.194.41568: Flags [P.], seq 42672:43408, ack 1, win 502, options [nop,nop,TS val 3346861597 ecr 842945753], length 736
08:11:48.029116 IP prabesha2026.ssh > 198.211.111.194.41568: Flags [P.], seq 43408:43808, ack 1, win 502, options [nop,nop,TS val 3346861597 ecr 842945753], length 400
08:11:48.029189 IP prabesha2026.ssh > 198.211.111.194.41568: Flags [P.], seq 43808:44032, ack 1, win 502, options [nop,nop,TS val 3346861597 ecr 842945753], length 224
08:11:48.029274 IP prabesha2026.ssh > 198.211.111.194.41568: Flags [P.], seq 44032:44592, ack 1, win 502, options [nop,nop,TS val 3346861597 ecr 842945753], length 560
08:11:48.029322 IP prabesha2026.ssh > 198.211.111.194.41568: Flags [P.], seq 44592:44816, ack 1, win 502, options [nop,nop,TS val 3346861597 ecr 842945753], length 224
08:11:48.029383 IP prabesha2026.ssh > 198.211.111.194.41568: Flags [P.], seq 44816:45216, ack 1, win 502, options [nop,nop,TS val 3346861597 ecr 842945753], length 400
08:11:48.029446 IP prabesha2026.ssh > 198.211.111.194.41568: Flags [P.], seq 45216:45616, ack 1, win 502, options [nop,nop,TS val 3346861597 ecr 842945753], length 400
08:11:48.029492 IP prabesha2026.ssh > 198.211.111.194.41568: Flags [P.], seq 45616:45840, ack 1, win 502, options [nop,nop,TS val 3346861597 ecr 842945753], length 224
08:11:48.029555 IP prabesha2026.ssh > 198.211.111.194.41568: Flags [P.], seq 45840:46240, ack 1, win 502, options [nop,nop,TS val 3346861597 ecr 842945753], length 400
08:11:48.029624 IP prabesha2026.ssh > 198.211.111.194.41568: Flags [P.], seq 46240:46464, ack 1, win 502, options [nop,nop,TS val 3346861598 ecr 842945753], length 224
08:11:48.029715 IP prabesha2026.ssh > 198.211.111.194.41568: Flags [P.], seq 46464:47024, ack 1, win 502, options [nop,nop,TS val 3346861598 ecr 842945753], length 560
08:11:48.029784 IP prabesha2026.ssh > 198.211.111.194.41568: Flags [P.], seq 47024:47424, ack 1, win 502, options [nop,nop,TS val 3346861598 ecr 842945753], length 400
08:11:48.029847 IP prabesha2026.ssh > 198.211.111.194.41568: Flags [P.], seq 47424:47824, ack 1, win 502, options [nop,nop,TS val 3346861598 ecr 842945753], length 400
08:11:48.029905 IP prabesha2026.ssh > 198.211.111.194.41568: Flags [P.], seq 47824:48048, ack 1, win 502, options [nop,nop,TS val 3346861598 ecr 842945753], length 224
08:11:48.029970 IP prabesha2026.ssh > 198.211.111.194.41568: Flags [P.], seq 48048:48448, ack 1, win 502, options [nop,nop,TS val 3346861598 ecr 842945753], length 400
08:11:48.030017 IP prabesha2026.ssh > 198.211.111.194.41568: Flags [P.], seq 48448:48672, ack 1, win 502, options [nop,nop,TS val 3346861598 ecr 842945753], length 224
08:11:48.030082 IP prabesha2026.ssh > 198.211.111.194.41568: Flags [P.], seq 48672:48896, ack 1, win 502, options [nop,nop,TS val 3346861598 ecr 842945753], length 224
08:11:48.030161 IP prabesha2026.ssh > 198.211.111.194.41568: Flags [P.], seq 48896:49296, ack 1, win 502, options [nop,nop,TS val 3346861598 ecr 842945753], length 400
08:11:48.030217 IP prabesha2026.ssh > 198.211.111.194.41568: Flags [P.], seq 49296:49520, ack 1, win 502, options [nop,nop,TS val 3346861598 ecr 842945753], length 224
08:11:48.030302 IP prabesha2026.ssh > 198.211.111.194.41568: Flags [P.], seq 49520:49920, ack 1, win 502, options [nop,nop,TS val 3346861598 ecr 842945753], length 400
08:11:48.030395 IP prabesha2026.ssh > 198.211.111.194.41568: Flags [P.], seq 49920:50480, ack 1, win 502, options [nop,nop,TS val 3346861598 ecr 842945753], length 560
08:11:48.030478 IP prabesha2026.ssh > 198.211.111.194.41568: Flags [P.], seq 50480:50880, ack 1, win 502, options [nop,nop,TS val 3346861598 ecr 842945753], length 400
08:11:48.030635 IP prabesha2026.ssh > 198.211.111.194.41568: Flags [P.], seq 50880:51280, ack 1, win 502, options [nop,nop,TS val 3346861599 ecr 842945753], length 400
08:11:48.030827 IP prabesha2026.ssh > 198.211.111.194.41568: Flags [P.], seq 51280:52016, ack 1, win 502, options [nop,nop,TS val 3346861599 ecr 842945753], length 736
08:11:48.030922 IP prabesha2026.ssh > 198.211.111.194.41568: Flags [P.], seq 52016:52416, ack 1, win 502, options [nop,nop,TS val 3346861599 ecr 842945753], length 400
08:11:48.031033 IP prabesha2026.ssh > 198.211.111.194.41568: Flags [P.], seq 52416:52976, ack 1, win 502, options [nop,nop,TS val 3346861599 ecr 842945753], length 560
08:11:48.031122 IP prabesha2026.ssh > 198.211.111.194.41568: Flags [P.], seq 52976:53536, ack 1, win 502, options [nop,nop,TS val 3346861599 ecr 842945753], length 560
08:11:48.031188 IP prabesha2026.ssh > 198.211.111.194.41568: Flags [P.], seq 53536:53936, ack 1, win 502, options [nop,nop,TS val 3346861599 ecr 842945753], length 400
08:11:48.031234 IP prabesha2026.ssh > 198.211.111.194.41568: Flags [P.], seq 53936:54160, ack 1, win 502, options [nop,nop,TS val 3346861599 ecr 842945753], length 224
08:11:48.031297 IP prabesha2026.ssh > 198.211.111.194.41568: Flags [P.], seq 54160:54560, ack 1, win 502, options [nop,nop,TS val 3346861599 ecr 842945753], length 400
08:11:48.031348 IP prabesha2026.ssh > 198.211.111.194.41568: Flags [P.], seq 54560:54784, ack 1, win 502, options [nop,nop,TS val 3346861599 ecr 842945753], length 224
08:11:48.031409 IP prabesha2026.ssh > 198.211.111.194.41568: Flags [P.], seq 54784:55184, ack 1, win 502, options [nop,nop,TS val 3346861599 ecr 842945753], length 400
08:11:48.031472 IP prabesha2026.ssh > 198.211.111.194.41568: Flags [P.], seq 55184:55584, ack 1, win 502, options [nop,nop,TS val 3346861599 ecr 842945753], length 400
08:11:48.031535 IP prabesha2026.ssh > 198.211.111.194.41568: Flags [P.], seq 55584:55984, ack 1, win 502, options [nop,nop,TS val 3346861599 ecr 842945753], length 400
08:11:48.031602 IP prabesha2026.ssh > 198.211.111.194.41568: Flags [P.], seq 55984:56208, ack 1, win 502, options [nop,nop,TS val 3346861600 ecr 842945753], length 224
08:11:48.031655 IP prabesha2026.ssh > 198.211.111.194.41568: Flags [P.], seq 56208:56272, ack 1, win 502, options [nop,nop,TS val 3346861600 ecr 842945753], length 64
08:11:48.031699 IP prabesha2026.ssh > 198.211.111.194.41568: Flags [P.], seq 56272:56496, ack 1, win 502, options [nop,nop,TS val 3346861600 ecr 842945753], length 224
08:11:48.031745 IP prabesha2026.ssh > 198.211.111.194.41568: Flags [P.], seq 56496:56720, ack 1, win 502, options [nop,nop,TS val 3346861600 ecr 842945753], length 224
08:11:48.031811 IP prabesha2026.ssh > 198.211.111.194.41568: Flags [P.], seq 56720:57120, ack 1, win 502, options [nop,nop,TS val 3346861600 ecr 842945753], length 400
08:11:48.031873 IP prabesha2026.ssh > 198.211.111.194.41568: Flags [P.], seq 57120:57520, ack 1, win 502, options [nop,nop,TS val 3346861600 ecr 842945753], length 400
08:11:48.031919 IP prabesha2026.ssh > 198.211.111.194.41568: Flags [P.], seq 57520:57744, ack 1, win 502, options [nop,nop,TS val 3346861600 ecr 842945753], length 224
08:11:48.031989 IP prabesha2026.ssh > 198.211.111.194.41568: Flags [P.], seq 57744:58144, ack 1, win 502, options [nop,nop,TS val 3346861600 ecr 842945753], length 400
08:11:48.032063 IP prabesha2026.ssh > 198.211.111.194.41568: Flags [P.], seq 58144:58544, ack 1, win 502, options [nop,nop,TS val 3346861600 ecr 842945753], length 400
08:11:48.032148 IP prabesha2026.ssh > 198.211.111.194.41568: Flags [P.], seq 58544:58768, ack 1, win 502, options [nop,nop,TS val 3346861600 ecr 842945753], length 224
08:11:48.032273 IP prabesha2026.ssh > 198.211.111.194.41568: Flags [P.], seq 58768:59168, ack 1, win 502, options [nop,nop,TS val 3346861600 ecr 842945753], length 400
08:11:48.032371 IP prabesha2026.ssh > 198.211.111.194.41568: Flags [P.], seq 59168:59728, ack 1, win 502, options [nop,nop,TS val 3346861600 ecr 842945753], length 560
08:11:48.032460 IP prabesha2026.ssh > 198.211.111.194.41568: Flags [P.], seq 59728:60128, ack 1, win 502, options [nop,nop,TS val 3346861600 ecr 842945753], length 400
08:11:48.032579 IP prabesha2026.ssh > 198.211.111.194.41568: Flags [P.], seq 60128:60672, ack 1, win 502, options [nop,nop,TS val 3346861601 ecr 842945753], length 544
08:11:48.032671 IP prabesha2026.ssh > 198.211.111.194.41568: Flags [P.], seq 60672:61040, ack 1, win 502, options [nop,nop,TS val 3346861601 ecr 842945753], length 368
08:11:48.032754 IP prabesha2026.ssh > 198.211.111.194.41568: Flags [P.], seq 61040:61552, ack 1, win 502, options [nop,nop,TS val 3346861601 ecr 842945753], length 512
08:11:48.032817 IP prabesha2026.ssh > 198.211.111.194.41568: Flags [P.], seq 61552:61920, ack 1, win 502, options [nop,nop,TS val 3346861601 ecr 842945753], length 368
08:11:48.032898 IP prabesha2026.ssh > 198.211.111.194.41568: Flags [P.], seq 61920:62128, ack 1, win 502, options [nop,nop,TS val 3346861601 ecr 842945753], length 208
08:11:48.032965 IP prabesha2026.ssh > 198.211.111.194.41568: Flags [P.], seq 62128:62336, ack 1, win 502, options [nop,nop,TS val 3346861601 ecr 842945753], length 208
08:11:48.033054 IP prabesha2026.ssh > 198.211.111.194.41568: Flags [P.], seq 62336:62704, ack 1, win 502, options [nop,nop,TS val 3346861601 ecr 842945753], length 368
08:11:48.033108 IP prabesha2026.ssh > 198.211.111.194.41568: Flags [P.], seq 62704:62768, ack 1, win 502, options [nop,nop,TS val 3346861601 ecr 842945753], length 64
08:11:48.043783 IP 198.211.111.194.41568 > prabesha2026.ssh: Flags [.], ack 40688, win 4378, options [nop,nop,TS val 842945813 ecr 3346861596], length 0
08:11:48.044023 IP 198.211.111.194.41568 > prabesha2026.ssh: Flags [.], ack 42272, win 4366, options [nop,nop,TS val 842945813 ecr 3346861596], length 0
08:11:48.044350 IP 198.211.111.194.41568 > prabesha2026.ssh: Flags [.], ack 43808, win 4354, options [nop,nop,TS val 842945813 ecr 3346861597], length 0
08:11:48.044660 IP 198.211.111.194.41568 > prabesha2026.ssh: Flags [.], ack 45616, win 4340, options [nop,nop,TS val 842945814 ecr 3346861597], length 0
08:11:48.044988 IP 198.211.111.194.41568 > prabesha2026.ssh: Flags [.], ack 47424, win 4326, options [nop,nop,TS val 842945814 ecr 3346861597], length 0
08:11:48.045309 IP 198.211.111.194.41568 > prabesha2026.ssh: Flags [.], ack 48896, win 4315, options [nop,nop,TS val 842945814 ecr 3346861598], length 0
08:11:48.045575 IP 198.211.111.194.41568 > prabesha2026.ssh: Flags [.], ack 50480, win 4303, options [nop,nop,TS val 842945814 ecr 3346861598], length 0
08:11:48.046029 IP 198.211.111.194.41568 > prabesha2026.ssh: Flags [.], ack 52016, win 4291, options [nop,nop,TS val 842945815 ecr 3346861598], length 0
08:11:48.046319 IP 198.211.111.194.41568 > prabesha2026.ssh: Flags [.], ack 53536, win 4280, options [nop,nop,TS val 842945815 ecr 3346861599], length 0
08:11:48.046404 IP 198.211.111.194.41568 > prabesha2026.ssh: Flags [.], ack 54160, win 4276, options [nop,nop,TS val 842945815 ecr 3346861599], length 0
08:11:48.046506 IP 198.211.111.194.41568 > prabesha2026.ssh: Flags [.], ack 54784, win 4272, options [nop,nop,TS val 842945815 ecr 3346861599], length 0
08:11:48.046645 IP 198.211.111.194.41568 > prabesha2026.ssh: Flags [.], ack 55584, win 4266, options [nop,nop,TS val 842945816 ecr 3346861599], length 0
08:11:48.046774 IP 198.211.111.194.41568 > prabesha2026.ssh: Flags [.], ack 56208, win 4262, options [nop,nop,TS val 842945816 ecr 3346861599], length 0
08:11:48.047083 IP 198.211.111.194.41568 > prabesha2026.ssh: Flags [.], ack 57120, win 4255, options [nop,nop,TS val 842945816 ecr 3346861600], length 0
08:11:48.047083 IP 198.211.111.194.41568 > prabesha2026.ssh: Flags [.], ack 57744, win 4251, options [nop,nop,TS val 842945816 ecr 3346861600], length 0
08:11:48.047240 IP 198.211.111.194.41568 > prabesha2026.ssh: Flags [.], ack 58544, win 4245, options [nop,nop,TS val 842945816 ecr 3346861600], length 0
08:11:48.047557 IP 198.211.111.194.41568 > prabesha2026.ssh: Flags [.], ack 59168, win 4241, options [nop,nop,TS val 842945816 ecr 3346861600], length 0
08:11:48.047703 IP 198.211.111.194.41568 > prabesha2026.ssh: Flags [.], ack 60128, win 4234, options [nop,nop,TS val 842945817 ecr 3346861600], length 0
08:11:48.047849 IP 198.211.111.194.41568 > prabesha2026.ssh: Flags [.], ack 61040, win 4227, options [nop,nop,TS val 842945817 ecr 3346861601], length 0
08:11:48.048020 IP 198.211.111.194.41568 > prabesha2026.ssh: Flags [.], ack 61920, win 4221, options [nop,nop,TS val 842945817 ecr 3346861601], length 0
08:11:48.048280 IP 198.211.111.194.41568 > prabesha2026.ssh: Flags [.], ack 62704, win 4215, options [nop,nop,TS val 842945817 ecr 3346861601], length 0
08:11:48.092633 IP 198.211.111.194.41568 > prabesha2026.ssh: Flags [.], ack 62768, win 4215, options [nop,nop,TS val 842945861 ecr 3346861601], length 0
08:11:48.131852 IP prabesha2026.ssh > 198.211.111.194.41568: Flags [P.], seq 62768:62992, ack 1, win 502, options [nop,nop,TS val 3346861700 ecr 842945861], length 224
08:11:48.131961 IP prabesha2026.ssh > 198.211.111.194.41568: Flags [P.], seq 62992:63392, ack 1, win 502, options [nop,nop,TS val 3346861700 ecr 842945861], length 400
08:11:48.132028 IP prabesha2026.ssh > 198.211.111.194.41568: Flags [P.], seq 63392:63792, ack 1, win 502, options [nop,nop,TS val 3346861700 ecr 842945861], length 400
08:11:48.132092 IP prabesha2026.ssh > 198.211.111.194.41568: Flags [P.], seq 63792:64192, ack 1, win 502, options [nop,nop,TS val 3346861700 ecr 842945861], length 400
08:11:48.132141 IP prabesha2026.ssh > 198.211.111.194.41568: Flags [P.], seq 64192:64416, ack 1, win 502, options [nop,nop,TS val 3346861700 ecr 842945861], length 224
08:11:48.132258 IP prabesha2026.ssh > 198.211.111.194.41568: Flags [P.], seq 64416:64816, ack 1, win 502, options [nop,nop,TS val 3346861700 ecr 842945861], length 400
08:11:48.132390 IP prabesha2026.ssh > 198.211.111.194.41568: Flags [P.], seq 64816:66224, ack 1, win 502, options [nop,nop,TS val 3346861700 ecr 842945861], length 1408
08:11:48.132469 IP prabesha2026.ssh > 198.211.111.194.41568: Flags [P.], seq 66224:66960, ack 1, win 502, options [nop,nop,TS val 3346861700 ecr 842945861], length 736
08:11:48.132541 IP prabesha2026.ssh > 198.211.111.194.41568: Flags [P.], seq 66960:67184, ack 1, win 502, options [nop,nop,TS val 3346861700 ecr 842945861], length 224
08:11:48.132582 IP prabesha2026.ssh > 198.211.111.194.41568: Flags [P.], seq 67184:67408, ack 1, win 502, options [nop,nop,TS val 3346861701 ecr 842945861], length 224
08:11:48.132633 IP prabesha2026.ssh > 198.211.111.194.41568: Flags [P.], seq 67408:67808, ack 1, win 502, options [nop,nop,TS val 3346861701 ecr 842945861], length 400
08:11:48.132674 IP prabesha2026.ssh > 198.211.111.194.41568: Flags [P.], seq 67808:68032, ack 1, win 502, options [nop,nop,TS val 3346861701 ecr 842945861], length 224
08:11:48.132723 IP prabesha2026.ssh > 198.211.111.194.41568: Flags [P.], seq 68032:68432, ack 1, win 502, options [nop,nop,TS val 3346861701 ecr 842945861], length 400
08:11:48.132774 IP prabesha2026.ssh > 198.211.111.194.41568: Flags [P.], seq 68432:68832, ack 1, win 502, options [nop,nop,TS val 3346861701 ecr 842945861], length 400
08:11:48.132824 IP prabesha2026.ssh > 198.211.111.194.41568: Flags [P.], seq 68832:69232, ack 1, win 502, options [nop,nop,TS val 3346861701 ecr 842945861], length 400
08:11:48.132875 IP prabesha2026.ssh > 198.211.111.194.41568: Flags [P.], seq 69232:69632, ack 1, win 502, options [nop,nop,TS val 3346861701 ecr 842945861], length 400
08:11:48.132925 IP prabesha2026.ssh > 198.211.111.194.41568: Flags [P.], seq 69632:70032, ack 1, win 502, options [nop,nop,TS val 3346861701 ecr 842945861], length 400
08:11:48.132976 IP prabesha2026.ssh > 198.211.111.194.41568: Flags [P.], seq 70032:70432, ack 1, win 502, options [nop,nop,TS val 3346861701 ecr 842945861], length 400
08:11:48.133027 IP prabesha2026.ssh > 198.211.111.194.41568: Flags [P.], seq 70432:70832, ack 1, win 502, options [nop,nop,TS val 3346861701 ecr 842945861], length 400
08:11:48.133077 IP prabesha2026.ssh > 198.211.111.194.41568: Flags [P.], seq 70832:71232, ack 1, win 502, options [nop,nop,TS val 3346861701 ecr 842945861], length 400
08:11:48.133118 IP prabesha2026.ssh > 198.211.111.194.41568: Flags [P.], seq 71232:71456, ack 1, win 502, options [nop,nop,TS val 3346861701 ecr 842945861], length 224
08:11:48.133167 IP prabesha2026.ssh > 198.211.111.194.41568: Flags [P.], seq 71456:71856, ack 1, win 502, options [nop,nop,TS val 3346861701 ecr 842945861], length 400
08:11:48.133218 IP prabesha2026.ssh > 198.211.111.194.41568: Flags [P.], seq 71856:72256, ack 1, win 502, options [nop,nop,TS val 3346861701 ecr 842945861], length 400
08:11:48.133269 IP prabesha2026.ssh > 198.211.111.194.41568: Flags [P.], seq 72256:72656, ack 1, win 502, options [nop,nop,TS val 3346861701 ecr 842945861], length 400
08:11:48.133320 IP prabesha2026.ssh > 198.211.111.194.41568: Flags [P.], seq 72656:73056, ack 1, win 502, options [nop,nop,TS val 3346861701 ecr 842945861], length 400
08:11:48.133370 IP prabesha2026.ssh > 198.211.111.194.41568: Flags [P.], seq 73056:73456, ack 1, win 502, options [nop,nop,TS val 3346861701 ecr 842945861], length 400
08:11:48.133408 IP prabesha2026.ssh > 198.211.111.194.41568: Flags [P.], seq 73456:73680, ack 1, win 502, options [nop,nop,TS val 3346861701 ecr 842945861], length 224
08:11:48.133458 IP prabesha2026.ssh > 198.211.111.194.41568: Flags [P.], seq 73680:74080, ack 1, win 502, options [nop,nop,TS val 3346861701 ecr 842945861], length 400
08:11:48.133508 IP prabesha2026.ssh > 198.211.111.194.41568: Flags [P.], seq 74080:74480, ack 1, win 502, options [nop,nop,TS val 3346861701 ecr 842945861], length 400
08:11:48.133559 IP prabesha2026.ssh > 198.211.111.194.41568: Flags [P.], seq 74480:74880, ack 1, win 502, options [nop,nop,TS val 3346861701 ecr 842945861], length 400
08:11:48.133609 IP prabesha2026.ssh > 198.211.111.194.41568: Flags [P.], seq 74880:75280, ack 1, win 502, options [nop,nop,TS val 3346861702 ecr 842945861], length 400
08:11:48.133659 IP prabesha2026.ssh > 198.211.111.194.41568: Flags [P.], seq 75280:75680, ack 1, win 502, options [nop,nop,TS val 3346861702 ecr 842945861], length 400
08:11:48.133714 IP prabesha2026.ssh > 198.211.111.194.41568: Flags [P.], seq 75680:75904, ack 1, win 502, options [nop,nop,TS val 3346861702 ecr 842945861], length 224
08:11:48.133768 IP prabesha2026.ssh > 198.211.111.194.41568: Flags [P.], seq 75904:76304, ack 1, win 502, options [nop,nop,TS val 3346861702 ecr 842945861], length 400
08:11:48.133809 IP prabesha2026.ssh > 198.211.111.194.41568: Flags [P.], seq 76304:76512, ack 1, win 502, options [nop,nop,TS val 3346861702 ecr 842945861], length 208
08:11:48.133858 IP prabesha2026.ssh > 198.211.111.194.41568: Flags [P.], seq 76512:76880, ack 1, win 502, options [nop,nop,TS val 3346861702 ecr 842945861], length 368
08:11:48.133909 IP prabesha2026.ssh > 198.211.111.194.41568: Flags [P.], seq 76880:77248, ack 1, win 502, options [nop,nop,TS val 3346861702 ecr 842945861], length 368
08:11:48.133965 IP prabesha2026.ssh > 198.211.111.194.41568: Flags [P.], seq 77248:77616, ack 1, win 502, options [nop,nop,TS val 3346861702 ecr 842945861], length 368
08:11:48.134038 IP prabesha2026.ssh > 198.211.111.194.41568: Flags [P.], seq 77616:77984, ack 1, win 502, options [nop,nop,TS val 3346861702 ecr 842945861], length 368
08:11:48.134101 IP prabesha2026.ssh > 198.211.111.194.41568: Flags [P.], seq 77984:78352, ack 1, win 502, options [nop,nop,TS val 3346861702 ecr 842945861], length 368
08:11:48.134150 IP prabesha2026.ssh > 198.211.111.194.41568: Flags [P.], seq 78352:78560, ack 1, win 502, options [nop,nop,TS val 3346861702 ecr 842945861], length 208
08:11:48.134209 IP prabesha2026.ssh > 198.211.111.194.41568: Flags [P.], seq 78560:78928, ack 1, win 502, options [nop,nop,TS val 3346861702 ecr 842945861], length 368
08:11:48.134272 IP prabesha2026.ssh > 198.211.111.194.41568: Flags [P.], seq 78928:79296, ack 1, win 502, options [nop,nop,TS val 3346861702 ecr 842945861], length 368
08:11:48.134318 IP prabesha2026.ssh > 198.211.111.194.41568: Flags [P.], seq 79296:79504, ack 1, win 502, options [nop,nop,TS val 3346861702 ecr 842945861], length 208
08:11:48.134381 IP prabesha2026.ssh > 198.211.111.194.41568: Flags [P.], seq 79504:79872, ack 1, win 502, options [nop,nop,TS val 3346861702 ecr 842945861], length 368
08:11:48.134426 IP prabesha2026.ssh > 198.211.111.194.41568: Flags [P.], seq 79872:80080, ack 1, win 502, options [nop,nop,TS val 3346861702 ecr 842945861], length 208
08:11:48.134488 IP prabesha2026.ssh > 198.211.111.194.41568: Flags [P.], seq 80080:80448, ack 1, win 502, options [nop,nop,TS val 3346861702 ecr 842945861], length 368
08:11:48.134528 IP prabesha2026.ssh > 198.211.111.194.41568: Flags [P.], seq 80448:80512, ack 1, win 502, options [nop,nop,TS val 3346861702 ecr 842945861], length 64
08:11:48.147228 IP 198.211.111.194.41568 > prabesha2026.ssh: Flags [.], ack 63392, win 4377, options [nop,nop,TS val 842945916 ecr 3346861700], length 0
08:11:48.147327 IP 198.211.111.194.41568 > prabesha2026.ssh: Flags [.], ack 64192, win 4386, options [nop,nop,TS val 842945916 ecr 3346861700], length 0
08:11:48.147501 IP 198.211.111.194.41568 > prabesha2026.ssh: Flags [.], ack 64816, win 4382, options [nop,nop,TS val 842945916 ecr 3346861700], length 0
08:11:48.147675 IP 198.211.111.194.41568 > prabesha2026.ssh: Flags [.], ack 66960, win 4366, options [nop,nop,TS val 842945917 ecr 3346861700], length 0
08:11:48.147954 IP 198.211.111.194.41568 > prabesha2026.ssh: Flags [.], ack 68432, win 4355, options [nop,nop,TS val 842945917 ecr 3346861700], length 0
08:11:48.148167 IP 198.211.111.194.41568 > prabesha2026.ssh: Flags [.], ack 70032, win 4343, options [nop,nop,TS val 842945917 ecr 3346861701], length 0
08:11:48.148303 IP 198.211.111.194.41568 > prabesha2026.ssh: Flags [.], ack 71456, win 4332, options [nop,nop,TS val 842945917 ecr 3346861701], length 0
08:11:48.148599 IP 198.211.111.194.41568 > prabesha2026.ssh: Flags [.], ack 73680, win 4315, options [nop,nop,TS val 842945918 ecr 3346861701], length 0
08:11:48.148809 IP 198.211.111.194.41568 > prabesha2026.ssh: Flags [.], ack 75280, win 4303, options [nop,nop,TS val 842945918 ecr 3346861701], length 0
08:11:48.149061 IP 198.211.111.194.41568 > prabesha2026.ssh: Flags [.], ack 76880, win 4291, options [nop,nop,TS val 842945918 ecr 3346861702], length 0
08:11:48.149286 IP 198.211.111.194.41568 > prabesha2026.ssh: Flags [.], ack 78352, win 4280, options [nop,nop,TS val 842945918 ecr 3346861702], length 0
08:11:48.149670 IP 198.211.111.194.41568 > prabesha2026.ssh: Flags [.], ack 79872, win 4269, options [nop,nop,TS val 842945919 ecr 3346861702], length 0
08:11:48.187671 IP prabesha2026.ssh > 198.211.111.194.41568: Flags [P.], seq 80448:80512, ack 1, win 502, options [nop,nop,TS val 3346861756 ecr 842945919], length 64
08:11:48.196606 IP 198.211.111.194.41568 > prabesha2026.ssh: Flags [.], ack 80512, win 4264, options [nop,nop,TS val 842945965 ecr 3346861702], length 0
08:11:48.202950 IP 198.211.111.194.41568 > prabesha2026.ssh: Flags [.], ack 80512, win 4264, options [nop,nop,TS val 842945972 ecr 3346861756,nop,nop,sack 1 {80448:80512}], length 0
08:11:48.235879 IP prabesha2026.ssh > 198.211.111.194.41568: Flags [P.], seq 80512:80736, ack 1, win 502, options [nop,nop,TS val 3346861804 ecr 842945972], length 224
08:11:48.236002 IP prabesha2026.ssh > 198.211.111.194.41568: Flags [P.], seq 80736:80960, ack 1, win 502, options [nop,nop,TS val 3346861804 ecr 842945972], length 224
08:11:48.236088 IP prabesha2026.ssh > 198.211.111.194.41568: Flags [P.], seq 80960:81184, ack 1, win 502, options [nop,nop,TS val 3346861804 ecr 842945972], length 224
08:11:48.236249 IP prabesha2026.ssh > 198.211.111.194.41568: Flags [P.], seq 81184:81744, ack 1, win 502, options [nop,nop,TS val 3346861804 ecr 842945972], length 560
08:11:48.236402 IP prabesha2026.ssh > 198.211.111.194.41568: Flags [P.], seq 81744:82480, ack 1, win 502, options [nop,nop,TS val 3346861804 ecr 842945972], length 736
08:11:48.236496 IP prabesha2026.ssh > 198.211.111.194.41568: Flags [P.], seq 82480:83040, ack 1, win 502, options [nop,nop,TS val 3346861804 ecr 842945972], length 560
08:11:48.236570 IP prabesha2026.ssh > 198.211.111.194.41568: Flags [P.], seq 83040:83440, ack 1, win 502, options [nop,nop,TS val 3346861805 ecr 842945972], length 400
08:11:48.236644 IP prabesha2026.ssh > 198.211.111.194.41568: Flags [P.], seq 83440:83840, ack 1, win 502, options [nop,nop,TS val 3346861805 ecr 842945972], length 400
08:11:48.236731 IP prabesha2026.ssh > 198.211.111.194.41568: Flags [P.], seq 83840:84240, ack 1, win 502, options [nop,nop,TS val 3346861805 ecr 842945972], length 400
08:11:48.236785 IP prabesha2026.ssh > 198.211.111.194.41568: Flags [P.], seq 84240:84464, ack 1, win 502, options [nop,nop,TS val 3346861805 ecr 842945972], length 224
08:11:48.236862 IP prabesha2026.ssh > 198.211.111.194.41568: Flags [P.], seq 84464:84864, ack 1, win 502, options [nop,nop,TS val 3346861805 ecr 842945972], length 400
08:11:48.236934 IP prabesha2026.ssh > 198.211.111.194.41568: Flags [P.], seq 84864:85264, ack 1, win 502, options [nop,nop,TS val 3346861805 ecr 842945972], length 400
08:11:48.236988 IP prabesha2026.ssh > 198.211.111.194.41568: Flags [P.], seq 85264:85488, ack 1, win 502, options [nop,nop,TS val 3346861805 ecr 842945972], length 224
08:11:48.237061 IP prabesha2026.ssh > 198.211.111.194.41568: Flags [P.], seq 85488:85888, ack 1, win 502, options [nop,nop,TS val 3346861805 ecr 842945972], length 400
08:11:48.237134 IP prabesha2026.ssh > 198.211.111.194.41568: Flags [P.], seq 85888:86288, ack 1, win 502, options [nop,nop,TS val 3346861805 ecr 842945972], length 400
08:11:48.237191 IP prabesha2026.ssh > 198.211.111.194.41568: Flags [P.], seq 86288:86512, ack 1, win 502, options [nop,nop,TS val 3346861805 ecr 842945972], length 224
08:11:48.237264 IP prabesha2026.ssh > 198.211.111.194.41568: Flags [P.], seq 86512:86912, ack 1, win 502, options [nop,nop,TS val 3346861805 ecr 842945972], length 400
08:11:48.237336 IP prabesha2026.ssh > 198.211.111.194.41568: Flags [P.], seq 86912:87312, ack 1, win 502, options [nop,nop,TS val 3346861805 ecr 842945972], length 400
08:11:48.237396 IP prabesha2026.ssh > 198.211.111.194.41568: Flags [P.], seq 87312:87536, ack 1, win 502, options [nop,nop,TS val 3346861805 ecr 842945972], length 224
08:11:48.237471 IP prabesha2026.ssh > 198.211.111.194.41568: Flags [P.], seq 87536:87936, ack 1, win 502, options [nop,nop,TS val 3346861805 ecr 842945972], length 400
08:11:48.237549 IP prabesha2026.ssh > 198.211.111.194.41568: Flags [P.], seq 87936:88160, ack 1, win 502, options [nop,nop,TS val 3346861805 ecr 842945972], length 224
08:11:48.237645 IP prabesha2026.ssh > 198.211.111.194.41568: Flags [P.], seq 88160:88560, ack 1, win 502, options [nop,nop,TS val 3346861806 ecr 842945972], length 400
08:11:48.237738 IP prabesha2026.ssh > 198.211.111.194.41568: Flags [P.], seq 88560:88960, ack 1, win 502, options [nop,nop,TS val 3346861806 ecr 842945972], length 400
08:11:48.237848 IP prabesha2026.ssh > 198.211.111.194.41568: Flags [P.], seq 88960:89520, ack 1, win 502, options [nop,nop,TS val 3346861806 ecr 842945972], length 560
08:11:48.237942 IP prabesha2026.ssh > 198.211.111.194.41568: Flags [P.], seq 89520:89920, ack 1, win 502, options [nop,nop,TS val 3346861806 ecr 842945972], length 400
08:11:48.238037 IP prabesha2026.ssh > 198.211.111.194.41568: Flags [P.], seq 89920:90304, ack 1, win 502, options [nop,nop,TS val 3346861806 ecr 842945972], length 384
08:11:48.238111 IP prabesha2026.ssh > 198.211.111.194.41568: Flags [P.], seq 90304:90672, ack 1, win 502, options [nop,nop,TS val 3346861806 ecr 842945972], length 368
08:11:48.238185 IP prabesha2026.ssh > 198.211.111.194.41568: Flags [P.], seq 90672:91040, ack 1, win 502, options [nop,nop,TS val 3346861806 ecr 842945972], length 368
08:11:48.238256 IP prabesha2026.ssh > 198.211.111.194.41568: Flags [P.], seq 91040:91408, ack 1, win 502, options [nop,nop,TS val 3346861806 ecr 842945972], length 368
08:11:48.238327 IP prabesha2026.ssh > 198.211.111.194.41568: Flags [P.], seq 91408:91776, ack 1, win 502, options [nop,nop,TS val 3346861806 ecr 842945972], length 368
08:11:48.238383 IP prabesha2026.ssh > 198.211.111.194.41568: Flags [P.], seq 91776:91984, ack 1, win 502, options [nop,nop,TS val 3346861806 ecr 842945972], length 208
08:11:48.238474 IP prabesha2026.ssh > 198.211.111.194.41568: Flags [P.], seq 91984:92352, ack 1, win 502, options [nop,nop,TS val 3346861806 ecr 842945972], length 368
08:11:48.238558 IP prabesha2026.ssh > 198.211.111.194.41568: Flags [P.], seq 92352:92736, ack 1, win 502, options [nop,nop,TS val 3346861806 ecr 842945972], length 384
08:11:48.238625 IP prabesha2026.ssh > 198.211.111.194.41568: Flags [P.], seq 92736:92976, ack 1, win 502, options [nop,nop,TS val 3346861807 ecr 842945972], length 240
08:11:48.251258 IP 198.211.111.194.41568 > prabesha2026.ssh: Flags [.], ack 80736, win 4386, options [nop,nop,TS val 842946020 ecr 3346861804], length 0
08:11:48.251258 IP 198.211.111.194.41568 > prabesha2026.ssh: Flags [.], ack 80960, win 4386, options [nop,nop,TS val 842946020 ecr 3346861804], length 0
08:11:48.251332 IP 198.211.111.194.41568 > prabesha2026.ssh: Flags [.], ack 81184, win 4386, options [nop,nop,TS val 842946020 ecr 3346861804], length 0
08:11:48.251502 IP 198.211.111.194.41568 > prabesha2026.ssh: Flags [.], ack 81744, win 4386, options [nop,nop,TS val 842946020 ecr 3346861804], length 0
08:11:48.251653 IP 198.211.111.194.41568 > prabesha2026.ssh: Flags [.], ack 82480, win 4381, options [nop,nop,TS val 842946021 ecr 3346861804], length 0
08:11:48.251672 IP 198.211.111.194.41568 > prabesha2026.ssh: Flags [.], ack 83040, win 4377, options [nop,nop,TS val 842946021 ecr 3346861804], length 0
08:11:48.251786 IP 198.211.111.194.41568 > prabesha2026.ssh: Flags [.], ack 83440, win 4374, options [nop,nop,TS val 842946021 ecr 3346861805], length 0
08:11:48.251834 IP 198.211.111.194.41568 > prabesha2026.ssh: Flags [.], ack 83840, win 4371, options [nop,nop,TS val 842946021 ecr 3346861805], length 0
08:11:48.251938 IP 198.211.111.194.41568 > prabesha2026.ssh: Flags [.], ack 84240, win 4368, options [nop,nop,TS val 842946021 ecr 3346861805], length 0
08:11:48.251957 IP 198.211.111.194.41568 > prabesha2026.ssh: Flags [.], ack 84464, win 4367, options [nop,nop,TS val 842946021 ecr 3346861805], length 0
08:11:48.252097 IP 198.211.111.194.41568 > prabesha2026.ssh: Flags [.], ack 84864, win 4364, options [nop,nop,TS val 842946021 ecr 3346861805], length 0
08:11:48.252111 IP 198.211.111.194.41568 > prabesha2026.ssh: Flags [.], ack 85264, win 4361, options [nop,nop,TS val 842946021 ecr 3346861805], length 0
08:11:48.252265 IP 198.211.111.194.41568 > prabesha2026.ssh: Flags [.], ack 85488, win 4360, options [nop,nop,TS val 842946021 ecr 3346861805], length 0
08:11:48.252266 IP 198.211.111.194.41568 > prabesha2026.ssh: Flags [.], ack 85888, win 4357, options [nop,nop,TS val 842946021 ecr 3346861805], length 0
08:11:48.252350 IP 198.211.111.194.41568 > prabesha2026.ssh: Flags [.], ack 86288, win 4354, options [nop,nop,TS val 842946021 ecr 3346861805], length 0
08:11:48.253658 IP 198.211.111.194.41568 > prabesha2026.ssh: Flags [.], ack 91984, win 4310, options [nop,nop,TS val 842946023 ecr 3346861805], length 0
08:11:48.291657 IP prabesha2026.ssh > 198.211.111.194.41568: Flags [P.], seq 92736:92976, ack 1, win 502, options [nop,nop,TS val 3346861860 ecr 842946023], length 240
08:11:48.296661 IP 198.211.111.194.41568 > prabesha2026.ssh: Flags [.], ack 92976, win 4306, options [nop,nop,TS val 842946065 ecr 3346861806], length 0
08:11:48.307053 IP 198.211.111.194.41568 > prabesha2026.ssh: Flags [.], ack 92976, win 4306, options [nop,nop,TS val 842946076 ecr 3346861860,nop,nop,sack 1 {92736:92976}], length 0
08:11:48.339901 IP prabesha2026.ssh > 198.211.111.194.41568: Flags [P.], seq 92976:93200, ack 1, win 502, options [nop,nop,TS val 3346861908 ecr 842946076], length 224
08:11:48.340014 IP prabesha2026.ssh > 198.211.111.194.41568: Flags [P.], seq 93200:93600, ack 1, win 502, options [nop,nop,TS val 3346861908 ecr 842946076], length 400
08:11:48.340080 IP prabesha2026.ssh > 198.211.111.194.41568: Flags [P.], seq 93600:94000, ack 1, win 502, options [nop,nop,TS val 3346861908 ecr 842946076], length 400
08:11:48.340144 IP prabesha2026.ssh > 198.211.111.194.41568: Flags [P.], seq 94000:94400, ack 1, win 502, options [nop,nop,TS val 3346861908 ecr 842946076], length 400
08:11:48.340277 IP prabesha2026.ssh > 198.211.111.194.41568: Flags [P.], seq 94400:94800, ack 1, win 502, options [nop,nop,TS val 3346861908 ecr 842946076], length 400
08:11:48.340311 IP prabesha2026.ssh > 198.211.111.194.41568: Flags [P.], seq 94800:94864, ack 1, win 502, options [nop,nop,TS val 3346861908 ecr 842946076], length 64
08:11:48.340361 IP prabesha2026.ssh > 198.211.111.194.41568: Flags [P.], seq 94864:95088, ack 1, win 502, options [nop,nop,TS val 3346861908 ecr 842946076], length 224
08:11:48.340410 IP prabesha2026.ssh > 198.211.111.194.41568: Flags [P.], seq 95088:95312, ack 1, win 502, options [nop,nop,TS val 3346861908 ecr 842946076], length 224
08:11:48.340461 IP prabesha2026.ssh > 198.211.111.194.41568: Flags [P.], seq 95312:95536, ack 1, win 502, options [nop,nop,TS val 3346861908 ecr 842946076], length 224
08:11:48.340522 IP prabesha2026.ssh > 198.211.111.194.41568: Flags [P.], seq 95536:95936, ack 1, win 502, options [nop,nop,TS val 3346861908 ecr 842946076], length 400
08:11:48.340608 IP prabesha2026.ssh > 198.211.111.194.41568: Flags [P.], seq 95936:96496, ack 1, win 502, options [nop,nop,TS val 3346861909 ecr 842946076], length 560
08:11:48.340669 IP prabesha2026.ssh > 198.211.111.194.41568: Flags [P.], seq 96496:96896, ack 1, win 502, options [nop,nop,TS val 3346861909 ecr 842946076], length 400
08:11:48.340730 IP prabesha2026.ssh > 198.211.111.194.41568: Flags [P.], seq 96896:97296, ack 1, win 502, options [nop,nop,TS val 3346861909 ecr 842946076], length 400
08:11:48.340791 IP prabesha2026.ssh > 198.211.111.194.41568: Flags [P.], seq 97296:97696, ack 1, win 502, options [nop,nop,TS val 3346861909 ecr 842946076], length 400
08:11:48.340840 IP prabesha2026.ssh > 198.211.111.194.41568: Flags [P.], seq 97696:97920, ack 1, win 502, options [nop,nop,TS val 3346861909 ecr 842946076], length 224
08:11:48.340899 IP prabesha2026.ssh > 198.211.111.194.41568: Flags [P.], seq 97920:98320, ack 1, win 502, options [nop,nop,TS val 3346861909 ecr 842946076], length 400
08:11:48.340961 IP prabesha2026.ssh > 198.211.111.194.41568: Flags [P.], seq 98320:98720, ack 1, win 502, options [nop,nop,TS val 3346861909 ecr 842946076], length 400
08:11:48.341022 IP prabesha2026.ssh > 198.211.111.194.41568: Flags [P.], seq 98720:99120, ack 1, win 502, options [nop,nop,TS val 3346861909 ecr 842946076], length 400
08:11:48.341099 IP prabesha2026.ssh > 198.211.111.194.41568: Flags [P.], seq 99120:99520, ack 1, win 502, options [nop,nop,TS val 3346861909 ecr 842946076], length 400
08:11:48.341151 IP prabesha2026.ssh > 198.211.111.194.41568: Flags [P.], seq 99520:99744, ack 1, win 502, options [nop,nop,TS val 3346861909 ecr 842946076], length 224
08:11:48.341217 IP prabesha2026.ssh > 198.211.111.194.41568: Flags [P.], seq 99744:100128, ack 1, win 502, options [nop,nop,TS val 3346861909 ecr 842946076], length 384
08:11:48.341296 IP prabesha2026.ssh > 198.211.111.194.41568: Flags [P.], seq 100128:100496, ack 1, win 502, options [nop,nop,TS val 3346861909 ecr 842946076], length 368
08:11:48.341372 IP prabesha2026.ssh > 198.211.111.194.41568: Flags [P.], seq 100496:101008, ack 1, win 502, options [nop,nop,TS val 3346861909 ecr 842946076], length 512
08:11:48.341432 IP prabesha2026.ssh > 198.211.111.194.41568: Flags [P.], seq 101008:101376, ack 1, win 502, options [nop,nop,TS val 3346861909 ecr 842946076], length 368
08:11:48.341495 IP prabesha2026.ssh > 198.211.111.194.41568: Flags [P.], seq 101376:101744, ack 1, win 502, options [nop,nop,TS val 3346861909 ecr 842946076], length 368
08:11:48.341556 IP prabesha2026.ssh > 198.211.111.194.41568: Flags [P.], seq 101744:102112, ack 1, win 502, options [nop,nop,TS val 3346861909 ecr 842946076], length 368
08:11:48.341616 IP prabesha2026.ssh > 198.211.111.194.41568: Flags [P.], seq 102112:102480, ack 1, win 502, options [nop,nop,TS val 3346861910 ecr 842946076], length 368
08:11:48.341676 IP prabesha2026.ssh > 198.211.111.194.41568: Flags [P.], seq 102480:102848, ack 1, win 502, options [nop,nop,TS val 3346861910 ecr 842946076], length 368
08:11:48.341738 IP prabesha2026.ssh > 198.211.111.194.41568: Flags [P.], seq 102848:103232, ack 1, win 502, options [nop,nop,TS val 3346861910 ecr 842946076], length 384
08:11:48.341794 IP prabesha2026.ssh > 198.211.111.194.41568: Flags [P.], seq 103232:103472, ack 1, win 502, options [nop,nop,TS val 3346861910 ecr 842946076], length 240
08:11:48.355299 IP 198.211.111.194.41568 > prabesha2026.ssh: Flags [.], ack 93200, win 4386, options [nop,nop,TS val 842946124 ecr 3346861908], length 0
08:11:48.355299 IP 198.211.111.194.41568 > prabesha2026.ssh: Flags [.], ack 93600, win 4386, options [nop,nop,TS val 842946124 ecr 3346861908], length 0
08:11:48.355299 IP 198.211.111.194.41568 > prabesha2026.ssh: Flags [.], ack 94000, win 4386, options [nop,nop,TS val 842946124 ecr 3346861908], length 0
08:11:48.355372 IP 198.211.111.194.41568 > prabesha2026.ssh: Flags [.], ack 94400, win 4386, options [nop,nop,TS val 842946124 ecr 3346861908], length 0
08:11:48.355530 IP 198.211.111.194.41568 > prabesha2026.ssh: Flags [.], ack 94800, win 4383, options [nop,nop,TS val 842946124 ecr 3346861908], length 0
08:11:48.355530 IP 198.211.111.194.41568 > prabesha2026.ssh: Flags [.], ack 94864, win 4383, options [nop,nop,TS val 842946124 ecr 3346861908], length 0
08:11:48.355594 IP 198.211.111.194.41568 > prabesha2026.ssh: Flags [.], ack 95088, win 4382, options [nop,nop,TS val 842946124 ecr 3346861908], length 0
08:11:48.355594 IP 198.211.111.194.41568 > prabesha2026.ssh: Flags [.], ack 95312, win 4381, options [nop,nop,TS val 842946125 ecr 3346861908], length 0
08:11:48.355677 IP 198.211.111.194.41568 > prabesha2026.ssh: Flags [.], ack 95536, win 4380, options [nop,nop,TS val 842946125 ecr 3346861908], length 0
08:11:48.355708 IP 198.211.111.194.41568 > prabesha2026.ssh: Flags [.], ack 95936, win 4377, options [nop,nop,TS val 842946125 ecr 3346861908], length 0
08:11:48.355800 IP 198.211.111.194.41568 > prabesha2026.ssh: Flags [.], ack 96496, win 4373, options [nop,nop,TS val 842946125 ecr 3346861909], length 0
08:11:48.355852 IP 198.211.111.194.41568 > prabesha2026.ssh: Flags [.], ack 96896, win 4370, options [nop,nop,TS val 842946125 ecr 3346861909], length 0
08:11:48.355927 IP 198.211.111.194.41568 > prabesha2026.ssh: Flags [.], ack 97296, win 4367, options [nop,nop,TS val 842946125 ecr 3346861909], length 0
08:11:48.355980 IP 198.211.111.194.41568 > prabesha2026.ssh: Flags [.], ack 97696, win 4364, options [nop,nop,TS val 842946125 ecr 3346861909], length 0
08:11:48.356032 IP 198.211.111.194.41568 > prabesha2026.ssh: Flags [.], ack 97920, win 4363, options [nop,nop,TS val 842946125 ecr 3346861909], length 0
08:11:48.356284 IP 198.211.111.194.41568 > prabesha2026.ssh: Flags [.], ack 99520, win 4351, options [nop,nop,TS val 842946125 ecr 3346861909], length 0
08:11:48.356648 IP 198.211.111.194.41568 > prabesha2026.ssh: Flags [.], ack 101008, win 4340, options [nop,nop,TS val 842946126 ecr 3346861909], length 0
08:11:48.356831 IP 198.211.111.194.41568 > prabesha2026.ssh: Flags [.], ack 102480, win 4329, options [nop,nop,TS val 842946126 ecr 3346861909], length 0
08:11:48.395657 IP prabesha2026.ssh > 198.211.111.194.41568: Flags [P.], seq 103232:103472, ack 1, win 502, options [nop,nop,TS val 3346861964 ecr 842946126], length 240
08:11:48.400665 IP 198.211.111.194.41568 > prabesha2026.ssh: Flags [.], ack 103472, win 4338, options [nop,nop,TS val 842946169 ecr 3346861910], length 0
08:11:48.411011 IP 198.211.111.194.41568 > prabesha2026.ssh: Flags [.], ack 103472, win 4386, options [nop,nop,TS val 842946180 ecr 3346861964,nop,nop,sack 1 {103232:103472}], length 0
08:11:48.443920 IP prabesha2026.ssh > 198.211.111.194.41568: Flags [P.], seq 103472:103696, ack 1, win 502, options [nop,nop,TS val 3346862012 ecr 842946180], length 224
08:11:48.444018 IP prabesha2026.ssh > 198.211.111.194.41568: Flags [P.], seq 103696:103920, ack 1, win 502, options [nop,nop,TS val 3346862012 ecr 842946180], length 224
08:11:48.444081 IP prabesha2026.ssh > 198.211.111.194.41568: Flags [P.], seq 103920:104144, ack 1, win 502, options [nop,nop,TS val 3346862012 ecr 842946180], length 224
08:11:48.444139 IP prabesha2026.ssh > 198.211.111.194.41568: Flags [P.], seq 104144:104368, ack 1, win 502, options [nop,nop,TS val 3346862012 ecr 842946180], length 224
08:11:48.444244 IP prabesha2026.ssh > 198.211.111.194.41568: Flags [P.], seq 104368:104592, ack 1, win 502, options [nop,nop,TS val 3346862012 ecr 842946180], length 224
08:11:48.444388 IP prabesha2026.ssh > 198.211.111.194.41568: Flags [P.], seq 104592:105488, ack 1, win 502, options [nop,nop,TS val 3346862012 ecr 842946180], length 896
08:11:48.444465 IP prabesha2026.ssh > 198.211.111.194.41568: Flags [P.], seq 105488:105888, ack 1, win 502, options [nop,nop,TS val 3346862012 ecr 842946180], length 400
08:11:48.444522 IP prabesha2026.ssh > 198.211.111.194.41568: Flags [P.], seq 105888:106112, ack 1, win 502, options [nop,nop,TS val 3346862012 ecr 842946180], length 224
08:11:48.444599 IP prabesha2026.ssh > 198.211.111.194.41568: Flags [P.], seq 106112:106512, ack 1, win 502, options [nop,nop,TS val 3346862013 ecr 842946180], length 400
08:11:48.444655 IP prabesha2026.ssh > 198.211.111.194.41568: Flags [P.], seq 106512:106736, ack 1, win 502, options [nop,nop,TS val 3346862013 ecr 842946180], length 224
08:11:48.444729 IP prabesha2026.ssh > 198.211.111.194.41568: Flags [P.], seq 106736:107136, ack 1, win 502, options [nop,nop,TS val 3346862013 ecr 842946180], length 400
08:11:48.444785 IP prabesha2026.ssh > 198.211.111.194.41568: Flags [P.], seq 107136:107360, ack 1, win 502, options [nop,nop,TS val 3346862013 ecr 842946180], length 224
08:11:48.444860 IP prabesha2026.ssh > 198.211.111.194.41568: Flags [P.], seq 107360:107760, ack 1, win 502, options [nop,nop,TS val 3346862013 ecr 842946180], length 400
08:11:48.444919 IP prabesha2026.ssh > 198.211.111.194.41568: Flags [P.], seq 107760:107984, ack 1, win 502, options [nop,nop,TS val 3346862013 ecr 842946180], length 224
08:11:48.444991 IP prabesha2026.ssh > 198.211.111.194.41568: Flags [P.], seq 107984:108384, ack 1, win 502, options [nop,nop,TS val 3346862013 ecr 842946180], length 400
08:11:48.445047 IP prabesha2026.ssh > 198.211.111.194.41568: Flags [P.], seq 108384:108608, ack 1, win 502, options [nop,nop,TS val 3346862013 ecr 842946180], length 224
08:11:48.445122 IP prabesha2026.ssh > 198.211.111.194.41568: Flags [P.], seq 108608:109008, ack 1, win 502, options [nop,nop,TS val 3346862013 ecr 842946180], length 400
08:11:48.445178 IP prabesha2026.ssh > 198.211.111.194.41568: Flags [P.], seq 109008:109232, ack 1, win 502, options [nop,nop,TS val 3346862013 ecr 842946180], length 224
08:11:48.445253 IP prabesha2026.ssh > 198.211.111.194.41568: Flags [P.], seq 109232:109632, ack 1, win 502, options [nop,nop,TS val 3346862013 ecr 842946180], length 400
08:11:48.445310 IP prabesha2026.ssh > 198.211.111.194.41568: Flags [P.], seq 109632:109840, ack 1, win 502, options [nop,nop,TS val 3346862013 ecr 842946180], length 208
08:11:48.445368 IP prabesha2026.ssh > 198.211.111.194.41568: Flags [P.], seq 109840:110048, ack 1, win 502, options [nop,nop,TS val 3346862013 ecr 842946180], length 208
08:11:48.445437 IP prabesha2026.ssh > 198.211.111.194.41568: Flags [P.], seq 110048:110416, ack 1, win 502, options [nop,nop,TS val 3346862013 ecr 842946180], length 368
08:11:48.445510 IP prabesha2026.ssh > 198.211.111.194.41568: Flags [P.], seq 110416:110784, ack 1, win 502, options [nop,nop,TS val 3346862013 ecr 842946180], length 368
08:11:48.445565 IP prabesha2026.ssh > 198.211.111.194.41568: Flags [P.], seq 110784:110992, ack 1, win 502, options [nop,nop,TS val 3346862013 ecr 842946180], length 208
08:11:48.445643 IP prabesha2026.ssh > 198.211.111.194.41568: Flags [P.], seq 110992:111200, ack 1, win 502, options [nop,nop,TS val 3346862014 ecr 842946180], length 208
08:11:48.445743 IP prabesha2026.ssh > 198.211.111.194.41568: Flags [P.], seq 111200:111568, ack 1, win 502, options [nop,nop,TS val 3346862014 ecr 842946180], length 368
08:11:48.445859 IP prabesha2026.ssh > 198.211.111.194.41568: Flags [P.], seq 111568:112080, ack 1, win 502, options [nop,nop,TS val 3346862014 ecr 842946180], length 512
08:11:48.445985 IP prabesha2026.ssh > 198.211.111.194.41568: Flags [P.], seq 112080:112592, ack 1, win 502, options [nop,nop,TS val 3346862014 ecr 842946180], length 512
08:11:48.446142 IP prabesha2026.ssh > 198.211.111.194.41568: Flags [P.], seq 112592:113280, ack 1, win 502, options [nop,nop,TS val 3346862014 ecr 842946180], length 688
08:11:48.446205 IP prabesha2026.ssh > 198.211.111.194.41568: Flags [P.], seq 113280:113520, ack 1, win 502, options [nop,nop,TS val 3346862014 ecr 842946180], length 240
08:11:48.459309 IP 198.211.111.194.41568 > prabesha2026.ssh: Flags [.], ack 103696, win 4386, options [nop,nop,TS val 842946228 ecr 3346862012], length 0
08:11:48.459309 IP 198.211.111.194.41568 > prabesha2026.ssh: Flags [.], ack 103920, win 4386, options [nop,nop,TS val 842946228 ecr 3346862012], length 0
08:11:48.459309 IP 198.211.111.194.41568 > prabesha2026.ssh: Flags [.], ack 104144, win 4386, options [nop,nop,TS val 842946228 ecr 3346862012], length 0
08:11:48.459429 IP 198.211.111.194.41568 > prabesha2026.ssh: Flags [.], ack 104368, win 4386, options [nop,nop,TS val 842946228 ecr 3346862012], length 0
08:11:48.459441 IP 198.211.111.194.41568 > prabesha2026.ssh: Flags [.], ack 104592, win 4386, options [nop,nop,TS val 842946228 ecr 3346862012], length 0
08:11:48.459603 IP 198.211.111.194.41568 > prabesha2026.ssh: Flags [.], ack 105488, win 4379, options [nop,nop,TS val 842946229 ecr 3346862012], length 0
08:11:48.459713 IP 198.211.111.194.41568 > prabesha2026.ssh: Flags [.], ack 105888, win 4376, options [nop,nop,TS val 842946229 ecr 3346862012], length 0
08:11:48.459723 IP 198.211.111.194.41568 > prabesha2026.ssh: Flags [.], ack 106112, win 4375, options [nop,nop,TS val 842946229 ecr 3346862012], length 0
08:11:48.459795 IP 198.211.111.194.41568 > prabesha2026.ssh: Flags [.], ack 106512, win 4372, options [nop,nop,TS val 842946229 ecr 3346862013], length 0
08:11:48.459818 IP 198.211.111.194.41568 > prabesha2026.ssh: Flags [.], ack 106736, win 4371, options [nop,nop,TS val 842946229 ecr 3346862013], length 0
08:11:48.459931 IP 198.211.111.194.41568 > prabesha2026.ssh: Flags [.], ack 107136, win 4368, options [nop,nop,TS val 842946229 ecr 3346862013], length 0
08:11:48.459981 IP 198.211.111.194.41568 > prabesha2026.ssh: Flags [.], ack 107360, win 4367, options [nop,nop,TS val 842946229 ecr 3346862013], length 0
08:11:48.460159 IP 198.211.111.194.41568 > prabesha2026.ssh: Flags [.], ack 107760, win 4364, options [nop,nop,TS val 842946229 ecr 3346862013], length 0
08:11:48.460159 IP 198.211.111.194.41568 > prabesha2026.ssh: Flags [.], ack 107984, win 4363, options [nop,nop,TS val 842946229 ecr 3346862013], length 0
08:11:48.460262 IP 198.211.111.194.41568 > prabesha2026.ssh: Flags [.], ack 108384, win 4360, options [nop,nop,TS val 842946229 ecr 3346862013], length 0
08:11:48.460633 IP 198.211.111.194.41568 > prabesha2026.ssh: Flags [.], ack 110048, win 4347, options [nop,nop,TS val 842946230 ecr 3346862013], length 0
08:11:48.461056 IP 198.211.111.194.41568 > prabesha2026.ssh: Flags [.], ack 111568, win 4336, options [nop,nop,TS val 842946230 ecr 3346862013], length 0
08:11:48.461403 IP 198.211.111.194.41568 > prabesha2026.ssh: Flags [.], ack 113280, win 4323, options [nop,nop,TS val 842946230 ecr 3346862014], length 0
08:11:48.504677 IP 198.211.111.194.41568 > prabesha2026.ssh: Flags [.], ack 113520, win 4354, options [nop,nop,TS val 842946273 ecr 3346862014], length 0
08:11:48.547884 IP prabesha2026.ssh > 198.211.111.194.41568: Flags [P.], seq 113520:113744, ack 1, win 502, options [nop,nop,TS val 3346862116 ecr 842946273], length 224
08:11:48.547993 IP prabesha2026.ssh > 198.211.111.194.41568: Flags [P.], seq 113744:114144, ack 1, win 502, options [nop,nop,TS val 3346862116 ecr 842946273], length 400
08:11:48.548047 IP prabesha2026.ssh > 198.211.111.194.41568: Flags [P.], seq 114144:114368, ack 1, win 502, options [nop,nop,TS val 3346862116 ecr 842946273], length 224
08:11:48.548109 IP prabesha2026.ssh > 198.211.111.194.41568: Flags [P.], seq 114368:114768, ack 1, win 502, options [nop,nop,TS val 3346862116 ecr 842946273], length 400
08:11:48.548173 IP prabesha2026.ssh > 198.211.111.194.41568: Flags [P.], seq 114768:115168, ack 1, win 502, options [nop,nop,TS val 3346862116 ecr 842946273], length 400
08:11:48.548330 IP prabesha2026.ssh > 198.211.111.194.41568: Flags [P.], seq 115168:115392, ack 1, win 502, options [nop,nop,TS val 3346862116 ecr 842946273], length 224
08:11:48.548442 IP prabesha2026.ssh > 198.211.111.194.41568: Flags [P.], seq 115392:115968, ack 1, win 502, options [nop,nop,TS val 3346862116 ecr 842946273], length 576
08:11:48.548511 IP prabesha2026.ssh > 198.211.111.194.41568: Flags [P.], seq 115968:116368, ack 1, win 502, options [nop,nop,TS val 3346862116 ecr 842946273], length 400
08:11:48.548578 IP prabesha2026.ssh > 198.211.111.194.41568: Flags [P.], seq 116368:116768, ack 1, win 502, options [nop,nop,TS val 3346862117 ecr 842946273], length 400
08:11:48.548643 IP prabesha2026.ssh > 198.211.111.194.41568: Flags [P.], seq 116768:117168, ack 1, win 502, options [nop,nop,TS val 3346862117 ecr 842946273], length 400
08:11:48.548691 IP prabesha2026.ssh > 198.211.111.194.41568: Flags [P.], seq 117168:117392, ack 1, win 502, options [nop,nop,TS val 3346862117 ecr 842946273], length 224
08:11:48.548756 IP prabesha2026.ssh > 198.211.111.194.41568: Flags [P.], seq 117392:117792, ack 1, win 502, options [nop,nop,TS val 3346862117 ecr 842946273], length 400
08:11:48.548823 IP prabesha2026.ssh > 198.211.111.194.41568: Flags [P.], seq 117792:118016, ack 1, win 502, options [nop,nop,TS val 3346862117 ecr 842946273], length 224
08:11:48.548905 IP prabesha2026.ssh > 198.211.111.194.41568: Flags [P.], seq 118016:118416, ack 1, win 502, options [nop,nop,TS val 3346862117 ecr 842946273], length 400
08:11:48.548996 IP prabesha2026.ssh > 198.211.111.194.41568: Flags [P.], seq 118416:118816, ack 1, win 502, options [nop,nop,TS val 3346862117 ecr 842946273], length 400
08:11:48.549074 IP prabesha2026.ssh > 198.211.111.194.41568: Flags [P.], seq 118816:119040, ack 1, win 502, options [nop,nop,TS val 3346862117 ecr 842946273], length 224
08:11:48.549175 IP prabesha2026.ssh > 198.211.111.194.41568: Flags [P.], seq 119040:119616, ack 1, win 502, options [nop,nop,TS val 3346862117 ecr 842946273], length 576
08:11:48.549262 IP prabesha2026.ssh > 198.211.111.194.41568: Flags [P.], seq 119616:119984, ack 1, win 502, options [nop,nop,TS val 3346862117 ecr 842946273], length 368
08:11:48.549320 IP prabesha2026.ssh > 198.211.111.194.41568: Flags [P.], seq 119984:120192, ack 1, win 502, options [nop,nop,TS val 3346862117 ecr 842946273], length 208
08:11:48.549393 IP prabesha2026.ssh > 198.211.111.194.41568: Flags [P.], seq 120192:120560, ack 1, win 502, options [nop,nop,TS val 3346862117 ecr 842946273], length 368
08:11:48.549458 IP prabesha2026.ssh > 198.211.111.194.41568: Flags [P.], seq 120560:120768, ack 1, win 502, options [nop,nop,TS val 3346862117 ecr 842946273], length 208
08:11:48.549542 IP prabesha2026.ssh > 198.211.111.194.41568: Flags [P.], seq 120768:121136, ack 1, win 502, options [nop,nop,TS val 3346862117 ecr 842946273], length 368
08:11:48.549638 IP prabesha2026.ssh > 198.211.111.194.41568: Flags [P.], seq 121136:121504, ack 1, win 502, options [nop,nop,TS val 3346862118 ecr 842946273], length 368
08:11:48.549724 IP prabesha2026.ssh > 198.211.111.194.41568: Flags [P.], seq 121504:121872, ack 1, win 502, options [nop,nop,TS val 3346862118 ecr 842946273], length 368
08:11:48.549789 IP prabesha2026.ssh > 198.211.111.194.41568: Flags [P.], seq 121872:122240, ack 1, win 502, options [nop,nop,TS val 3346862118 ecr 842946273], length 368
08:11:48.549851 IP prabesha2026.ssh > 198.211.111.194.41568: Flags [P.], seq 122240:122608, ack 1, win 502, options [nop,nop,TS val 3346862118 ecr 842946273], length 368
08:11:48.549913 IP prabesha2026.ssh > 198.211.111.194.41568: Flags [P.], seq 122608:122976, ack 1, win 502, options [nop,nop,TS val 3346862118 ecr 842946273], length 368
08:11:48.550010 IP prabesha2026.ssh > 198.211.111.194.41568: Flags [P.], seq 122976:123184, ack 1, win 502, options [nop,nop,TS val 3346862118 ecr 842946273], length 208
08:11:48.563464 IP 198.211.111.194.41568 > prabesha2026.ssh: Flags [.], ack 115168, win 4378, options [nop,nop,TS val 842946332 ecr 3346862116], length 0
08:11:48.563888 IP 198.211.111.194.41568 > prabesha2026.ssh: Flags [.], ack 117392, win 4361, options [nop,nop,TS val 842946333 ecr 3346862116], length 0
08:11:48.564251 IP 198.211.111.194.41568 > prabesha2026.ssh: Flags [.], ack 118816, win 4350, options [nop,nop,TS val 842946333 ecr 3346862117], length 0
08:11:48.564711 IP 198.211.111.194.41568 > prabesha2026.ssh: Flags [.], ack 120560, win 4337, options [nop,nop,TS val 842946334 ecr 3346862117], length 0
08:11:48.565062 IP 198.211.111.194.41568 > prabesha2026.ssh: Flags [.], ack 122240, win 4324, options [nop,nop,TS val 842946334 ecr 3346862117], length 0
08:11:48.607655 IP prabesha2026.ssh > 198.211.111.194.41568: Flags [P.], seq 122976:123184, ack 1, win 502, options [nop,nop,TS val 3346862176 ecr 842946334], length 208
08:11:48.608612 IP 198.211.111.194.41568 > prabesha2026.ssh: Flags [.], ack 123184, win 4317, options [nop,nop,TS val 842946377 ecr 3346862118], length 0
08:11:48.623003 IP 198.211.111.194.41568 > prabesha2026.ssh: Flags [.], ack 123184, win 4354, options [nop,nop,TS val 842946392 ecr 3346862176,nop,nop,sack 1 {122976:123184}], length 0
^C
602 packets captured
637 packets received by filter
0 packets dropped by kernel